Sentence-ID,Sentence-String,Q1,Q2,Q3,Q4,Q5,Q6,Q7,Q8,Q9,Q10,Q11,Section
0,This study was undertaken to compare the quality of life (QoL) in women with early stage endometrial cancer treated with 2 different surgical approaches.,0,0,0,0,0,0,0,0,0,0,0,Objective
1,Eighty-four women with clinical stage I endometrial cancer were enrolled in a prospective randomized controlled trial design and treated with laparoscopic or laparotomic approach.,0,0,0,0,0,0,0,0,0,0,0,Study design
2,Another 40 women matched for demographic characteristics were studied as controls.,0,0,0,1,0,0,0,0,0,0,0,
3,"In patients, before and after surgery, and in their matched controls, QoL was evaluated by using the Short-Form Healthy Survey (SF-36) and the climacteric symptoms using the Kupperman Index (KI).",0,0,0,0,0,0,0,0,0,0,0,
4,"After randomization, no difference was detected in data recorded between the groups.",0,0,0,0,0,0,0,0,0,0,0,Results
5,"At entry, QoL was similar in both treatment groups but significantly (P < .05) worse in comparison with controls.",0,0,0,0,0,0,0,0,0,0,0,
6,"Throughout the study, QoL was significantly (P < .05) higher in laparoscopic group versus laparotomic group.",0,0,0,0,0,0,0,0,0,0,0,
7,After KI adjustment our data did not change.,0,0,0,0,0,0,0,0,0,0,0,
8,"In early stage endometrial cancer, the laparoscopic approach provides significant benefits compared with laparotomy in terms of QoL.",0,0,0,0,0,0,0,0,0,0,0,Conclusion
9,Adenocarcinoma of the endometrium is the most common malignancy of the female genital tract.,0,0,0,0,0,0,0,0,0,0,0,
10,"In approximately 75% of cases, at diagnosis, the cancer is clinically confined to the uterus and is referred to as early stage endometrial cancer.1 The majority of women with early stage endometrial cancer are treated with total abdominal hysterectomy, bilateral salpingo-oophorectomy (BSO), peritoneal washing, and pelvic lymphadenectomy eventually extended to para-aortic sites.1",0,0,0,0,0,0,0,0,0,0,0,
11,"Several authors have used a laparoscopic approach on women with early stage endometrial carcinoma obtaining excellent results with costs similar to traditional surgery.24 Many significant advantages of laparoscopy over laparotomy have been demonstrated: smaller incision, better visibility of the operative field, minimal intraoperative blood loss, and less postoperative pain, quicker recovery time, shorter hospital stay, and an earlier return to work.",0,0,0,0,0,0,0,0,0,0,0,
12,"In addition, laparoscopy has also shown to be safe in obese and elderly11 patients with endometrial cancer.",0,0,0,0,0,0,0,0,0,0,0,
13,"To date, the studies evaluating the effect of the laparoscopic approach on the survival of women with endometrial carcinoma are very few.",0,0,0,0,0,0,0,0,0,0,0,
14,Four retrospective analyses of surviva have shown that the laparoscopic and laparotomic approaches to treatment of early stage endometrial cancer are similar in terms of estimated recurrence-free and overall survival rates after 2 and 5 years follow-up.,0,0,0,0,0,0,0,0,0,0,0,
15,These data have been confirmed in 2 prospective controlled studies.,0,0,0,0,0,0,0,0,0,0,0,
16,"Unfortunately, prospective data on a wider sample and on a longer follow-up are lacking.",0,0,0,0,0,0,0,0,0,0,0,
17,"Though quality of life (QoL) assessment has become an essential element in the evaluation of therapeutic interventions in several conditions, scarce data are available on this issue regarding the surgical treatment of the endometrial cancer.",0,0,0,0,0,0,0,0,0,0,0,
18,"On the basis of this consideration, a current randomized controlled trial (RCT) was performed to compare the influence of laparoscopic and laparotomic approaches on QoL in women with early stage endometrial carcinoma.",0,0,0,0,0,0,0,0,0,0,0,
19,The procedures used in this study were in accordance with the guidelines of the Helsinki Declaration on human experimentation.,0,0,0,0,0,0,0,0,0,0,0,Materials and methods
20,The study was approved by the Institutional Review Board (IRB).,0,0,0,0,0,0,0,0,0,0,0,
21,"Before entering the study, the purpose of the protocol was explained to the patients and their written consent obtained.",0,0,0,0,0,0,0,0,0,0,0,
22,Protocol and surgical treatment,0,0,0,0,0,0,0,0,0,0,0,
23,"Between March 2001 and December 2003, 138 women with early stage endometrial cancer, ie, stage I according to International Federation of Gynecology and Obstetrics (FIGO) classification, were assessed for eligibility at the Department of Obstetrics and Gynecology of the University “Magna Graecia” of Catanzaro, Italy.",1,0,0,0,0,0,0,0,0,0,0,
24,"Exclusion criteria were as follows: other premalignancies or malignancies, major medical conditions, psychiatric disorders, current or past history of acute or chronic physical illness, premenstrual syndrome (PMS), current or past (within 6 months from study enrollment) use of drugs influencing cognition, vigilance, and/or mood.",1,0,0,0,0,0,0,0,0,0,0,
25,"At entry, each patient underwent a gynecologic and rectal examination, Papanicolau smear test, ultrasonographic and hysteroscopic assessment with endometrial biopsy, liver ultrasonography, chest radiograph, and computerized tomography (CT).",0,0,0,0,0,0,0,0,0,0,0,
26,"Age, parity, and body mass index (BMI), menopausal, socio/economic and work status, together with QoL, previous major surgical laparotomies, and associated medical conditions were also carefully assessed.",0,0,0,1,0,0,0,0,0,0,0,
27,All eligible patients were randomly assigned in single blocks into a single-blind controlled study design with the use of a computer-generated randomization list.,0,1,0,0,0,0,0,0,0,0,0,
28,The subjects were assigned to 1 of the 2 surgical treatment groups.,0,0,0,0,0,0,0,0,0,0,0,
29,"Forty-two patients were treated with a laparoscopic approach (laparoscopic group), whereas the other 42 patients were treated with a laparotomic approach (laparotomic group).",0,0,0,0,0,0,0,0,0,0,0,
30,"All surgical procedures consisted of total hysterectomy, BSO, peritoneal washing, and systematic inspection of intraperitoneal cavity with biopsy of each suspected lesion.",0,0,0,0,0,0,0,0,0,0,0,
31,In all cases a pelvic lymphadenectomy was performed and the removed nodes were sent for intraoperative histologic (frozen-section) examination.,0,0,0,0,0,0,0,0,0,0,0,
32,"The pelvic lymphadenectomy was performed by removing the lymphatic tissue overlying the external, internal, common iliac veins and arteries, and the fossa obturatoria above the obturator nerve.",0,0,0,0,0,0,0,0,0,0,0,
33,Para-aortic lymph nodes were also removed whether metastases to pelvic nodes were detected.,0,0,0,0,0,0,0,0,0,0,0,
34,"The para-aortic lymphadenectomy was performed by removing the lymphatic tissue overlying the right upper common iliac artery, aorta, and vena cava to a level just below the renal vein.",0,0,0,0,0,0,0,0,0,0,0,
35,"When a serous papillary carcinoma was detected, an omentectomy was also performed.",0,0,0,0,0,0,0,0,0,0,0,
36,"In the laparoscopic group, a vaginal-assisted laparoscopic hysterectomy (VALH) was performed.",0,0,0,0,0,0,0,0,0,0,0,
37,"In the laparotomic group, abdominal access was obtained though a vertical midline skin incision and the hysterectomy consisted of an extrafascial total hysterectomy.",0,0,0,0,0,0,0,0,0,0,0,
38,Surgical procedures were performed by the same experienced operator.,0,0,0,0,0,0,0,0,0,0,0,
39,"Laparoscopic access was obtained with a 10-mm trocar through the umbilicus for video laparoscope, 2 lateral 5-mm ancillary ports at the level of the superior iliac crest just lateral to the inferior epigastric vessels for the instruments, and 1 midline 10-mm trocar just above the symphysis for the node extraction.",0,0,0,0,0,0,0,0,0,0,0,
40,"Immediately before surgery, each patient received intravenously 2 g of cephalosporin (Curoxim 2, GlaxoSmithKline S.p.A., Verona, Italy) as antibiotic prophylaxis; a same dose was repeated after the first 2 hours of intervention.",0,0,0,0,0,0,0,0,0,0,0,
41,"Twenty-four hours before and 12 hours after surgery (at 24-hours intervals) a subcutaneous small-molecular-weight heparin (Clexane 0.4, Aventis S.p.A., Cusano Milanino, Milan, Italy) was administered for thrombosis prophylaxis.",0,0,0,0,0,0,0,0,0,0,0,
42,"For each surgical intervention, duration of surgical procedures, number of lymph nodules excised, intraoperative blood loss, amount of blood transfusion, and intraoperative complications were recorded.",0,0,0,0,0,0,0,0,0,0,0,
43,"Intraoperative complications were defined as bowel, bladder, uretheral or vascular injuries, and estimated blood loss exceeding 500 mL.",0,0,0,0,0,0,0,0,0,0,0,
44,Criteria for transfusion were an intraoperative blood loss equal or higher than 1500 mL and/or a variation of hemoglobin (Δ Hb) levels equal or higher than 4 mmol/L in a double assay performed 3 hours form surgery.,1,0,0,0,0,0,0,0,0,0,0,
45,"In the first 24 hours after surgery, all patients received intravenous analgesics.",0,0,0,0,0,0,0,0,0,0,0,
46,"Pain control consisted of tramadol (Prontalgin, GiEnne Pharma S.p.A., Milan, Italy) administered intravenously at a dose of 100 mg immediately after surgery, followed by patient-controlled analgesia (PCA) consisting in tramadol 200 mg (2 vials) in 500 mL of saline solution.",0,0,0,0,0,0,0,0,0,0,0,
47,The number of vials for pain control used during the hospital stay was recorded.,0,0,0,0,0,0,0,0,0,0,0,
48,"At the end of the surgical procedure, the postoperative pain was also evaluated by using a visual analogue scale (VAS), and pain severity was expressed as a score ranging from 0 to 10.",0,0,0,0,0,0,0,0,0,0,0,
49,"Specifically, postoperative pain was assessed in each group every 3 hours for the first 12 hours after surgery, 24 and 48 hours after surgery, and before hospital discharge.",0,0,0,0,0,0,0,0,0,0,0,
50,The morning after surgery patients were allowed to eat and drink and could ambulate as soon as they felt comfortable.,0,0,0,0,0,0,0,0,0,0,0,
51,The urinary catheter was removed the morning after surgery.,0,0,0,0,0,0,0,0,0,0,0,
52,"Twenty-four hours after surgery, a blood sample was taken from each patient and Δ Hb levels were calculated.",0,0,0,0,0,0,0,0,0,0,0,
53,"Postoperative complications, hospital stay, and time needed to return to full activity and/or work were also recorded in both groups.",0,0,0,0,0,0,0,0,0,0,0,
54,"Postoperative complications were defined as adverse events occurring within 30 days from surgery as a result of the operations and were considered major if they resulted in unplanned readmission, blood transfusion, or secondary surgical procedure.",0,0,0,0,0,0,0,0,0,0,0,
55,"Another 40 women, matched for demographic characteristic with patients, were enrolled in the present protocol-study as controls (control group).",0,0,0,1,0,0,0,0,0,0,0,QoL assessment
56,"Women with premalignancies or malignancies, with current or past physical and/or psychiatric disorder and/or PMS, and/or users of drugs influencing cognition, vigilance, and/or mood were excluded.",0,0,0,0,0,0,0,0,0,0,0,
57,"At baseline, 1, 3, and 6 months from surgery, QoL and climacteric symptoms were assessed in each patient and control subject.",0,0,0,1,0,0,0,0,0,0,0,
58,The climacteric symptoms were evaluated with the Kupperman Index (KI).,0,0,0,0,0,0,0,0,0,0,0,
59,"KI (score range, 0-51) assesses 11 symptoms: vasomotor symptoms, paresthesia, insomnia, nervousness, melancholia, vertigo, weakness, arthralgia and myalgia, headache, palpitations, and formication.",0,0,0,0,0,0,0,0,0,0,0,
60,QoL was studied by using the Italian version of the Short-Form Healthy Survey (SF-36).,0,0,0,0,0,0,0,0,0,0,0,
61,"SF-36 is a well-validated generic measure of QoL (score range, 0-100; higher scores indicating better quality of life) and consists of 8 domains: physical functioning (10 items), physical role functioning (4 items), body pain (2 items), general health perceptions (5 items), vitality (4 items), social function (2 items), emotional role function (3 items), and mental health (5 items).",0,0,0,0,0,0,0,0,0,0,0,
62,The primary endpoint of our study was the QoL assessment.,0,0,0,0,0,0,0,0,0,0,0,Statistical analysis
63,A prestudy power analysis was not feasible because of a lack of specific and previous data in literature.,0,0,0,0,0,0,0,0,0,1,0,
64,Unpaired Student t test for independent groups of data was used to compare age and BMI.,0,0,0,1,0,0,0,0,0,0,0,
65,"The Mann-Whitney U test was used to compare parity, global operative time, intraoperative blood loss, total blood loss, vials for pain control used, hospital stay, and time length needed to return to full activity and/or work.",0,0,0,0,0,0,0,0,0,0,0,
66,"Fisher exact test was used to compare, between treatment groups, the proportion of women with previous major abdominal surgery, medical conditions, different menopausal state, type of work, socioeconomic status, different pathologic diagnosis, and incidence of intraoperative and postoperative complications.",0,0,0,0,0,0,0,0,0,0,0,
67,Analysis of the covariance (ANCOVA) was used to evaluate differences adjusted for baseline values between and within groups in KI and SF-36 scores.,0,0,0,1,0,0,0,0,0,1,0,
68,"The differences, between and within groups, in KI and in SF-36 were also studied by repeated analysis of variance (ANOVA) measures by using a post-hoc t test to compare individual domains of interest.",0,0,0,0,0,0,0,0,0,1,1,
69,"The analysis of QoL data was performed after adjustment for KI score, as dependent variable.",0,0,0,0,0,0,0,0,0,1,0,
70,Stepwise multiple linear regression analysis was also performed to separately test KI against the independent variable SF-36 scores.,0,0,0,0,0,0,0,0,0,1,0,
71,"Statistical analysis was performed with the SPSS 11.0 (SPSS Inc, Chicago, Ill) package.",0,0,0,0,0,0,0,0,0,1,0,
72,Continuous data were expressed as mean ± SD.,0,0,0,0,0,0,0,0,0,0,1,
73,A P < .05 value was considered as statistically significant.,0,0,0,0,0,0,0,0,0,0,0,
74,Data were analyzed by using the intention-to-treat method on the basis of treatment assignment and not on treatment receipt.,0,0,0,0,0,0,0,0,1,0,0,
75,Only those subjects not having undergone the first follow-up visit after randomization were excluded from the final analysis.,0,0,0,0,0,0,0,0,0,1,0,
76,The flow-diagram of the clinical trial according to the Consolidated Standards of Reporting Trials (CONSORT) guidelines is shown in Figure 1.,0,0,0,0,0,0,0,0,0,0,0,Results
77,Demographic characteristics of the subjects are shown in Table I.,0,0,0,1,0,0,0,0,0,0,0,
78,"After randomization, the 2 treatment groups were comparable for all variables considered.",0,0,0,0,0,0,0,0,0,0,0,
79,"No difference in associated medical conditions was observed between laparoscopic and laparotomic groups, and between both treatment groups and controls (data not shown).",0,0,0,0,0,0,0,0,0,0,0,
80,Trial profile according to CONSORT guidelines.,0,0,0,0,0,0,0,0,0,0,0,Figure 1.
81,In 87.5% (35/40) of cases the laparoscopic procedure was successfully completed.,0,0,0,0,0,0,0,0,0,0,0,Patient characteristics
82,"In 5 cases (5/40, 12.5%) laparoscopy was converted to laparotomy.",0,0,0,0,0,0,0,0,0,0,0,
83,"In 3 cases (3/5, 60%), we performed an early laparotomic conversion caused by an anesthesiologist indication for the impossibility to maintain a Trendelemburg's position during surgical intervention.",0,0,0,0,0,0,0,0,0,0,0,
84,"Specifically, these patients were all obese with a BMI of 32, 34, and 35, respectively.",0,0,0,0,0,0,0,0,0,0,0,
85,"In 1 case (1/5, 20%), the reason of laparotomy conversion was the extrauterine spread of the tumor to the ovaries and the omentum (poorly differentiated stage IV adenosquamous endometrial carcinoma at definitive histologic examination).",0,0,0,0,0,0,0,0,0,0,0,
86,"In the last case (1/5, 20%), the laparotomic conversion was due to severe adhesions precluding visualization of the uterus for previous laparotomies.",0,0,0,0,0,0,0,0,0,0,0,
87,"In 7 cases (7/78, 9.0%), ie, 4 and 3 in laparoscopic and laparotomic groups, respectively, para-aortic lymph nodes dissection was performed because of intraoperative detection of micrometastases in the pelvic lymph nodes.",0,0,0,0,0,0,0,0,0,0,0,
88,"In only 1 case (1/78, 1.3%), para-aortic lymph nodal metastases were also detected.",0,0,0,0,0,0,0,0,0,0,0,
89,No case of falsely negative lymph nodes was observed at the frozen-section examination.,0,0,0,0,0,0,0,0,0,0,0,
90,"For both treatment groups, FIGO stage, grading, and histologic type of the cancers were similar (Table II).",0,0,0,0,0,0,0,0,0,0,0,
91,"After complete surgical staging, 10 (10/40, 25%) and 8 (8/38, 21%) patients for laparoscopic and laparotomic groups, respectively, resulted upstaged.",0,0,0,0,0,0,0,1,0,0,0,
92,"Surgical stage, grade, and histology of the endometrial cancers in the 2 surgical treatment groups",0,0,0,0,0,0,0,0,0,0,0,Table II.
93,The global operative time was statistically (P < .05) longer in the laparoscopic than in the laparotomic group (196.7 ± 38.4 vs 135.3 ± 47.6).,0,0,0,0,0,0,0,0,0,0,0,
94,The intraoperative blood loss (173.9 ± 58.1 vs 282.5 ± 81.0) and the Δ Hb (1.2 ± 0.7 vs 2.5 ± 1.2) was significantly (P < .05) lower in the laparoscopic than in the laparotomic group.,0,0,0,0,0,0,0,0,0,0,0,
95,"In only 1 case (laparotomic group), a blood transfusion was required.",0,0,0,0,0,0,0,0,0,0,0,
96,The number of pelvic (11.5 ± 4.6 vs 10.7 ± 5.5) and para-aortic (5.8 ± 4.2 vs 4.9 ± 3.9) lymph nodules removed were similar between the 2 groups.,0,0,0,0,0,0,0,0,0,0,0,
97,"Regarding postoperative pain, no difference between groups was detected during the first 48 hours from surgery, whereas at the hospital discharge a VAS score significantly (P < .05) lower was observed in the laparoscopic than in the laparotomic group.",0,0,0,0,0,0,0,0,0,0,0,
98,"In addition, the total number of vials for pain control used during hospital stay was significantly (P < .05) lower in the laparoscopic than in the laparotomic group (6.7 ± 2.2 vs 10.3 ± 2.5).",0,0,0,0,0,0,0,0,0,0,0,
99,The mean hospital stay (3.0 ± 1.4 vs 6.9 ± 2.6) and the length time needed to return to full activity and/or work (28.2 ± 12.8 vs 47.8 ± 24.7) were significantly (P < .05) lower after laparoscopy in comparison with laparotomy.,0,0,0,0,0,0,0,0,0,0,1,
100,"No significant difference in intraoperative complications was observed between groups, whereas postoperative complications were significantly (P < .05) less common in the laparoscopic than in the laparotomic group (Table III).",0,0,0,0,0,0,0,0,0,0,0,
101,Intraoperative and postoperative complications in laparoscopic and laparotomic group,0,0,0,0,0,0,0,0,0,0,0,Table III.
102,"In patients with positive pelvic nodes and negative para-aortic nodes (2 and 3 in laparoscopic and laparotomic groups, respectively), total pelvic irradiation until common iliac nodes was performed (total dose 50 Gy in 15 fractions).",0,0,0,0,0,0,0,0,0,0,0,
103,"In only 1 patient (laparoscopic group) with positive pelvic and para-aortic nodes, extended-field irradiation to the pelvis and the aortic area was performed.",0,0,0,0,0,0,0,0,0,0,0,
104,"Two patients and 1 patient in laparoscopic and laparotomic groups, respectively, received vaginal brachytherapy (4 × 5-10 Gy).",0,0,0,0,0,0,0,0,0,0,0,
105,"After the first 6-month follow-up, there was only 1 case (laparoscopic group) of recurrence and no deaths occurred in either group.",0,0,0,0,0,0,0,0,0,0,0,
106,"At entry, the QoL was similar in both treatment groups but significantly (P < .05) worse in comparison with controls.",0,0,0,0,0,0,0,0,0,0,0,QoL assessment
107,"At the 1-month follow-up, total SF-36 scores resulted significantly (P < .05) higher in the laparoscopic group in comparison with baseline, whereas in the laparotomic group no significant change was detected.",0,0,0,1,0,0,0,0,0,0,0,
108,"At the 3-month follow-up, we observed a significant (P < .05) increase in total SF-36 scores in both treatment groups compared with baseline.",0,0,0,1,0,0,0,0,0,0,0,
109,"At the same time, total SF-36 scores resulted significantly (P < .05) lower in treatment groups than in controls.",0,0,0,0,0,0,0,0,0,0,0,
110,Total SF-36 scores resulted significantly (P < .05) increased in comparison with the first-month follow-up in the laparotomic group.,0,0,0,0,0,0,0,0,0,0,0,
111,"Six months after surgery, QoL improvement observed in both treatment groups was not significantly changed in comparison with the 3-month evaluation.",0,0,0,0,0,0,0,0,0,0,0,
112,The QoL score was significantly (P < .05) worse in the laparotomic than in the control group.,0,0,0,0,0,0,0,0,0,0,0,
113,"On the contrary, QoL did not result significantly different between the laparoscopic and the control group.",0,0,0,0,0,0,0,0,0,0,0,
114,"Throughout the study, total SF-36 scores were significantly (P < .05) higher in the laparoscopic versus the laparotomic group (Figure 2).",0,0,0,0,0,0,0,0,0,0,0,
115,"Total SF-36 score (mean ± SD) in laparoscopic and laparotomic group, and in controls.",0,0,0,0,0,0,0,0,0,0,1,Figure 2.
116,∗P < .05 vs controls; †P < .05 vs baseline; ‡P < .05 vs laparoscopic group; §P < .05 vs first month follow-up.,0,0,0,1,0,0,0,0,0,0,0,
117,The different domains of the SF-36 are shown in Table IV.,0,0,0,0,0,0,0,0,0,0,0,
118,"QoL assessment (mean SF-36 scores) in laparoscopic, laparotomic, and control group",0,0,0,0,0,0,0,0,0,0,1,Table IV.
119,"At baseline, no difference in the KI score was detected among the 3 groups (14.6 ± 12.4, 15.5 ± 13.8, and 15.1 ± 13.1 for laparoscopic, laparotomic, and control group, respectively).",0,0,0,1,0,0,0,0,0,0,0,
120,"After surgery, a significant (P < .05) increase in the KI score was observed in both treatment groups in comparison with the control group, without differences between them (25.5 ± 5.3, 23.8 ± 13.8, and 17.2 ± 14.2 for laparoscopic, laparotomic, and control group, respectively).",0,0,0,0,0,0,0,0,0,0,0,
121,"The KI scores resulted significantly (P < .05) related to SF-36 scores only in those patients regularly cycled before surgery (r = 0.67), whereas no relation was observed in postmenopausal patients (r = 0.38).",0,0,0,0,0,0,0,0,0,0,0,
122,"When analyzing the data only in patients who received postoperative radiotherapy, a significant (P < .05) difference in the SF-36 score was observed in both treatment groups in comparison with controls, and between the laparoscopic and laparotomic groups (data not shown).",0,0,0,0,0,0,0,0,0,0,0,
123,"Several articles are available regarding the laparoscopic treatment of early stage endometrial cancer.Although many studies have a retrospective or prospective unrandomized design,only a few are performed in a prospective randomized controlled fashion.",0,0,0,0,0,0,0,0,0,0,0,Comment
124,The current RCT clearly indicated and confirmed that the laparoscopic approach is a feasible and safe procedure in the treatment of stage I endometrial cancer.,0,0,0,0,0,0,0,0,0,0,0,
125,"The laparoscopic procedure lasted significantly longer in comparison with the laparotomic approach, whereas the intraoperative blood loss and the drop in Hb levels resulted significantly lower during the laparoscopic procedures.",0,0,0,0,0,0,0,0,0,0,0,
126,"According to previous data, in our series of cases no difference in mean number of pelvic and para-aortic lymph nodules removed was observed between the 2 surgical approaches.",0,0,0,0,0,0,0,0,0,0,1,
127,"Furthermore, the data on the lower total number of vials for pain control used during hospital stay and the lower value of the VAS score for postoperative pain, as observed at hospital discharge, confirmed that laparoscopic access is related to lower postoperative pain.6 In addition, the mean hospital stay was significantly lower after laparoscopy compared with laparotomy.",0,0,0,0,0,0,0,0,0,0,1,
128,"The low intraoperative and postoperative complications rate, observed in the laparoscopic group, highlights the safety of this surgical approach.",0,0,0,0,0,0,0,0,0,0,0,
129,"Specifically, the intraoperative complications incidence resulted similar in both treatment groups (7.5% vs 7.9%), whereas a lower rate of postoperative complications (27.5% vs 47.4%) was observed after laparoscopic surgery.",0,0,0,0,0,0,0,0,0,0,0,
130,"However, definitive conclusions on this issue cannot be drawn because the current study was not powered for this endpoint.",0,0,0,0,0,0,0,0,0,0,0,
131,"Despite the current data have been obtained from a small sized sample with a limited follow-up period, they confirm that in patients with early stage endometrial cancer recurrence-free and overall survival rates are similar after laparotomic and laparoscopic approaches.",0,0,0,0,0,0,0,0,0,0,0,
132,"In fact, after 6 months of follow-up, the survival rate was 100% in both groups.",0,0,0,0,0,0,0,0,0,0,0,
133,"Notwithstanding, we used all procedures to reduce recurrence of endometrial cancer, ie, occlusion of the fallopian tubes as first surgical step and minimal uterine manipulation, 1 case (2.5%) of recurrence was observed in the laparoscopic group.",0,0,0,0,0,0,0,0,0,0,0,
134,This case consisted of vaginal cuff recurrence and was detected after 6 months from surgery in a woman with a stage II B endometrial cancer previously treated with brachytherapy.,0,0,0,0,0,0,0,0,0,0,0,
135,"Our data were obtained on a study population unselected for BMI, age, and (major) medical conditions.",0,0,0,1,0,0,0,0,0,0,0,
136,"Accordingly, at enrollment and before randomization, no specific exclusion criteria were used.",1,0,0,0,0,0,0,0,0,0,0,
137,"As expected, a high percentage of patients was overweight or obese and was affected by associated medical conditions.",0,0,0,0,0,0,0,0,0,0,0,
138,"However, only 12.5% of the laparoscopic procedures were converted to laparotomy.",0,0,0,0,0,0,0,0,0,0,0,
