Sentence-ID,Sentence-String,Q1,Q2,Q3,Q4,Q5,Q6,Q7,Q8,Q9,Q10,Q11,Section
139,"In 60% of cases, the laparotomic conversions were performed in obese patients just after laparoscopic procedure start began after an anesthesiologist indication caused by the impossibility to maintain the Trendelemburg's position.",0,0,0,0,0,0,0,0,0,0,0,
140,"In only 2 cases, conversion to laparotomy was performed for surgical reasons (extrauterine spread of the tumor and severe peritoneal adhesions).",0,0,0,0,0,0,0,0,0,0,0,
141,Our study shows that the laparotomic and laparoscopic approaches to early stage of endometrial cancer have the same indications and limits.,0,0,0,0,0,0,0,0,0,0,0,
142,"The current study suggest that the only limiting factors of the feasibility of the laparoscopic approach, as demonstrated by the high early conversion rate of the current study, is the impossibility to maintain Trendelemburg's position during the surgical procedure in some obese women with an high amount of visceral fat.",0,0,0,0,0,0,0,0,0,0,0,
143,"Moreover, the preoperative BMI assessment is not accurate in the detection of this subgroup of patients.",0,0,0,0,0,0,0,0,0,0,0,
144,"In our department, we routinely perform a complete surgical stadiation in all patients with clinical stage I endometrial carcinoma.",0,0,0,0,0,0,0,1,0,0,0,
145,"In fact, in our series, 25% and 21% of patients for the laparoscopic and the laparotomic group, respectively, resulted upstaged after surgery.",0,0,0,0,0,0,0,0,0,0,0,
146,In about 9% of cases micrometastases were detected intraoperatively in the pelvic nodes (without cases of falsely negative nodes at the frozen-section examination) but only in 1.3% of cases para-aortic nodal metastases were observed.,0,0,0,0,0,0,0,0,0,0,0,
147,"QoL assessment should be considered as a complementary index to evaluate therapeutic interventions and to measure health status perception, but there are scarce data on this issue in the field of gynecologic oncology.",0,0,0,0,0,0,0,0,0,0,0,
148,Several studies have concluded that laparoscopic treatment for early stage endometrial cancer improves the QoL.,0,0,0,0,0,0,0,0,0,0,0,
149,"Moreover, these reports were obtained only on indirect indexes of QoL, such as the length of time necessary to return to work or to full activity, hospital stay, level of satisfaction, and so on.",0,0,0,0,0,0,0,0,0,0,0,
150,Spirtos et al23 showed that laparoscopic treatment of early stage of endometrial cancer improves the QoL when compared with laparotomic surgery.,0,0,0,0,0,0,0,0,0,0,0,
151,"These conclusions were achieved retrospectively on a sample of patients surgically treated in 9 different hospitals using as QoL indexes the mean hospital stay, the complication rates, the length of time necessary to time to return to normal activity, and the ability to return to work.",0,0,0,0,0,0,0,0,0,0,1,
152,"To our knowledge, the current study is the first aimed to primarily evaluate QoL differences between women with early stage endometrial cancer treated by either laparotomic or laparoscopic approaches, using a specific evaluation tool.",0,0,0,0,0,0,0,0,0,0,0,
153,Such tool is based on the SF-36 test for QoL after the recent demonstration of its use and effectiveness in patients affected by gynecologic cancers by Capelli et al.,0,0,0,0,0,0,0,0,0,0,0,
154,"Consequently, we enrolled patients with similar social, economic, and menopausal status, and a well-matched control group with similar demographic characteristics and associated medical conditions.",0,0,0,1,0,0,0,0,0,0,0,
155,"Our findings demonstrate that in an early clinical stage the knowledge of a malignancy, as endometrial cancer, also, reduces the QoL acting on all domains examined with a major on mental functions.",0,0,0,0,0,0,0,0,0,0,0,
156,A significant improvement in QoL was observed after laparoscopic treatment in comparison with the baseline and the laparotomic group.,0,0,0,1,0,0,0,0,0,0,0,
157,"Soon after laparotomic surgery, we detected a significant decrease in the QoL domains evaluating the physical health, whereas after a longer follow-up, a significant improvement was observed in all domains.",0,0,0,0,0,0,0,0,0,0,0,
158,"As evaluated at short-term follow-up, the difference in the SF-36 scores in the 2 surgical groups could be explained with a reduced effect caused by laparoscopy on physical functions.",0,0,0,0,0,0,0,0,0,0,0,
159,"In a more long-term follow-up, laparotomy seems to act on the psychologic condition probably influencing the subjective perception of the severity of the disease that can be overestimated.",0,0,0,0,0,0,0,0,0,0,0,
160,"Similarly, a mini-invasive procedure, as a laparoscopic approach, could minimize the severity of the disease because of the little alteration in the body image.",0,0,0,0,0,0,0,0,0,0,0,
161,"Of note, even thought the 3 groups were well matched for menopausal status, a statistical QoL data adjustment for climacteric symptomatology was performed showing no influence of this factor on QoL after oncologic surgery.",0,0,0,0,0,0,0,0,0,0,0,
162,"Clearly, our data are limited by the short-term period of evaluation.",0,0,0,0,0,0,0,0,0,0,0,
163,"In long-term endometrial survivors, QoL resulted significantly lower in comparison with healthy postmenopausal women.",0,0,0,0,0,0,0,0,0,0,0,
164,"Furthermore, in this last study, all patients were treated with abdominal radical hysterectomy and BSO, and a high percentage received postsurgery radiotherapy and/or chemotherapy.",0,0,0,0,0,0,0,0,0,0,0,
165,"In conclusion, this study shows that the laparoscopic approach of clinical early stage endometrial cancer is a surgical approach as feasible and safe as classical laparotomic procedure.",0,0,0,0,0,0,0,0,0,0,0,
166,"However, in patients with early stage endometrial carcinoma, the mini-invasivity of the laparoscopic approach gives significant benefits over laparotomy in terms of QoL for at least 6 months from surgery independently from menopausal status.",0,0,0,0,0,0,0,0,0,0,0,