Sentence-ID,Sentence-String,Q1,Q2,Q3,Q4,Q5,Q6,Q7,Q8,Q9,Q10,Q11
143,"Third, only one sample of speech was obtained from each child.",0,0,N,0,N,N,0,0,0,0,0
144,"Although this is not ideal, additional information was obtained via a questionnaire completed by the parent of the child.",0,0,N,1,N,N,0,0,0,0,0
145,"In general, it appears that the speech sample data and questionnaire data are consistent in what they convey about the children's stuttering during the post‐treatment period.",0,0,N,0,N,N,0,0,0,0,0
146,The findings of the present study indicate that most children are able to complete the Lidcombe Program successfully and maintain those clinically significant gains.,0,0,N,0,N,N,0,0,0,0,0
147,"However, it is also apparent that a minority of children do relapse.",0,0,N,0,N,N,0,0,0,0,0
148,"Therefore, it is important that: (1) parents remember to present occasionally verbal contingencies for stutter‐free speech for an extended period after the end of Stage 2; (2) parents reintroduce verbal contingencies for stuttered speech should stuttering reappear; and (3) if stuttering does not then reduce to criterion levels, the parent should contact a speech–language therapist.",0,0,N,0,N,N,0,0,0,0,0
149,At present there are no known predictors of long‐term relapse after successful treatment of stuttering during the preschool years.,0,0,N,0,N,N,0,0,0,0,0
150,An exploratory least‐squares regression in the present paper failed to generate any evidence of such predictors.,0,0,N,0,N,N,0,0,0,0,0
151,"However, the present methodology only permitted a preliminary assessment of this important topic.",0,0,N,0,N,N,0,0,0,1,0
152,The present group is currently undertaking research in this area with a large cohort of children who have been treated successfully.,0,0,N,0,N,N,0,0,0,0,0
153,"Additionally, research has been designed to establish whether any additional post‐treatment strategies can reduce the risk of relapse.",0,0,N,0,N,N,0,0,0,0,0
154,"In the interim, though, the present data raise the importance of parental vigilance after their children's treatment for early stuttering.",0,0,N,0,N,N,0,0,0,0,0