Sentence-ID,Sentence-String,Q1,Q2,Q3,Q4,Q5,Q6,Q7,Q8,Q9,Q10,Q11
321,"The current study would need to be replicated with other phonological intervention approaches to determine if, in fact, this finding can be generalized.",0,0,0,0,0,0,N,0,N,0,0
322,"Nevertheless, the results of this study are likely to be of interest to SLPs in the midst of determining dose frequency.",0,0,0,0,0,0,N,0,N,0,0
323,"In addition, the current study contributes higher-level evidence to the current evidence base regarding the efficacy of the multiple oppositions approach (Pagliarin et al., 2009; Williams, 2000a, 2000b, 2005) due to the completion of a larger scale, randomized controlled study.",0,0,0,0,0,0,N,0,N,0,0
324,"In addition, the present study presents evidence for intervention effectiveness as it was implemented by seven SLPs and two SLPAs in their natural work settings with a high level of fidelity.",0,0,0,0,0,0,N,0,N,0,0
325,Study Limitations and Future Directions,0,0,0,0,0,0,N,0,N,0,0
326,Limitations center around the challenges of controlling the intervention intensity variables.,0,0,0,0,0,0,N,0,N,0,0
327,Dose form was the easiest variable to control due to the intervention protocol.,0,0,0,0,0,0,N,0,N,0,0
328,The fidelity-of-implementation data indicate that dose form was implemented with a high level of fidelity.,0,0,0,0,0,0,N,0,N,0,0
329,"Total intervention duration was intended to be 24 sessions—although, in actuality, it averaged 19.42 sessions for the P1 condition and 19.84 sessions for the P3 condition.",0,0,0,0,0,0,N,0,N,0,0
330,Dose frequency was designed to compare a one-time-per-week intervention to a three-times-per-week intervention.,0,0,0,0,0,0,N,0,N,0,0
331,"The attendance data indicate that the expected ratio of one to three sessions every week was not achieved, although the actual ratio of 0.81 to 2.48 sessions per week did show significant effects.",0,0,0,0,0,0,N,0,N,0,0
332,The most difficult aspect to control was dose.,0,0,0,0,0,0,N,0,N,0,0
333,"Training and the intervention protocol provided an intended dose, but there was variability reported in the fidelity-of-implementation data, requiring multiple feedback sessions to better control this intervention intensity variable.",0,0,0,0,0,0,N,0,N,0,0
334,"It is possible that the prescribed minimum dose, 81, was too high.",0,0,0,0,0,0,N,0,N,0,0
335,"In addition, there may have been a difference in the number of targets and, thus, the number of times each target was addressed.",0,0,0,0,0,0,N,0,N,0,0
336,"For example, a child with one to two targets would have had more opportunities to produce those targets, resulting in deeper training.",0,0,0,0,0,0,N,0,N,0,0
337,"In contrast, a child with three to four targets would have had fewer opportunities to produce each target, resulting in broader training.",0,0,0,0,0,0,N,0,N,0,0
338,"In order to better control dose for the multiple oppositions approach, all children would need to have the same number of targets, and this is worthy of future investigations.",0,0,0,0,0,0,N,0,N,0,0
339,These data do provide preliminary evidence that dose should be explicitly stated in a Method section and captured in fidelity-of-implementation data.,0,0,0,0,0,0,N,0,N,0,0
340,A second potential limitation was the use of the multiple oppositions approach for all children.,0,0,0,0,0,0,N,0,N,0,0
341,The multiple oppositions approach was chosen for all participants due to the need for a consistent intervention protocol.,0,0,0,0,0,0,N,0,N,0,0
342,"This phonological intervention has been recommended for children with severe and moderate–severe SSD (Pagliarin et al., 2009), so it is possible that the children with mild–moderate SSD may not have benefited from this approach as much as from a different phonological intervention approach.",0,0,0,0,0,0,N,0,N,0,0
343,A third potential limitation is the possible confound of concomitant speech and language impairment.,0,0,0,0,0,0,N,0,N,0,0
344,"In the current study, only receptive language was assessed.",0,0,0,0,0,0,N,0,N,0,0
345,"The differences between the P1 and P3 conditions were not significantly different, although the mean 10-point difference could indicate subtle differences in broad receptive language skills.",0,0,0,0,0,0,N,0,N,0,0
346,"Different profiles of children with SSD may include those with receptive and expressive language impairment, receptive language impairment only, expressive language impairment only, and no language impairment.",0,0,0,0,0,0,N,0,N,0,0
347,"It has been noted that poorer comprehension skills may have a negative impact upon prognosis (Paul, 2007), so it is possible that these different profiles of children with concomitant speech and language impairment may present with different responsiveness rates to phonological intervention.",0,0,0,0,0,0,N,0,N,0,0
348,"In the future, a larger speech sample should be collected because it may be a more sensitive outcome measure for analyzing PCC.",0,0,0,0,0,0,N,0,N,0,0
349,"Although the GFTA–2 samples all initial singleton consonants, very few consonants are sampled more than once.",0,0,0,0,0,0,N,0,N,0,0
350,"In addition, a minimal number of consonant clusters are sampled.",0,0,0,0,0,0,N,0,N,0,0
351,A measure that elicited each singleton consonant in initial and final positions of words as well as consonant clusters at least five times each may have provided a more sensitive phonological outcome measure.,0,0,0,0,0,0,N,0,N,0,0
352,"A different option for a possibly more sensitive outcome measure would be a score based on the Scaffolding Scale of Stimulability (Glaspey & Stoel-Gammon, 2005).",0,0,0,0,0,0,N,0,N,0,0
353,This study provides an initial investigation into the manipulation of one intervention intensity variable for one phonological intervention approach.,0,0,0,0,0,0,N,0,N,0,0
354,"The manipulation of other intervention intensity variables—for example, dose—would inform the field of the best combination of intervention intensity variables for each intervention approach.",0,0,0,0,0,0,N,0,N,0,0
355,"In addition, homework may increase intensity by providing additional doses to cumulative intervention intensity.",0,0,0,0,0,0,N,0,N,0,0
356,"Once the best combination of intervention intensity variables is known across phonological intervention approaches, then interventions can be validly compared to determine which are most effective and efficient.",0,0,0,0,0,0,N,0,N,0,0
357,The quest to investigate the effect of intervention intensity variables upon phonological outcomes continues to be an area of need within the communication disorders literature.,0,0,0,0,0,0,N,0,N,0,0
358,"Results from the current study indicate that preschool children with SSD receiving the multiple oppositions approach made significantly greater gains in intervention when they were provided with a more intensive, three-times-per-week dose frequency than when cumulative intervention intensity was held constant.",0,0,0,0,0,0,N,0,N,0,0
359,"The children receiving a one-time-per-week intervention dose frequency also made progress, but the growth was similar to that of the children in an active control condition.",0,0,0,0,0,0,N,0,N,0,0
360,Future examination of the impact of dose frequency upon phonological outcomes is warranted to determine if preschool children differentially respond to variations in frequency no matter the chosen phonological intervention approach.,0,0,0,0,0,0,N,0,N,0,0