Sentence-ID,Sentence-String,Q1,Q2,Q3,Q4,Q5,Q6,Q7,Q8,Q9,Q10,Q11
136,"Second, more HLA B27 positive patients were allocated in the prednisolone group than in the methylprednisolone group (29.4% vs. 18.4%).",0,0,N,0,N,0,0,0,N,0,0
137,This may potentially cause a more severe and more resistant kind of anterior uveitis in the prednisolone-treated group.,0,0,N,0,N,0,0,0,N,0,0
138,"However, because we have already excluded cases with severe inflammation at presentation, this difference may barely affect our results.",0,0,N,0,N,0,0,0,N,0,0
139,"Finally, our patients were not masked to the treatment group they had been randomized to and were aware of which medication they were using.",0,0,N,0,N,0,0,0,N,0,0
140,"Because the study only looks at patients with mild-to-moderate disease, patients with severe disease should be evaluated in future studies, because these are the patients who might benefit the most from preservative-free treatment.",0,0,N,0,N,0,0,0,N,0,0
141,"In conclusion, preservative-free methylprednisolone 1% preparation was shown to be at least as effective as prednisolone acetonide 1% suspension in resolving the inflammation associated with mild-to-moderate noninfectious AAU with less corneal toxicity and lower subjective discomfort.",0,0,N,0,N,0,0,0,N,0,0