Sentence-ID,Sentence-String,Q1,Q2,Q3,Q4,Q5,Q6,Q7,Q8,Q9,Q10,Q11
136,"In contrast, measurements of corneal thickness in the treatment group using Orbscan computerized videokeratography revealed a highly significant decrease in the measured values at the thinnest point compared with baseline readings that was most marked at 3 months (−93.00±7.98 μm; P <0.001).",0,0,N,N,N,N,N,0,N,0,0
137,The measured thinning reversed over the follow-up period to −19.52±5.06 μm at 36 months.,0,0,N,N,N,N,N,0,N,0,0
138,"However, the thinnest point on Orbscan computerized videokeratography remained significantly lower than at baseline (P <0.001) at all time points.",0,0,N,N,N,N,N,0,N,0,0
139,"A different pattern of change was observed in control eyes with a statistically significant, progressive decrease in the measurement at the thinnest point at 12, 24, and 36 months.",0,0,N,N,N,N,N,0,N,0,0
140,The trends over time were significantly different between the groups (P  <0.001).,0,0,N,N,N,N,N,0,N,0,0
141,"Using the Tono-Pen, no significant difference was detected for the mean change in intraocular pressure from baseline to 36 months in either group.",0,0,N,N,N,N,N,0,N,0,0
142,"Using the Goldmann applanation tonometer, a significant decrease from baseline was observed in both groups at 36 months, but this was not significantly different between the groups.",0,0,N,N,N,N,N,0,N,0,0
143,There was also no significant difference observed comparing the trends between the groups with either device (Table 2).,0,0,N,N,N,N,N,0,N,0,0
144,At no point was a significant difference in endothelial cell density found when compared with baseline for either group.,0,0,N,N,N,N,N,0,N,0,0
145,"Similarly, there was no significant difference between the 2 groups (Table 2).",0,0,N,N,N,N,N,0,N,0,0
146,"Two eyes with adverse events after CXL treatment were initially reported in an earlier publication.11 In one case, there was mild, diffuse corneal edema and a small paracentral infiltrate 1 week after treatment.",0,0,N,N,N,N,N,0,N,0,0
147,This was attributed to the premature (day 3) resumption of rigid contact lens wear and was treated with a prolonged course of fluorometholone acetate 0.1%.,0,0,N,N,N,N,N,0,N,0,0
148,"The BSCVA was not adversely affected, with an improvement observed from 0.30 logMAR at baseline to 0.00 logMAR at 3 months.",0,0,N,N,N,N,N,0,N,0,0
149,"By 12 months, there was only a faint corneal scar, with BSCVA stable at 0.00 logMAR (Fig 5).",0,0,N,N,N,N,N,0,N,0,0
150,"Slit-lamp photographs of a patient with mild, diffuse, corneal edema and a small paracentral infiltrate obtained (A) 1 week after corneal collagen cross-linking (CXL) and (B) 12 months after CXL demonstrating residual corneal scarring.",0,0,N,N,N,N,N,0,N,0,0
151,"In a second case, subepithelial infiltrates and anterior chamber inflammation were observed 2 days after treatment in a patient with a history of severe atopy.",0,0,N,N,N,N,N,0,N,0,0
152,"This was treated as possible microbial keratitis with removal of the bandage soft contact lens and the frequent application of ofloxacin eye drops (Ocuflox; Allergan, Sydney, Australia).",0,0,N,N,N,N,N,0,N,0,0
153,Fluorometholone acetate 0.1% was initiated 1 week later.,0,0,N,N,N,N,N,0,N,0,0
154,There were no organisms identified on either Gram stain or culture from corneal scrapings.,0,0,N,N,N,N,N,0,N,0,0
155,The clinical signs had resolved by 3 months after CXL.,0,0,N,N,N,N,N,0,N,0,0
156,The BSCVA improved from 0.6 logMAR at baseline to 0.3 logMAR at 6 months in this eye.,0,0,N,N,N,N,N,0,N,0,0
157,A third patient was noted to have peripheral corneal vascularization 3 years after CXL treatment.,0,0,N,N,N,N,N,0,N,0,0
158,"However, there was evidence of acne rosacea and vascularization in both the treated eye and the untreated fellow eye.",0,0,N,N,N,N,N,0,N,0,0
159,This change was thought to be unrelated to the CXL treatment.,0,0,N,N,N,N,N,0,N,0,0
160,There were no other treatment-related adverse events.,0,0,N,N,N,N,N,0,N,0,0
161,Corneal collagen cross-linking is often described as the most promising innovation in the treatment of progressive keratoconus in recent years.,0,0,N,N,N,N,N,0,N,0,0
162,The growing interest in CXL is reflected in the rapid increase in publications since the first report by Spoerl et al in 1998.,0,0,N,N,N,N,N,0,N,0,0
163,"A keyword search using PubMed (http://www-ncbi-nlm-nih-gov.ezp.lib.unimelb.edu.au/pubmed) accessed on September 6, 2013, using the terms collagen cross-linking and keratoconus yielded 323 citations, 90% of which were published in the past 4 years.",0,0,N,N,N,N,N,0,N,0,0
164,"Despite the growing body of literature and continuing efforts to optimize the treatment protocol, there remains a lack of randomized controlled studies with longer-term follow-up to support the widespread clinical use of CXL for keratoconus.",0,0,N,N,N,N,N,0,N,0,0
165,This article reports our 36-month results from a 5-year randomized controlled clinical trial of CXL for progressive keratoconus.,0,0,N,N,N,N,N,0,N,0,0
166,"The results continue to demonstrate a statistically significant improvement in Kmax, UCVA, and BSCVA in treated eyes.",0,0,N,N,N,N,N,0,N,0,0
167,"In contrast, the Kmax in control eyes increased and the UCVA deteriorated, suggesting continuing progression of the disease.",0,0,N,N,N,N,N,0,N,0,0
168,A number of published case series similarly suggest a therapeutic effect of CXL in slowing the progression of keratoconus.,0,0,N,N,N,N,N,0,N,0,0
169,"However, the level of evidence they can provide is limited by their lack of control data.There have only been 3 published randomized controlled trials to date.",0,0,N,N,N,N,N,0,N,0,0
170,"In 2008, we reported the initial results of our trial in which we observed an improvement in Kmax by a mean of −0.74 D after 12 months in the first 9 treated eyes, whereas 11 control eyes progressed by a mean of +1.28 D. In 2011, O'Brart et al reported an improvement in average Orbscan simulated keratometry values by −0.62 D after 18 months in the treatment group (P <0.001), whereas the control group progressed by +0.14 D (P = 0.3).",0,0,N,N,N,N,N,0,N,0,0
171,Hersh et al reported a randomized controlled trial with shorter follow-up (3 months) for control eyes that were treated subsequently.,0,0,N,N,N,N,N,0,N,0,0
172,"In this study, Kmax improved by a mean of −2.0 D from baseline in treated keratoconic eyes at 1 year, whereas no change in Kmax was documented in control eyes at 3 months.",0,0,N,N,N,N,N,0,N,0,0
173,Only 4 case series report results extending to 36 months.,0,0,N,N,N,N,N,0,N,0,0
174,"Caparossi et al reported a decrease in the mean K value by −2.24 D in 44 eyes, Raiskup-Wolf et al documented a decrease in Kmax by an average of −2.57 D in 33 eyes, Vinciguerra et al observed a decrease in Kmax of −1.68 D in 12 eyes at 36 months, and O'Brart et al reported a decrease in cone apex power of −1.16 D in 30 eyes after 4 to 6 years.",0,0,N,N,N,N,N,0,N,0,0
175,"We observed an improvement in Kmax that was maintained at 3 years, with some eyes showing an ongoing improvement between 24 and 36 months.",0,0,N,N,N,N,N,0,N,0,0
176,This apparent continuing flattening effect of CXL needs to be taken into account when combining CXL with refractive procedures such as photorefractive keratectomy and LASIK.,0,0,N,N,N,N,N,0,N,0,0
177,"A continued improvement over time may be the result of altered expression of enzymes, including transglutaminase and other keratocyte-derived markers.",0,0,N,N,N,N,N,0,N,0,0
178,Several authors suggest a possible correlation between preoperative parameters and the degree of postoperative corneal flattening.,0,0,N,N,N,N,N,0,N,0,0
179,We found that a baseline Kmax of more than 54.0 D was associated with a greater degree of flattening.,0,0,N,N,N,N,N,0,N,0,0
180,"Although of borderline statistical significance, this observation is consistent with the report by Koller et al.",0,0,N,N,N,N,N,0,N,0,0
181,"Conversely, Asri et al15 suggested that progression of disease after CXL was more common in cases with a preoperative K value of more than 58.0 D. They also reported that age of more than 35 years and female gender were further risk factors for postoperative progression.",0,0,N,N,N,N,N,0,N,0,0
182,Vinciguerra et al reported the most promising results in patients 18 to 39 years of age.,0,0,N,N,N,N,N,0,N,0,0
183,We did not observe any correlation between either age or gender with the change in Kmax in the treatment group.,0,0,N,N,N,N,N,0,N,0,0
184,The negative correlation between age and change in Kmax (r = −0.314) in the control group of our study is consistent with the more rapidly progressive disease observed in patients diagnosed with keratoconus at a younger age.,0,0,N,N,N,N,N,0,N,0,0
185,"After CXL, UCVA has been reported to improve by 2.8 Snellen lines at 36 months.",0,0,N,N,N,N,N,0,N,0,0
186,"Similarly, BSCVA has been shown to improve by 2 Snellen lines and −0.15 to −0.23 logMAR.Our results demonstrate a more modest but significant improvement of −0.15 logMAR in UCVA and −0.09 logMAR in BSCVA at 36 months.",0,0,N,N,N,N,N,0,N,0,0
187,We did not detect any change in spherical equivalent or the spherical or cylindrical component of the subjective refraction.,0,0,N,N,N,N,N,0,N,0,0
188,"However, a change in spherical equivalent (reduction in myopia) of between +1.39 and +2.13 D has been reported previously.",0,0,N,N,N,N,N,0,N,0,0
189,"In the control group, the UCVA deteriorated at all follow-up visits, but this change reached statistical significance only at 36 months.",0,0,N,N,N,N,N,0,N,0,0
190,These results are consistent with the continued progression of keratoconus in this group.,0,0,N,N,N,N,N,0,N,0,0
191,"The BSCVA unexpectedly improved by −0.05 logMAR in the control group, but this was not statistically significant.",0,0,N,N,N,N,N,0,N,0,0
192,This observation may be explained by the inherent variability and poor reproducibility of subjective refraction and visual acuity measurement in keratoconic eyes.,0,0,N,N,N,N,N,0,N,0,0
193,The withdrawal of eyes with progressive disease from the control group (after their CXL treatment on compassionate grounds or corneal transplantation surgery) also would reduce the ability to detect deterioration in BSCVA.,0,0,N,N,N,N,N,0,N,0,0
194,The effect of CXL on corneal thickness has so far been less clear.,0,0,N,N,N,N,N,0,N,0,0
195,"Thinning immediately after CXL has been reported and is thought to be the result of several factors, including treatment-related effects from stromal compaction, postoperative dehydration, and alterations in epithelial healing and distribution.",0,0,N,N,N,N,N,0,N,0,0
196,It also may represent a measurement artefact after treatment.,0,0,N,N,N,N,N,0,N,0,0
197,Longer-term observations vary from no change in corneal thickness to a decrease at 12 months and an increase at 24 months.,0,0,N,N,N,N,N,0,N,0,0
198,"In our study, 2 different devices were used to assess corneal thickness.",0,0,N,N,N,N,N,0,N,0,0
199,The marked reduction in the corneal thickness measurements at the thinnest point using Orbscan computerized videokeratography 3 months after treatment was not observed with ultrasound pachymetry.,0,0,N,N,N,N,N,0,N,0,0
200,Caporossi et al similarly reported an underestimation of corneal thickness measurements using the Orbscan compared with ultrasound pachymetry and confocal microscopy.,0,0,N,N,N,N,N,0,N,0,0
201,This may be due to alterations in light transmission as the result of postoperative corneal haze when using optical methods for measuring corneal thickness.,0,0,N,N,N,N,N,0,N,0,0
202,"Postoperative haze is less evident after 6 to 12 months, which is consistent with the gradual return of corneal thickness measurements to near-baseline levels after 24 months.",0,0,N,N,N,N,N,0,N,0,0
203,The small but persistent difference at 36 months using the Orbscan device may be the result of subclinical changes in optical properties that can be observed using confocal microscopy.,0,0,N,N,N,N,N,0,N,0,0
204,"In contrast, the corneal thickness in control eyes determined with both Orbscan and ultrasound pachymetry was thinner after 36 months, again consistent with progressive disease.",0,0,N,N,N,N,N,0,N,0,0
205,A number of adverse effects have been reported.,0,0,N,N,N,N,N,0,N,0,0
206,"Most commonly, a transient stromal edema may occur in up to 70% of patients.",0,0,N,N,N,N,N,0,N,0,0
207,Caparossi et al observed stromal haze in 9.8% of eyes after CXL.,0,0,N,N,N,N,N,0,N,0,0
208,"In contrast, we observed a mild degree of haze in all patients undergoing CXL that resolved with time.",0,0,N,N,N,N,N,0,N,0,0
209,The risk of haze may be greater in corneas that are steeper and thinner at baseline.,0,0,N,N,N,N,N,0,N,0,0
210,Sterile infiltrates have also been reported in up to 7.6% of treated eyes.,0,0,N,N,N,N,N,0,N,0,0
211,We observed 1 case of clinically evident postoperative edema associated with a paracentral infiltrate and a second eye in which subepithelial infiltrates developed.,0,0,N,N,N,N,N,0,N,0,0
212,"The mechanism underlying sterile infiltration in this setting is unknown, but may relate to an altered immune response to antigens or may be a direct result of the phototoxic effect of CXL.",0,0,N,N,N,N,N,0,N,0,0
213,"In our patient, a contributing factor may have been the premature resumption of contact lens wear.",0,0,N,N,N,N,N,0,N,0,0
214,Several cases of proven infectious keratitis have been reported by others.,0,0,N,N,N,N,N,0,N,0,0
215,"In the 1 treated eye in which we initially suspected the diagnosis of microbial keratitis, microbiologic cultures did not demonstrate any growth.",0,0,N,N,N,N,N,0,N,0,0
216,"This infiltrate may have been sterile, occurring in a patient with a marked atopic predisposition.",0,0,N,N,N,N,N,0,N,0,0
217,"Cases of endothelial irregularity and damage associated with CXL have been published by other authors.There was no evidence of endothelial cell damage in any of our study patients, including the single eye with early postoperative edema.",0,0,N,N,N,N,N,0,N,0,0
218,"The endothelial cell density at baseline in our study population seemed to be slightly lower than that of the normal population, but this is consistent with the findings of Niederer et al, who reported a reduction in cell density in all layers of the keratoconic cornea.",0,0,N,N,N,N,N,0,N,0,0
219,"Progression of keratoconus after CXL by +1.00 D over 12 months has been described in up to 7.6% of treated eyes.We identified only 1 treatment failure after CXL, with progression of +4.10 D over 36 months in a patient who demonstrated evidence of rosacea keratitis during the follow-up period.",0,0,N,N,N,N,N,0,N,0,0
220,"A limitation of this study was the decision to offer CXL to patients in the control group after a minimum of 6 months of follow-up, provided that continuous significant progression was documented.",0,0,N,N,N,N,N,0,N,0,0
221,This could lead to masking of progression in the control group and an underestimation of the treatment effect demonstrated in this study.,0,0,N,N,N,N,N,0,N,0,0
222,It also may explain the lack of deterioration in BSCVA at 36 months in the control group.,0,0,N,N,N,N,N,0,N,0,0
223,"It is also notable that the baseline mean corneal curvature (Kmax) was steeper by 1.65 D in the treatment group compared with the control group, with this difference almost reaching statistical significance (P = 0.052).",0,0,N,N,N,N,N,0,N,0,0
224,The course of keratoconus is typically variable in its severity and rate of progression.,0,0,N,N,N,N,N,0,N,0,0
225,There are also difficulties in reliably and reproducibly measuring outcome parameters.,0,0,N,N,N,N,N,0,N,0,0
226,"For this reason, randomized controlled clinical trials are essential to assess the efficacy of CXL properly.",0,0,N,N,N,N,N,0,N,0,0
227,Long-term studies also are necessary given the natural history of the disease and to monitor the persistence of the CXL effect.,0,0,N,N,N,N,N,0,N,0,0
228,"Overall, the results of this randomized controlled trial of CXL continue to support the efficacy of this treatment in progressive keratoconus, with an improvement in Kmax, UCVA, and BSCVA 36 months after CXL and progression of these parameters in the control eyes over the same period.",0,0,N,N,N,N,N,0,N,0,0
229,"Furthermore, the risks associated with the procedure seem to be minor relative to the morbidity of advanced disease.",0,0,N,N,N,N,N,0,N,0,0
230,The findings of this study suggest that CXL should continue to be considered as a treatment option for patients with progressive keratoconus.,0,0,N,N,N,N,N,0,N,0,0