Sentence-ID,Sentence-String,Q1,Q2,Q3,Q4,Q5,Q6,Q7,Q8,Q9,Q10,Q11
158,"Lip and tongue movement: Data were distributed as a DVD‐Video disc, viewed together by raters on a video projector and sound system.",0,0,0,0,0,0,0,0,0,0,0
159,"Each response was viewed twice, with 5‐s gaps.",0,0,0,0,0,0,0,0,0,0,0
160,The relevant FDA‐2 scoring descriptors were used to rate performance.,0,0,0,0,0,0,0,0,0,0,0
161,"Training included full consideration of these descriptors, and practice followed by discussion, using three samples representing varied severities.",0,0,0,0,0,0,0,0,0,0,0
162,"Consistent with the direction given in the test manual, raters were instructed to apply the ‘best fit’ rating.",0,0,0,0,0,0,0,0,0,0,0
163,Breaks were taken after each set of five or six samples.,0,0,0,0,0,0,0,0,0,0,0
164,Items from the practice samples were reviewed at several points during the rating process.,0,0,0,0,0,0,0,0,0,0,0
165,"Intra‐class correlations across the data for SETs 1 and 2 respectively were 0.88, F = 8.01, p < 0.001; and 0.92, F = 11.74, p < 0.001.",0,0,0,0,0,0,0,0,0,0,0
166,Mean rater scores were utilized for data reporting and analysis.,0,0,0,0,0,0,0,0,0,0,0
167,Self‐rated communicative effectiveness: Participants’ totals on CES were tallied by one researcher.,0,0,0,0,0,0,0,0,0,0,0
168,A second researcher independently tallied 40% of the data.,0,0,0,0,0,0,0,0,0,0,0
169,Participants’ views of the programme,0,0,0,0,0,0,0,0,0,0,0
170,A post‐intervention anonymous evaluation (AE) questionnaire was issued to participants following the final intervention session.,0,0,0,0,0,0,0,0,0,0,0
171,The intervention therapist was not involved in this nor did she see the returns.,0,0,0,0,0,0,0,0,0,0,0
172,"No validated measure was available that would provide informative study‐specific anonymous feedback, so a questionnaire was modelled on that used in a previous stroke dysarthria intervention study.",0,0,0,0,0,0,0,0,0,0,0
173,"It comprised (1) 15 statements on therapy sessions and results, for response on a one to five scale (1 = strongly disagree; 2 = disagree; 3 = neither agree nor disagree; 4 = agree; 5 = strongly agree); (2) 12 suggested programme improvements, using a ‘tick all that apply’ response, covering session difficulty, pace, length, number, amount of content and of home practice; (3) a question on preferred therapy location; and (4) two open questions requesting further suggestions for programme improvement and ‘anything else you would like to tell us’.",0,0,0,0,0,0,0,0,0,0,0
174,Group equivalence at A1 (n = 39) was measured by t‐tests and for categorical data by chi‐square.,0,0,0,0,0,0,0,0,0,0,0
175,Assessment point and group effects were examined by analysis of variance (ANOVA) (n = 32).,0,0,0,0,0,0,0,0,0,0,0
176,"Where across assessment variance was established, assessment point pairwise comparisons were used, with Bonferroni adjustments applied.",0,0,0,0,0,0,0,0,0,0,0
177,"Analysis was also carried out with results imputed for the seven additional cases with incomplete intervention and/or post‐intervention assessments, by last observation carried forward and multiple imputation.",0,0,0,0,0,0,0,0,0,0,0
178,Association between amount of practice and A2/A3 performance change was examined by Pearson tests.,0,0,0,0,0,0,0,0,0,0,0
179,The target number of 50 participants had been agreed with collaborating SLT managers as a realistic aim within a 1‐year period.,0,0,0,0,0,0,0,0,0,0,0
180,Identification and recruitment strategy was active: a research assistant at the university base liaised with the local collaborators and followed up all leads.,0,0,0,0,0,0,0,0,0,0,0
181,"Initially four health boards were involved, and two more distant locations were later added, alongside a 4‐month extension of the recruitment period.",0,0,0,0,0,0,0,0,0,0,0
182,"As participants were seen at home, some travelling distances for assessor and intervention therapist were more than anticipated, the furthest being 87 miles from base.",0,0,0,0,0,0,0,0,0,0,0
183,"From 121 individuals, whose clinical records suggested suitability for the project, 58 were excluded because they were not contactable, unwell or frail, did not meet criteria, were not interested or for whom social or work circumstances or inconvenience precluded participation.",0,0,0,0,0,0,0,0,0,0,0
184,"Similar reasons, with the exception of contact failure, applied to a further 24 who were excluded after the sending of recruitment literature.",0,0,0,0,0,0,0,0,0,0,0
185,"Thirty‐six people completed the intervention programme and 32 (Group A: 16; Group B: 16) completed to final assessment, 8 weeks after intervention (figure 1).",0,0,0,0,0,0,0,0,0,0,0
186,There was no movement from one group to another.,0,0,0,0,0,0,0,0,0,0,0
187,Two participants from each group missed one session each.,0,0,0,0,0,0,0,0,0,0,0
188,Attrition was within the 20% projection and was mainly due to ill‐health.,0,0,0,0,0,0,0,0,0,0,0
189,Fidelity to intervention protocol was monitored by a member of the research team during two sessions with each of six participants representing four health boards.,0,0,0,0,0,0,0,0,0,0,0
190,"Intervention consistent with protocol was verified, in relation to time distribution within sessions, therapy materials, and appropriate inclusion of modelling, practice opportunities, feedback, reinforcement, verbal reward, review, response correction, encouragement, communication maximization strategies, and achievement of 80% threshold success on stimulus sets before progression.",0,0,0,0,0,0,0,0,0,0,0
191,Records of practice were obtained from the 32 participants who completed through to A4.,0,0,0,0,0,0,0,0,0,0,0
192,"The total amount of time recorded for practice varied greatly (range = 0–4482 min, mean (SD) = 1559 (1300.58).",0,0,0,0,0,0,0,0,0,0,0
193,A total of 19/32 (59%) completed at least the recommended practice total of 1050 min (30 min × 5 days a week × 7 between‐session weeks).,0,0,0,0,0,0,0,0,0,0,0
194,"Four participants recorded less than 1 h in total throughout the programme, whereas five people exceeded 3000 min.",0,0,0,0,0,0,0,0,0,0,0
195,"Although Group B, with three practice conditions rather than the two conditions for Group A, had a higher mean total practice minute score (figure 2), the difference did not approach significance.",0,0,0,0,0,0,0,0,0,0,0
196,"Groups A and B did not differ in practice totals across all conditions (t(30) = –0.90, p = 0.38), nor in totals for word and sentences stimuli (t(30) = 0.70, p = 0.49), nor conversation (t(30) = 0.80, p = 0.43).",0,0,0,0,0,0,0,0,0,0,0
197,"Correlations of total practice and A2/A3 score changes on the four outcome measures were not significant, with the exception of FDA‐2 (SIT: r = 0.02, p = 0.92; CES: r = 0.17, p = 0.35; CEM: r = 0.25, p = 0.16; FDA‐2: r = 0.38, p = 0.03).",0,0,0,0,0,0,0,0,0,0,0
198,"For the Group B who carried out NSOMExs, correlation of A2/A3 score change on FDA‐2 (tongue and lip status) and total time recorded for NSOMExs practice did not reach significance (r = 0.39, p = 0.14).",0,0,0,0,0,0,0,0,0,0,0
199,Total practice between sessions.,0,0,0,0,0,0,0,0,0,0,0
200,Participants’ views of the programme,0,0,0,0,0,0,0,0,0,0,0
201,Thirty‐four participants returned the AE.,0,0,0,0,0,0,0,0,0,0,0
202,Responses to the 15 statements indicated high satisfaction with the programme and its outcome.,0,0,0,0,0,0,0,0,0,0,0
203,Few responses were not ‘strongly agree’ or ‘agree’.,0,0,0,0,0,0,0,0,0,0,0
204,A total of 82% thought their speech had improved and 88% felt they were more confident in communication.,0,0,0,0,0,0,0,0,0,0,0
205,A total of 82% had been able to carry out the home practice.,0,0,0,0,0,0,0,0,0,0,0
206,The usefulness of the DVD was confirmed in that 82% found it helpful and 76% found it easy to use.,0,0,0,0,0,0,0,0,0,0,0
207,A total of 73% found the practice diary easy to complete.,0,0,0,0,0,0,0,0,0,0,0
208,"In relation to the content of sessions, only one participant reported that the sessions had not met expectations.",0,0,0,0,0,0,0,0,0,0,0
209,"Over 85% respondents thought the activities useful, at an appropriate level of difficulty and pace.",0,0,0,0,0,0,0,0,0,0,0
210,"Excepting one non‐respondent, all thought they had been given enough feedback by a helpful and well prepared SLT.",0,0,0,0,0,0,0,0,0,0,0
211,A total of 76% thought the sessions included enough practice.,0,0,0,0,0,0,0,0,0,0,0
212,Further details are given in figure 3.,0,0,0,0,0,0,0,0,0,0,0
213,Anonymous evaluations (AEs): responses to statements.,0,0,0,0,0,0,0,0,0,0,0
214,"For the 12 suggested improvements to the programme, the largest responses were ‘have more sessions’ (56%), ‘give more home practice’ (44%), ‘make sessions more difficult’ (32%) and ‘make sessions longer’ (32%).",0,0,0,0,0,0,0,0,0,0,0
215,All other responses were from few individuals.,0,0,0,0,0,0,0,0,0,0,0
216,No one thought there should be fewer sessions or less home practice.,0,0,0,0,0,0,0,0,0,0,0
217,No suggestions for improvement additional to those provided were offered.,0,0,0,0,0,0,0,0,0,0,0
218,The domestic situation was preferred over hospital‐based therapy by 73% and 15% had no preference.,0,0,0,0,0,0,0,0,0,0,0
219,"The final open question of ‘anything else you would like to tell us’ produced only positive remarks about the sessions, their enjoyment and usefulness, the SLT and belief that improvements had occurred e.g.",0,0,0,0,0,0,0,0,0,0,0
220,"‘Friends and family have commented on how my speech has improved as I now take my time and any difficult words I break them down which I have learned through this programme.’ One respondent endorsed the individualization of practice stimuli and another indicated that he/she continued to practise: ‘We felt the sessions were more useful when the sentences, words and phrases were interesting to the participant’; and ‘I thought the idea was good and has helped my speech.",0,0,0,0,0,0,0,0,0,0,0
221,"I am looking forward to improving each week as I practise more and more.’ Two respondents conveyed a need for SLT feedback: ‘Speech practice alone is no good without an SLT's feedback—this is one of the main benefits of SLT’; and ‘There is no benefit in tongue exercises if you don’t get any feedback.’ One respondent referred to the usefulness of the DVD: ‘I found it helpful to practise along with the DVD, imitating the speech models presented on it.’",0,0,0,0,0,0,0,0,0,0,0
222,Participant status on outcome measures,0,0,0,0,0,0,0,0,0,0,0
223,"Group A (n = 20) and Group B (n = 19) performance was equivalent at A1 on all outcome measures: SIT t(37) = –0.69, p = 0.49, CEM t(37) = –1.18, p = 0.25, CES t(37) = 0.55, p = 0.59, FDA‐2 t(37) = –1.05, p = 0 .30.",0,0,0,0,0,0,0,0,0,0,0
224,"Figure 4 shows performance of Group A (n = 16) and Group B (n = 16), and the combined groups on the four measures (n = 32) at the four assessment points.",0,0,0,0,0,0,0,0,0,0,0
225,Mean scores at assessments 1–4.,0,0,0,0,0,0,0,0,0,0,0
226,"Group A versus Group B difference was not indicated on any of the four measures, based on data for 32 completing participants: SIT F(1, 30) = 1.46, p = 0.24; CEM F(1, 30) = 2.39, p = 0.13, CES F(1, 30) = 0.58, p = 0.45; FDA‐2 F(1, 30) = 2.61, p = 0.12.",0,0,0,0,0,0,0,0,0,0,0
227,"There was no significant interaction between group allocation and assessment point on any of the four measures for these participants: SIT F(3, 90) = 0.88, p = 0.97; CEM F(3, 90) = 0.34, p = 0.80; CES F(3, 90) = 0.16, p = 0.92; FDA F(3, 90) = 0.12, p = 0.95.",0,0,0,0,0,0,0,0,0,0,0
228,"In view of the scale nature of the CEM measure, non‐parametric analysis was also undertaken and provided similar results.",0,0,0,0,0,0,0,0,0,0,0
229,"Imputation of results for seven additional cases with incomplete intervention and/or post‐intervention assessments, by last observation carried forward and multiple imputation provided similar results for all measures.",0,0,0,0,0,0,0,0,0,0,0
230,"Whole sample (n = 32) variance across assessment points was demonstrated for all measures, except SIT.",0,0,0,0,0,0,0,0,0,0,0
231,"SIT F(3,90) = 1.02, p = 0.39, CEM F(3,90) = 8.87, p < 0.001, CES F(3, 90) = 21.70, p < 0.001, FDA‐2 F(3, 90) = 10.34, p < 0.001.",0,0,0,0,0,0,0,0,0,0,0
232,"Pairwise comparison of assessment points for CEM, CES and FDA‐2 were justified.",0,0,0,0,0,0,0,0,0,0,0
233,"Table 4 shows significance levels, with Bonferroni correction, effect sizes and 95% confidence intervals.",0,0,0,0,0,0,0,0,0,0,0
234,"For all three measures, performance did not change significantly across non‐intervention periods (A1/A2 and A3/A4).",0,0,0,0,0,0,0,0,0,0,0
235,"CEM and CES showed significant gains across the intervention period (A2/A3), between A2 and A4 and also between A1 and A4.",0,0,0,0,0,0,0,0,0,0,0
236,The intervention period effect size was small for the CEM and at the high end of medium for CES.,0,0,0,0,0,0,0,0,0,0,0
237,"For FDA‐2 performance across the intervention period (A2/A3) did not change, but significant gains were present between A2 and A4 and A1 and A4, the latter with a medium effect size.",0,0,0,0,0,0,0,0,0,0,0
238,"Assessment point pairwise comparisons: CEM, CES and FDA‐2",0,0,0,0,0,0,0,0,0,0,0
239,"Because of the close relationship between the FDA‐2 tasks and the NSOMExs in the Group B intervention, Groups A and B were examined separately on this measure.",0,0,0,0,0,0,0,0,0,0,0
240,"This confirmed significant A1/A4 change for both groups (Group A t(15) = –3.947, p < 0.01; Group B, t(15) = –3.551 p < 0.05).",0,0,0,0,0,0,0,0,0,0,0
241,No other pairwise comparisons were significant.,0,0,0,0,0,0,0,0,0,0,0
242,"To examine further the results for the two measures (SIT and FDA‐2) for which an intervention effect was not indicated, A2/A3 results were inspected for high and low scorers.",0,0,0,0,0,0,0,0,0,0,0
243,For SIT at A2 21 participants scored above and 11 below the sample mean (76%).,0,0,0,0,0,0,0,0,0,0,0
244,The A2 and A3 means (SD) respectively were 93.52(4.43) and 92.86 (6.61) for high scorers and 43.55 (24.18) and 52.91 (29.45) for low scorers.,0,0,0,0,0,0,0,0,0,0,0
245,"For the high scoring subgroup there was no A2/A3 gain: (t(20) = 0.46, p = 0.65, CI = –2.39 to 3.72).",0,0,0,0,0,0,0,0,0,0,0
246,"For the lower subgroup change was significant (t(10) = –3.12, p = 0.01, CI = –16.05, –2.68).",0,0,0,0,0,0,0,0,0,0,0
247,The data and results suggest that a ceiling effect may contribute to the non‐variance of SIT scores across assessment points.,0,0,0,0,0,0,0,0,0,0,0
248,This subgroup comprised seven Group A and four Group B members.,0,0,0,0,0,0,0,0,0,0,0
249,For FDA‐2 at A2 20 participants scored above and 12 below the sample mean (38.22/54).,0,0,0,0,0,0,0,0,0,0,0
250,The A2 and A3 means (SD) respectively were 43.43 (3.16) and 43.00 (3.60) for high scorers and 29.53 (4.91) and 32.89 (6.00) for low scorers.,0,0,0,0,0,0,0,0,0,0,0
251,"For the high scoring subgroup there was no A2/A3 gain; (t(19) = 0.61, p = 0.55, CI = –1.06, 1.92).",0,0,0,0,0,0,0,0,0,0,0
252,"For the lower subgroup change was significant (t(11) = –2.36, p = 0.04, CI = –6.50, –0.22).",0,0,0,0,0,0,0,0,0,0,0
253,This subgroup comprised seven Group A and five Group B members.,0,0,0,0,0,0,0,0,0,0,0
254,The behavioural management provided was positively received by the dysarthric stroke population and the evidence of benefit includes both external measures and participant evaluation.,0,0,0,0,0,0,0,0,0,0,0
255,The inclusion of NSOMExs in the intervention programme did not appear to provide additional benefit.,0,0,0,0,0,0,0,0,0,0,0
256,"The results presented contribute to the limited literature on outcome of SLT intervention for post‐stroke dysarthria and should be viewed in the context of the sample size, the content and amount of intervention and the outcome measures used.",0,0,0,0,0,0,0,0,0,0,0
257,"A feasibility study design, rather than a fully powered trial, was appropriate to the current state of progress of intervention research for chronic post‐stroke dysarthria.",0,0,0,0,0,0,0,0,0,0,0
258,Participants were randomized into groups that differed only in respect of the inclusion of NSOMExs.,0,0,0,0,0,0,0,0,0,0,0
259,The same amount of therapy time was provided to both groups by a single SLT.,0,0,0,0,0,0,0,0,0,0,0
260,There was not a non‐intervention control group.,0,0,0,0,0,0,0,0,1,0,0
261,"The inclusion of non‐intervention periods, equal in length to the intervention period, allowed evaluation of participant status on the outcome measures with and without intervention.",0,0,0,0,0,0,0,0,0,0,0
262,Feasibility and participant feedback,0,0,0,0,0,0,0,0,0,0,0
263,"Feasibility is considered in relation to recruitment, retention and engagement, delivery of and adherence to the intervention protocol, and suitability of outcome measures.",0,0,0,0,0,0,0,0,0,0,0
264,"Recruitment, retention and engagement",0,0,0,0,0,0,0,0,1,0,0
265,Recruitment was lower and slower than projected.,0,0,0,0,0,0,0,0,0,0,0
266,"Even with extension of the recruitment period and inclusion of two further, more distant, health boards, the enrolled number was 20% below target.",0,0,0,0,0,0,0,0,0,0,0
267,From the original 121 identifications 32% were enrolled to the study and allocated to an intervention group.,0,0,0,0,0,0,0,0,0,0,0
268,There were then two stages of exclusion: 48% of those whose records indicated suitability were not sent recruitment literature and 38% of those who were sent literature were not enrolled.,0,0,0,0,0,0,0,0,0,0,0
269,"Taking these two stages together, a high number of exclusions related to poor health and this is not unexpected in a stroke population.",0,0,0,0,0,0,0,0,0,0,0
270,"An equally high proportion of exclusions were due to non‐fulfilment of inclusion criteria, such as speech standard now being good, diagnosis of additional neurological disease or cognitive deficit, hospital residence or markedly poor vision or hearing.",0,0,0,0,0,0,0,0,0,0,0
271,A relatively small number of people on initial contact indicated that they were not interested in participating and further people declined after receiving the participant information sheet.,0,0,0,0,0,0,0,0,0,0,0
272,"This conformed to NHS ethical guidelines, and was formatted and worded appropriately for the population.",0,0,0,0,0,0,0,0,0,0,0
273,"In many cases we did not determine the reason for not wishing to join the study, but there were instances where speech was not a priority for the individual or he/she did not want to commit to the schedule of assessment and intervention.",0,0,0,0,0,0,0,0,0,0,0
274,"Consideration should be given in future research to seeking this information systematically from individuals who decline to participate, via anonymous questionnaires.",0,0,0,0,0,0,0,0,0,0,0
275,"For some people non‐participation was linked to personal and domestic situations, including work commitments and family member health or support factors.",0,0,0,0,0,0,0,0,0,0,0
276,"The recruitment experience showed that for a stroke dysarthria intervention study, even with a tenacious approach, it is likely that many apparently eligible people will not be enrolled, and for very varied reasons.",0,0,0,0,0,0,0,0,0,0,0
277,"Conducting further, larger scale research in this field would require a wider geographical radius.",0,0,0,0,0,0,0,0,0,0,0
278,"Consistency of approach, with one assessor and one intervention therapist carrying out all sessions, was a strength of the current study.",0,0,0,0,0,0,0,0,0,0,0
279,"Further training and monitoring steps are required to maintain such consistency across researchers in future, larger studies.",0,0,0,0,0,0,0,0,0,0,0
280,Attrition on health grounds is inevitable with stroke populations and the 18% attrition (three people during the intervention phase and four others before follow‐up) was as expected.,0,0,0,0,0,0,0,0,0,0,0
281,"Participant sustained engagement was indicated by there being no withdrawals or loss to follow‐up through reduction in interest, and very few missed sessions.",0,0,0,0,0,0,0,0,0,0,0
282,Further evidence of interest and engagement is provided from participant feedback (see below).,0,0,0,0,0,0,0,0,0,0,0
283,"It is likely that the domestic location, about which participants were almost unanimously positive, supported attendance.",0,0,0,0,0,0,0,0,0,0,0
284,The project does not inform on aspects of efficiency and economics of home versus hospital models and that is a topic for future research.,0,0,0,0,0,0,0,0,0,0,0
285,Also the participant sample represented broad spectra of age and time post‐stroke.,0,0,0,0,0,0,0,0,0,0,0
286,Evaluation of programme response with reference to these two potentially important variables was not appropriate in a study of this size.,0,0,0,0,0,0,0,0,0,0,0
287,Intervention protocol delivery and adherence,0,0,0,0,0,0,0,0,1,0,0
288,"Currently post‐stroke dysarthria research and practice guidelines do not inform on optimum dosage and duration of intervention, or amounts of independent practice.",0,0,0,0,0,0,0,0,0,0,0
289,A regime of eight once‐weekly sessions was consistent with previous behavioural intervention in post‐stroke dysarthria which reported positive outcomes.,0,0,0,0,0,0,0,0,0,0,0
290,"The people with dysarthria, family members and clinicians consulted when planning the project thought this appropriate and that recruitment and attrition may be affected by a longer programme length.",0,0,0,0,0,0,0,0,0,0,0
291,Via AE over half of the participants recommended having more sessions.,0,0,0,0,0,0,0,0,0,0,0
292,No one thought there should be fewer sessions.,0,0,0,0,0,0,0,0,0,0,0
293,"This feedback, and attrition being mainly related to health issues, indicates the course length was appropriate for many.",0,0,0,0,0,0,0,0,0,0,0
294,The effects of a longer and/or more intense programme are unknown.,0,0,0,0,0,0,0,0,0,0,0
295,"Outcomes associated with different dosage and duration of intervention, which is a current topic in aphasia research, requires to be viewed in conjunction with what is acceptable to and sustainable by the dysarthric stroke population.",0,0,0,0,0,0,0,0,0,0,0
296,"The programme of assessment and intervention was delivered to plan and we monitored and confirmed fidelity to protocol in relation to time management, session content and a broad range of behavioural intervention features.",0,0,0,0,0,0,0,0,0,0,0
297,Participant satisfaction with the sessions was demonstrated by the level of sustained attendance and also by AE responses.,0,0,0,0,0,0,0,0,0,0,0
298,"Session content was individualized to take account of not only dysarthria severity and the profile of affected speech sounds and contexts, but also to incorporate material of interest to participants, e.g.",0,0,0,0,0,0,0,0,0,0,0
299,song lyrics and scripture excerpts.,0,0,0,0,0,0,0,0,0,0,0
300,Endorsement of this approach is indicated by there being no disagreement in the AE that the ‘activities were useful for me’.,0,0,0,0,0,0,0,0,0,0,0
301,"Much pre‐session preparation was involved and in the AE there was unanimous agreement that ‘the therapist was well prepared’, ‘helpful’ and gave ‘enough feedback’.",0,0,0,0,0,0,0,0,0,0,0
302,Response agreement was high as regards the difficulty level of materials and the pacing of sessions.,0,0,0,0,0,0,0,0,0,0,0
303,"A strong majority thought there was enough practice in the sessions, though some participants felt they could have tackled more, and this was evident also in 26% agreement with the suggestion to ‘include more in each session’.",0,0,0,0,0,0,0,0,0,0,0
304,"Clinicians should discuss the amount of practice in sessions, at an early stage, and make relevant adjustments to optimize this for individuals.",0,0,0,0,0,0,0,0,0,0,0
305,Behavioural dysarthria therapy is practice based and between‐session practice typically is a component of management programmes.,0,0,0,0,0,0,0,0,0,0,0
306,"Structured practice, to supplement the SLT led sessions was recommended for two to three short periods (10–15 min) for each of 5 days each week.",0,0,0,0,0,0,0,0,0,0,0
307,"There was much variation in amounts of practice recorded, and its distribution across word and sentence stimuli, conversation, and NSOMExs (Group B).",0,0,0,0,0,0,0,0,0,0,0
308,"The data do not indicate any quantifiable relationship between group membership, practice and improved outcome.",0,0,0,0,0,0,0,0,0,0,0
309,"According to the AE only a few people had been unable to carry out the home practice but the diary records indicate that over 40% did not complete the recommended amount, although the importance of adhering to the home practice schedule was regularly emphasized by the intervention SLT and the participants appeared well motivated.",0,0,0,0,0,0,0,0,0,0,0
310,No one agreed with the AE suggestion that there should be less home practice and over 40% agreed that more home practice should be provided.,0,0,0,0,0,0,0,0,0,0,0
311,"As with amount of session content, clinicians should gauge the extent of practice appropriate for individuals and be flexible in their approach to this.",0,0,0,0,0,0,0,0,0,0,0
312,(2013) similarly reported variation in attitude to home practice in the Living with Dysarthria group programme.,0,0,0,0,0,0,0,0,0,0,0
313,"The availability of a practice partner appeared to be influential, leading Mackenzie et al.",0,0,0,0,0,0,0,0,0,0,0
314,(2013) to suggest volunteer assistance to maximize home practice.,0,0,0,0,0,0,0,0,0,0,0
315,A total of 36% of the participants in the current study lived alone and involving volunteers in between‐session practice should be considered.,0,0,0,0,0,0,0,0,0,0,0
