Sentence-ID,Sentence-String,Q1,Q2,Q3,Q4,Q5,Q6,Q7,Q8,Q9,Q10,Q11
316,"Some people find it difficult to maintain records of practice and there may be reason to question the reliability of the records, although according to the AEs a strong majority found the practice diary easy to complete.",0,0,0,0,0,0,0,0,0,0,0
317,The intervention SLT reported that some participants were vague about independent practice amounts and some needed assistance to complete records retrospectively.,0,0,0,0,0,0,0,0,0,0,0
318,We learned the importance of full engagement of available family.,0,0,0,0,0,0,0,0,0,0,0
319,Volunteers might assist in maintaining records as well as in carrying out practice.,0,0,0,0,0,0,0,0,0,0,0
320,"The practice records inform only on the amount of time individuals reported that they spent practising, and not on how they approached this and with what success.",0,0,0,0,0,0,0,0,0,0,0
321,The gathering of such valuable information would be facilitated by the full involvement of a practice partner.,0,0,0,0,0,0,0,0,0,0,0
322,"To aid home practice a DVD was given, and used also in the sessions.",0,0,0,0,0,0,0,0,0,0,0
323,"This demonstrated clear, careful articulation and for Group B included the NSOMExs.",0,0,0,0,0,0,0,0,0,0,0
324,"As we anticipated, the DVD format was difficult to use for some less fit people who lived alone, and some were unable to use it consistently.",0,0,0,0,0,0,0,0,0,0,0
325,"Nevertheless three‐quarters of respondents agreed this material ‘was easy to use’, and an even higher proportion thought it was helpful.",0,0,0,0,0,0,0,0,0,0,0
326,We conclude that for many people this is a useful adjunct to written format materials.,0,0,0,0,0,0,0,0,0,0,0
327,Suitability of outcome measures,0,0,0,0,0,0,0,0,0,0,0
328,We aimed to obtain outcome information that was relevant to everyday communication.,0,0,0,0,0,0,0,0,0,0,0
329,"The SIT, CEM and CES are concerned with intelligibility and effectiveness of connected speech and the CES provides the perspective of the person with dysarthria.",0,0,0,0,0,0,0,0,0,0,0
330,"In contrast to these three measures that have face validity as regards how much of speech is understood and how effective communication is, the lip and tongue tasks from FDA‐2 inform on movements and their rate and were included because lip and tongue movements were practised by one participant group.",0,0,0,0,0,0,0,0,0,0,0
331,"Informal feedback from the assessor indicates that these measures, including the use of audio and video, which were necessary for data analysis, were acceptable to the participants and the time involved, at an average of 45 min on each occasion, was not excessive.",0,0,0,0,0,0,0,0,0,0,0
332,"The FDA‐2, SIT and CES are widely used in dysarthria and are validated and standardized measures.",0,0,0,0,0,0,0,0,0,0,0
333,"The CEM is an informal measure, used in the absence of a reputable single external rating of communication effectiveness, applicable to the stroke dysarthria population.",0,0,0,0,0,0,0,0,0,0,0
334,Standardization and validation testing are required.,0,0,0,0,0,0,0,0,0,0,0
335,We detected a possible ceiling effect for SIT scores for this population.,0,0,0,0,0,0,0,0,0,0,0
336,"Scores may have been inflated by the volume normalization applied in the data editing process and by listeners being graduating speech SLTs, who were permitted to select and adjust playback volume.",0,0,0,0,0,0,0,0,0,0,0
337,These decisions were made because all data were collected in participants’ homes and we wished to avoid ratings being negatively affected by issues which were reflective of recording rather than patient status.,0,0,0,0,0,0,0,0,0,0,0
338,"Although every effort was made to keep conditions constant there were inevitably occasions where individual circumstances and conditions, such as posture and background noise affected recordings.",0,0,0,0,0,0,0,0,0,0,0
339,Collecting data under laboratory conditions would allow more objective measurement.,0,0,0,0,0,0,0,0,0,0,0
340,Further consideration should also be given to the most appropriate indexes of intelligibility.,0,0,0,0,0,0,0,0,0,0,0
341,Miller (2013) points out that sensitivity may be increased by supplementary listener confidence or ease of listening ratings.,0,0,0,0,0,0,0,0,0,0,0
342,Also future research might add a measure that captures the impact of dysarthria.,0,0,0,0,0,0,0,0,0,0,0
343,"Several tools are in development, including Communicative Participation Item Bank, Dysarthria Impact Profile, and Living With Dysarthria questionnaire.",0,0,0,0,0,0,0,0,0,0,0
344,There was no apparent advantage on any of the four outcome measures for the participants whose intervention included NSOMExs.,0,0,0,0,0,0,0,0,0,0,0
345,"Thus this study provides no support for the inclusion of these exercises, as used in this programme, in SLT management of people with post‐stroke dysarthria.",0,0,0,0,0,0,0,0,0,0,0
346,To date no robust study has demonstrated speech gains attributable to NSOMExs.,0,0,0,0,0,0,0,0,0,0,0
347,"The results for the combined groups data indicate intervention related improvements in communication effectiveness, based on external rating of conversational samples and participants’ self‐ratings.",0,0,0,0,0,0,0,0,0,0,0
348,"The effect size for the self‐ratings, at just below large, shows that participants viewed themselves as more effective communicators following the programme and maintained this increased confidence with their communication two months after the end of the programme, suggesting a lasting effect.",0,0,0,0,0,0,0,0,0,0,0
349,"The effect size for the externally rated effectiveness measure, CEM, was lower, but here too the significant gain was maintained, indicating that this improved communication was not dependent on ongoing SLT input.",0,0,0,0,0,0,0,0,0,0,0
350,"SLT behavioural interventions comprise several interacting components, linked to participant, therapy and therapist.",0,0,0,0,0,0,0,0,0,0,0
351,"Variables relevant to this study included practice of individually selected word and sentence stimuli and conversation, both incorporating speech maximization strategies, a therapist with whom participants had favourable rapport, and also for Group B, NSOMExs.",0,0,0,0,0,0,0,0,0,0,0
352,"It is impossible to tease out the relative contributions of these factors in a feasibility study of this nature, but controls built into future research might include comparisons of outcomes associated with conversational practice only versus the specific stimuli plus conversational model used here.",0,0,0,0,0,0,0,0,0,0,0
353,Relevant also is input from a non‐SLT versus planning and provision by an experienced SLT.,0,0,0,0,0,0,0,0,0,0,0
354,'s (2012) results for the acute stroke population indicated no added benefit of SLT over social contact from an employed visitor.,0,0,0,0,0,0,0,0,0,0,0
355,Significant variance across assessment points was also evident for the FDA‐2 tasks.,0,0,0,0,0,0,0,0,0,0,0
356,However the absence of A2/A3 gain suggests no intervention effect but gradual changes over the assessment time period.,0,0,0,0,0,0,0,0,0,0,0
357,Assessment may be identifying slight ongoing improvements in tongue and lip activity.,0,0,0,0,0,0,0,0,0,0,0
358,"Also it is possible that there is some familiarity effect with this motor task, with participants feeling more comfortable with what initially may be perceived as strange demands.",0,0,0,0,0,0,0,0,0,0,0
359,These changes did not appear to be related to group allocation in that across assessment profiles of Group A and Group B were similar.,0,0,0,0,0,0,0,0,0,0,0
360,"Furthermore the low scoring group, for whom significant A2/A3 change was present, comprised members of both groups in almost equal numbers.",0,0,0,0,0,0,0,0,0,0,0
361,It would seem that the NSOMExs regime used in this study has no specific effect on the tongue and lip movement tasks of the FDA‐2.,0,0,0,0,0,0,0,0,0,0,0
362,"This challenges even the sceptical position on the use of NSOMExs in dysarthria that, while speech is not likely to improve, ability to do the exercises should improve .",0,0,0,0,0,0,0,0,0,0,0
363,The exercises were practised at an intensity that was consistent with clinical practice.,0,0,0,0,0,0,0,0,0,0,0
364,"The results do not inform on outcome that may be associated with high intensity repetitive practice, an approach which is thought to show promise for limb activity.",0,0,0,0,0,0,0,0,0,0,0
365,Future research might examine the outcome of high‐intensity practice with selected motivated participants who have the required stamina.,0,0,0,0,0,0,0,0,0,0,0
366,Intervention was not structured to adhere to motor learning principles concerning practice and feedback conditions.,0,0,0,0,0,0,0,0,0,0,0
367,"With the exception of one small randomized study of dysarthria in Parkinson's disease , which showed that skill retention is aided by low rather than high‐frequency feedback, the effects of the implementation of motor‐learning principles have not been explored in acquired dysarthria.",0,0,0,0,0,0,0,0,0,0,0
368,"Nevertheless, taken together with evidence from studies of healthy adults and apraxia of speech a motor learning approach is considered promising and worthy of further investigation.",0,0,0,0,0,0,0,0,0,0,0
369,"We considered whether intervention for the exercise group should comprise solely exercises, which might permit a purer comparison with speech treatment.",0,0,0,0,0,0,0,0,0,0,0
370,This was not acceptable to our clinical collaborators because of its inconsistency with usual practice.,0,0,0,0,0,0,0,0,0,0,0
371,Furthermore it would be difficult to achieve group parity of session length where intervention was limited to exercises.,0,0,0,0,0,0,0,0,0,0,0
372,"Given the significant improvements in effectiveness of communication and the intervention emphasis on clarity of articulation, the absence of parallel gains in the intelligibility measure was anomalous.",0,0,0,0,0,0,0,0,0,0,0
373,Dysarthria affects not only intelligibility but also dimensions such as naturalness and rate and while all had articulatory imprecision many participants entered the study with relatively good intelligibility.,0,0,0,0,0,0,0,0,0,0,0
374,A prevailing mild–moderate impairment level is documented in the literature on dysarthria in stroke.,0,0,0,0,0,0,0,0,0,0,0
375,The additional analysis of A2/A3 SIT results suggested a ceiling effect for this test in that change was significant in low‐scoring participants.,0,0,0,0,0,0,0,0,0,0,0
376,Participants’ positive views of outcome were further demonstrated via the AE.,0,0,0,0,0,0,0,0,0,0,0
377,Only one participant disagreed with the statement ‘I feel the sessions and practice helped my speech’ and four responded neutrally.,0,0,0,0,0,0,0,0,0,0,0
378,One strongly disagreed that ‘I feel the sessions and practice have made me more confident in communication’ and three responded neutrally.,0,0,0,0,0,0,0,0,0,0,0
379,"Thus from the CES and AE results, it may be concluded that the majority of participants thought the programme beneficial, rating themselves as having improved speech, being more confident in speech, and being more effective communicators in everyday functional situations.",0,0,0,0,0,0,0,0,0,0,0
380,This ‘participant voice’ strengthens the relevance of SLT to the management of post‐stroke dysarthria demonstrated in outcome measurement.,0,0,0,0,0,0,0,0,0,0,0
381,"SLT practice currently lacks the tested and validated patient experience tools which are widely used in primary healthcare, such as the Scottish Health and Care Experience Survey and the development of appropriate instruments is an important area for future research.",0,0,0,0,0,0,0,0,0,0,0
382,"Methods of collecting data to evaluate patient satisfaction such as focus groups, interviews and questionnaires, each have advantages and disadvantages.",0,0,0,0,0,0,0,0,0,0,0
383,"Questionnaires of the type used in this study have the benefits of convenience, anonymity and ease of completion and obviate the possibilities of fatigue and perceived confrontation which interviews may present, but do not permit detailed exploration of responses.",0,0,0,0,0,0,0,0,0,0,0
384,For example it would be informative to probe as to why the recommended amount of practice was not carried out and the perceived usefulness of the DVD.,0,0,0,0,0,0,0,0,0,0,0
385,"The use of more than one method may increase the richness, completeness and robustness of information.",0,0,0,0,0,0,0,0,0,0,0
386,"We will be separately reporting on a subgroup of participants who took part in individual interviews, the data from which may provide further insights into the therapeutic experience and the perceived value of the programme.",0,0,0,0,0,0,0,0,0,0,0
387,"As a disorder of the integrated motor speech system, dysarthria in stroke variably affects articulatory accuracy, but also respiration, phonation, resonance and prosody.",0,0,0,0,0,0,0,0,0,0,0
388,"Behavioural SLT intervention may therefore incorporate several areas in addition to articulatory accuracy, which were not directly targeted in this study, and which may impact on articulatory accuracy and evaluations of intelligibility and communicative effectiveness.",0,0,0,0,0,0,0,0,0,0,0
389,Future stroke intervention research may attend to a broader profile of impairment and incorporate outcome measures relevant to these.,0,0,0,0,0,0,0,0,0,0,0
390,This research confirms the feasibility of delivering and evaluating a randomized SLT trial in post‐stroke chronic dysarthria to examine and compare outcomes in groups where intervention includes and does not include NSOMExs.,0,0,0,0,0,0,0,0,0,0,0
391,"Although recruitment was below target, the study involved a higher number of participants than has previously been reported in post‐stroke dysarthria intervention research, and contributes to a limited evidence base for the relevance of behavioural intervention.",0,0,0,0,0,0,0,0,0,0,0
392,"The recruitment experience, with a strategy that was appropriately active and focused, indicates a future requirement for an approach that is not only multicentre but also widely based geographically.",0,0,0,0,0,0,0,0,0,0,0
393,The wide age span of the participant sample was representative of SLT caseloads and time post‐stroke was also diverse.,0,0,0,0,0,0,0,0,0,0,0
394,These variables would be controllable in a larger study.,0,0,0,0,0,0,0,0,0,0,0
395,Careful attention would be required to maintain and monitor consistency of approach across an increased number of assessors and intervention therapists.,0,0,0,0,0,0,0,0,0,0,0
396,"The study informs on outcomes associated with a small number of SLT sessions targeting articulatory precision, supplemented by a home practice regime.",0,0,0,0,0,0,0,0,0,0,0
397,"The significant post‐intervention gains in the effectiveness of communication during conversation, and in self‐ratings of situational effectiveness, maintained 2 months after the conclusion of the programme, were demonstrated on a background of pre‐intervention stability.",0,0,0,0,0,0,0,0,0,0,0
398,"The inclusion of NSOMExs, delivered in accordance with standard clinical practice, did not appear to influence outcomes.",0,0,0,0,0,0,0,0,0,0,0
399,There is a need to incorporate additional steps to maximize practice compliance in order to facilitate completion of the recommended amount of between‐session practise.,0,0,0,0,0,0,0,0,0,0,0
400,For able and motivated participants future research might examine the acceptability and effects of higher intensity and prolonged practice and an increased number of sessions.,0,0,0,0,0,0,0,0,0,0,0