Sentence-ID,Sentence-String,Q1,Q2,Q3,Q4,Q5,Q6,Q7,Q8,Q9,Q10,Q11
123,"If the initial response to atropine was more moderate (e.g., progression of 0.25–0.75 D in the second year), then one could consider continuing atropine 0.01% for a longer period until progression slows to <0.25 D per year, as it might do in the mid to late teens.",0,0,0,0,0,0,0,0,N,0,0
124,"However, there may be children who are poor responders to atropine.",0,0,0,0,0,0,0,0,N,0,0
125,"In phase 1, 9.3% of children in the 0.01% group, 6.4% of children in the 0.1% group, and 4.3% of children in the 0.5% group had myopia progression ≥1.5 D over the first 2 years of treatment.",0,0,0,0,0,0,0,0,N,0,0
126,"In children who respond poorly to atropine 0.01% (e.g., progress >0.75 D per year in the second year), it may be possible that they would also not respond to higher doses and that atropine should be stopped.",0,0,0,0,0,0,0,0,N,0,0
127,"An ultimate goal of myopia control therapy would be to slow myopic progression during the years of most active eye growth so that the eventual level of myopia was lower than if the eye was allowed to grow naturally (i.e., to reduce the incidence of high myopia).",0,0,0,0,0,0,0,0,N,0,0
128,"If less people developed high or pathologic myopia, then less might also develop the potentially blinding myopic complications, such as posterior staphyloma, macula choroidal neovascularization, retinal detachment, and glaucoma.",0,0,0,0,0,0,0,0,N,0,0
129,"In a recent review, pathologic myopia was estimated to have a global prevalence of 0.9% to 3.1% and to be the cause of low vision or blindness in 5.8% to 7.8% in European populations and 12.2% to 31.3% in East Asian populations.",0,0,0,0,0,0,0,0,N,0,0
130,"Given the increasing prevalence of myopia in East Asia, where the prevalence of myopia in young adults now approaches 80% and high myopia rates exceed 20%, it is thought that the disease burden and cost of pathologic myopia will continue to increase over time.",0,0,0,0,0,0,0,0,N,0,0
131,The availability of an effective and low-cost myopia-retarding medication such as atropine 0.01% is timely and could make both clinical and economic sense as a public health measure.,0,0,0,0,0,0,0,0,N,0,0
132,"The role of higher doses of atropine remains debatable, and care should be taken in stopping it suddenly, particularly in younger children.",0,0,0,0,0,0,0,0,N,0,0
133,"The strength of this study is in its randomized double-blind design, its relatively low loss to follow rate, and its long duration.",0,0,0,0,0,0,0,0,N,0,0
134,"Unfortunately, the lack of a control group in this study severely limited our ability to evaluate the full effect of atropine, necessitating comparison with historic and population-based data.",0,0,0,0,0,0,0,0,N,0,0
135,Further studies are still needed to determine how eye growth is altered in the long term in children treated with varying doses of atropine so as to better assess the true long-term efficacy and safety of this medication.,0,0,0,0,0,0,0,0,N,0,0