Sentence-ID,Sentence-String,Q1,Q2,Q3,Q4,Q5,Q6,Q7,Q8,Q9,Q10,Q11
0,Panretinal photocoagulation (PRP) is standard treatment for reducing severe visual loss from proliferative diabetic retinopathy (PDR).,0,0,0,0,N,0,0,0,0,0,0
1,"However, PRP can damage the retina, resulting in peripheral vision loss or worsening diabetic macular edema (DME).",0,0,0,0,N,0,0,0,0,0,0
2,Compare ranibizumab versus PRP for PDR.,0,0,0,0,N,0,0,0,0,0,0
3,"Randomized clinical trial (55 U.S. sites) assessing non-inferiority of ranibizumab compared with PRP for vision outcomes; 305 adults with PDR enrolled February-December 2012 (mean age 52, 44% female, 52% white).",0,0,0,0,N,0,0,0,0,0,0
4,Both eyes enrolled for 89 participants totaling 394 study eyes.,0,0,0,0,N,0,0,0,0,0,0
5,The final 2-year visit was completed January 2015.,0,0,0,0,N,0,0,0,0,0,0
6,"Ranibizumab group (N=191 eyes): intravitreous 0.5-mg ranibizumab and, PRP if treatment failed; ranibizumab as needed for DME.",0,0,0,0,N,0,0,0,0,0,0
7,PRP group (N=203 eyes): PRP; ranibizumab as needed for DME.,0,0,0,0,N,0,0,0,0,0,0
8,Primary: mean visual acuity change at 2 years (5-letter non-inferiority margin; intention-to-treat analysis).,0,0,0,0,N,0,0,0,1,0,0
9,"Secondary: visual acuity area under the curve, peripheral visual field loss, DME development, neovascularization, vitrectomy, and safety.",0,0,0,0,N,0,0,0,1,0,0
10,"Mean visual acuity letter improvement at 2 years was +2.8 in the ranibizumab group versus +0.2 in the PRP group (difference +2.2, 95% confidence interval [CI]: −0.5 to +5.0, non-inferiority <span class=""italic"">P</span>&lt;0.001).",0,0,0,0,N,0,0,0,0,0,0
11,"Mean treatment group difference in visual acuity area under the curve over 2 years was +4.2 (95% CI: +3.0 to +5.4, <span class=""italic"">P</span>&lt;0.001).",0,0,0,0,N,0,0,0,0,0,0
12,"Visual field sensitivity loss was worse (mean dB difference 372; 95% CI: 213 to 531, <span class=""italic"">P</span>&lt;0.001), vitrectomy more frequent (15% versus 4%, difference 9%, 95% CI: 4% to 15%, <span class=""italic"">P</span>&lt;0.001), and DME development more frequent (28% versus 9%, difference 19%, 95% CI: 10% to 28%, <span class=""italic"">P</span>&lt;0.001) in the PRP versus ranibizumab group, respectively.",0,0,0,0,N,0,0,0,0,0,0
13,"Eyes with neither active nor regressed neovascularization at 2 years was similar (35% [ranibizumab group] versus 30% [PRP group], difference 3%, 95% CI: −7% to 12%, <span class=""italic"">P</span>=0.58).",0,0,0,0,N,0,0,0,0,0,0
14,One eye (ranibizumab group) developed endophthalmitis.,0,0,0,0,N,0,0,0,0,0,0
15,No significant differences between groups in rates of major cardiovascular events were identified.,0,0,0,0,N,0,0,0,0,0,0
16,"Among eyes with PDR, treatment with ranibizumab resulted in visual acuity that was non-inferior to (not worse than) PRP treatment at two years.",0,0,0,0,N,0,0,0,0,0,0
17,"Although longer term follow-up is needed, ranibizumab may be a reasonable treatment alternative, at least through 2 years, for patients with PDR.",0,0,0,0,N,0,0,0,0,0,0
18,"Proliferative diabetic retinopathy (PDR) is a leading cause of vision loss in patients with diabetes mellitus,<sup><a href=""#R1"">1</a>, <sup><a href=""#R2"">2</a></sup></sup> resulting in 12,000 to 24,000 new cases of blindness each year in the United States.<sup><a href=""#R3"">3</a></sup> Without treatment, nearly 50% of patients with high-risk PDR experience severe vision loss within five years.<sup><a href=""#R4"">4",0,0,0,0,N,0,0,0,0,0,0
19,"Panretinal photocoagulation (PRP) has been the standard treatment for PDR since the Diabetic Retinopathy Study demonstrated its benefit nearly 40 years ago.<sup><a href=""#R4"">4</a></sup> PRP is effective, in part, because it reduces vascular endothelial growth factor (VEGF).<sup><a href=""#R5"">5</a></sup> In a 2014 survey, 98% of retina specialists reported using PRP for initial PDR management in the absence of DME.<sup><a href=""#R6"">6</a></sup> However, it can cause permanent peripheral visual field loss, decreased night vision, and may exacerbate diabetic macular edema (DME), which makes alternative treatments desirable.<sup><a href=""#R7"">7</a>–<sup><a href=""#R9"">9</a></sup></sup> Even with timely PRP, about 5% of eyes develop severe vision loss<sup><a href=""#R4"">4</a>, <sup><a href=""#R7"">7",0,0,0,0,N,0,0,0,0,0,0
20,"When used for diabetic macular edema (DME) treatment, intravitreous anti-VEGF agents reduce the risk of diabetic retinopathy worsening and increase the chance of improvement<sup><a href=""#R10"">10</a>–<sup><a href=""#R12"">12</a></sup></sup>, making these agents a potentially viable PDR treatment.",0,0,0,0,N,0,0,0,0,0,0
21,"Therefore, we conducted a randomized trial evaluating the non-inferiority of intravitreous ranibizumab compared with PRP for visual acuity outcomes in patients with PDR.",0,0,0,0,N,0,0,0,0,0,0
22,This multi-center randomized clinical trial was conducted by the Diabetic Retinopathy Clinical Research Network (DRCR.net) at 55 clinical sites in the United States.,0,0,0,0,N,0,0,0,0,0,0
23,"The study adhered to the tenets of the Declaration of Helsinki<sup><a href=""#R13"">13</a></sup> and was approved by multiple institutional review boards.",0,0,0,0,N,0,0,0,0,0,0
24,Study participants provided written informed consent.,0,0,0,0,N,0,0,0,0,0,0
25,An independent data and safety monitoring committee provided oversight.,0,0,0,0,N,0,0,0,0,0,0
26,The study protocol is available in the supplemental material.,0,0,0,0,N,0,0,0,0,0,0
27,"Study participants were at least 18 years old, had type 1 or type 2 diabetes, at least one eye with PDR, no previous PRP, and a best corrected visual acuity letter score ≥24 (approximate Snellen equivalent 20/320 or better).",1,0,0,1,N,0,0,0,0,0,0
28,Eyes with or without DME were eligible.,1,0,0,1,N,0,0,0,0,0,0
29,All eligibility criteria are in Table S1.,1,0,0,1,N,0,0,0,0,0,0
30,"Baseline demographics (<a href=""#T1"">Table 1</a>) demonstrated balance among treatment groups.",1,0,0,1,N,0,0,0,0,0,0
31,"Age was patient reported, gender was determined by study staff, and race/ethnicity (based on fixed categories) were either patient reported or determined by study staff.",1,0,0,1,N,0,0,0,0,0,0
32,A participant could have one or two eyes included in the study.,0,0,1,0,N,1,1,0,0,0,0
33,"Using the DRCR.net study website to conceal the next treatment allocation, using a permuted block design, participants with one study eye were randomly assigned with equal probability to either PRP with ranibizumab as needed for DME treatment (PRP group) or intravitreous-0.5 mg ranibizumab with PRP for treatment failure (ranibizumab group) (injection procedure: <a href=""http://drcrnet.jaeb.org/ViewPage.aspx?PageName=Investig_Info"">http://drcrnet.jaeb.org/ViewPage.aspx?PageName=Investig_Info</a>).",0,1,1,0,N,1,1,0,0,0,0
34,Participants with two study eyes had one eye assigned randomly to PRP and the other to ranibizumab (Table S1).,0,1,1,0,N,1,1,0,0,0,0
35,"The primary outcome visit was at 2 years, with follow-up planned through 5 years.",0,0,1,0,N,1,1,0,0,0,0
36,Only data through 2 years are reported.,0,0,1,0,N,1,1,0,0,0,0
37,"In both groups, visits occurred every 16 weeks.",0,0,0,0,N,0,0,0,0,0,0
38,Ranibizumab group participants had additional visits every 4 weeks during the first year and every 4 to 16 weeks during the second year depending on treatment (eFigure S1).,0,0,0,0,N,0,0,0,0,0,0
39,"At baseline and each follow-up visit, certified personnel obtained best corrected visual acuity using the Electronic-Early Treatment Diabetic Retinopathy Study (e-ETDRS) Visual Acuity Test<sup><a href=""#R14"">14</a></sup>.",0,0,0,0,N,0,0,0,0,0,0
40,"Spectral (96% of scans), or time-domain ocular coherence tomography (OCT), was performed at baseline, annually and as needed for DME treatment assessment.",0,0,0,0,N,0,0,0,0,0,0
41,Humphrey visual field testing (at select sites) on 30-2 and 60-4 patterns and digital fundus photographs were obtained at baseline and annually (Table S1).,0,0,0,0,N,0,0,0,0,0,0
42,Images and visual fields were graded by centralized reading centers when applicable (Table S1).,0,0,0,0,N,0,0,0,0,0,0
43,"At baseline and annually, participants with one study eye completed visual function questionnaires and binocular visual acuity testing with everyday correction (Table S1).",0,0,0,0,N,0,0,0,0,0,0
44,Adverse events were coded using the Medical Dictionary for Regulatory Activities (MedDRA).,0,0,0,0,N,0,0,0,0,0,0
45,Reading center graders and the medical monitor who reviewed all adverse events were masked to treatment assignments.,0,0,0,0,N,0,0,0,0,0,0
46,Visual acuity and OCT technicians were masked to treatment group assignments at annual visits.,0,0,0,0,N,0,0,0,0,0,0
47,"Study participants, investigators and study coordinators were not masked due to the nature of the treatments.",0,0,0,0,N,0,0,0,0,0,0
48,"In the ranibizumab group, study eyes received an injection for PDR at baseline and every 4 weeks through 12 weeks.",0,0,0,0,N,0,0,0,0,0,0
49,"Thereafter, retreatment was based on investigator assessment of neovascularization (NV) on extended ophthalmoscopy and any available retinal images.",0,0,0,0,N,0,0,0,0,0,0
50,Injections at 16 and 20 weeks were required unless all NV resolved.,0,0,0,0,N,0,0,0,0,0,0
51,"Starting at the 24-week visit, an injection was required every 4 weeks unless NV resolved or was stable (not improved or worsened) following 2-consectuive injections.",0,0,0,0,N,0,0,0,0,0,0
52,Injections resumed if NV worsened.,0,0,0,0,N,0,0,0,0,0,0
53,Injections for PDR could be performed at investigator discretion if not required.,0,0,0,0,N,0,0,0,0,0,0
54,PRP for PDR was permitted (eFigure S1) in the ranibizumab group for “failure” or “futility”.,0,0,0,0,N,0,0,0,0,0,0
55,"In the PRP group, PRP for PDR was initiated at baseline (see Table S1 for PRP procedure).",0,0,0,0,N,0,0,0,0,0,0
56,"If the NV size or amount increased following completion of PRP, additional PRP could be given.",0,0,0,0,N,0,0,0,0,0,0
57,"In both groups, vitrectomy for vitreous hemorrhage or retinal detachment was at investigator discretion, and could include intraoperative PRP.",0,0,0,0,N,0,0,0,0,0,0
58,DME was defined for the protocol as a thickened OCT central subfield (Table S1) at least 2 standard deviations beyond the gender-specific and instrument-specific norm for the population and a visual acuity letter score ≤78 (~Snellen equivalent 20/32 or worse).,0,0,0,0,N,0,0,0,0,0,0
59,Eyes not meeting both criteria were considered not to have DME for purposes of the protocol.,0,0,0,0,N,0,0,0,0,0,0
60,Eyes in both treatment groups with DME could receive ranibizumab provided by the study.,0,0,0,0,N,0,0,0,0,0,0
61,"At randomization, ranibizumab was required for eyes with DME.",0,0,0,0,N,0,0,0,0,0,0
62,"Otherwise, initiation and retreatment with ranibizumab for DME and application of focal/grid photocoagulation for DME was at investigator discretion.",0,0,0,0,N,0,0,0,0,0,0
63,"A follow-up visit and retreatment regimen for DME was provided as a guideline, melded with protocol retreatment and follow-up visits for PDR.<sup><a href=""#R15"">15",0,0,0,0,N,0,0,0,0,0,0
64,The primary outcome was mean change in visual acuity letter score from baseline to 2 years.,0,0,0,0,N,0,0,1,1,0,0
65,"Secondary efficacy outcomes included visual acuity area under the curve, change in visual field total point score, central subfield thickness change, DME development, and proportion of eyes without PDR on fundus photographs.",0,0,0,0,N,0,0,1,0,0,0
66,"Pre-specified adverse events related to diabetic retinopathy included vitreous hemorrhage, retinal detachment, vitrectomy, neovascular glaucoma, and iris neovascularization.",0,0,0,0,N,0,0,1,0,0,0
67,"Pre-specified additional safety outcomes assessed included endophthalmitis, ocular inflammation, cataract surgery, serious adverse events, hospitalizations, death, Antiplatelet Trialists’ Collaboration events, and events in each MedDRA system organ class.",0,0,0,0,N,0,0,1,0,0,0
68,"Sample size estimate for the primary outcome, change in visual acuity, was 380 eyes for a non-inferiority margin of 5 letters, type I error of 2.5% and 85% power (Table S1).",0,0,0,0,N,0,0,0,0,1,1
69,The non-inferiority hypothesis was tested by determining whether the one end of a 2-sided 95% confidence interval excluded the non-inferiority margin.,0,0,0,0,N,0,0,0,0,1,1
70,"If ranibizumab was found non-inferior to prompt PRP, the same 2-sided 95% confidence interval would be used to test ranibizumab superiority.",0,0,0,0,N,0,0,0,0,1,1
71,"The non-inferiority margin was selected, in part, because it was the same margin used in a prior trial evaluating anti-VEGF agents for neovascular age-related macular degeneration.<sup><a href=""#R16"">16</a></sup> The Protocol Development Committee (see Acknowledgments) believed a true difference exceeding 5.0 letters represented a clinically important difference.<sup><a href=""#R17"">17",0,0,0,0,N,0,0,0,0,1,1
72,The primary analysis for comparison between treatments of mean change in visual acuity followed the intention-to-treat principle and included all randomly assigned eyes with multiple imputation by the Markov chain Monte Carlo method to impute missing 2-year visual acuities.,0,0,0,0,N,0,0,0,0,1,1
73,"Imputation for 2-year visual acuities was based on treatment group, baseline visual acuity, baseline central subfield thickness, and all visual acuity data from the 16-weekly visits.",0,0,0,0,N,0,0,0,0,0,0
74,Within group means were based on observed data unless otherwise specified.,0,0,0,0,N,0,0,0,0,0,0
75,"Treatment group differences, confidence intervals, and p-values were estimated using analysis of covariance (ANCOVA), adjusting for baseline visual acuity and randomization stratification factors (baseline central subfield thickness and number of study eyes), with generalized estimating equations (GEE) used to account for correlation between eyes of participants contributing 2 eyes.",0,0,0,0,N,0,0,0,0,0,0
76,Outlying visual acuity changes were truncated to ±3 standard deviations from the mean.,0,0,0,0,N,0,0,0,0,0,0
77,"A per-protocol analysis was conducted excluding eyes not completing the 2-year visit, eyes without PDR on baseline fundus photographs, and eyes receiving alternate PDR treatment.",0,0,0,0,N,0,0,0,0,0,0
78,Model assumptions were evaluated and satisfied.,0,0,0,0,N,0,0,0,0,0,0
79,"Sensitivity analyses using transformations, including nonparametric Van der Waerden normal scores, were conducted.",0,0,0,0,N,0,0,0,0,0,0
80,"Pre-planned subgroup analyses repeated the primary ANCOVA, adding subgroup and subgroup by treatment interactions.",0,0,0,0,N,0,0,0,0,0,0
81,"Safety analyses and secondary efficacy analyses used binomial regression, ANCOVA, or the marginal Cox proportional hazards model as appropriate.<sup><a href=""#R18"">18</a>, <sup><a href=""#R19"">19</a></sup></sup> Within group means for secondary outcomes were based on observed data unless otherwise specified.",0,0,0,0,N,0,0,0,0,0,0
82,"Treatment group differences, confidence intervals, and p-values for secondary outcomes were based on the intention-to-treat cohort.",0,0,0,0,N,0,0,0,0,0,0
83,"<span class=""italic"">P</span> values and confidence intervals are two-sided unless otherwise specified.",0,0,0,0,N,0,0,0,0,0,0
84,"For the primary non-inferiority and superiority analyses, <span class=""italic"">P</span> values &lt;0.025 (one-sided) or &lt;0.05 (two-sided) were considered statistically significant.",0,0,0,0,N,0,0,0,0,0,0
85,"Analyses were performed using SAS, version 9.4 (SAS Institute).",0,0,0,0,N,0,0,0,0,0,0
86,"Between February and December 2012, 394 study eyes of 305 participants were assigned randomly to the ranibizumab group (N=191) or the PRP group (N=203).",0,0,0,0,N,0,0,0,0,0,0
87,"In the ranibizumab and PRP groups respectively, the median age was 52 (44, 59) and 51 (44, 59) years, 43% and 45% were women, and 52% and 50% were white.",0,0,0,0,N,0,0,0,0,0,0
88,"Among the eyes in the ranibizumab and the PRP groups, respectively, mean baseline visual acuity letter score was 75.0 (approximate Snellen equivalent 20/32) ±12.8 and 75.2 (approximate Snellen equivalent 20/32) ±12.5.",0,0,0,0,N,0,0,0,0,0,0
89,DME at baseline was present in 22% and 23%.,0,0,0,0,N,0,0,0,0,0,0
90,"Baseline characteristics of the 2 groups appeared similar (<a href=""#T1"">Table 1</a>).",0,0,0,0,N,0,0,0,0,0,0
91,"Excluding 14 deaths (including 4 participants with two study eyes), the 2-year visit completion rate was 88% and 86% in the ranibizumab and PRP groups, respectively (<a href=""#F1"">Figure 1</a>).",0,0,0,0,N,0,0,0,0,0,0
92,"The median (quartiles) number of visits was 22 (18, 24) in the ranibizumab group and 16 (9, 22) in the PRP group.",0,0,0,0,N,0,0,0,0,0,0
93,Table S2 reports baseline characteristics by 2-year visit completion status.,0,0,0,0,N,0,0,0,0,0,0
94,Ninety-seven percent of protocol-required injections based on clinician interpretation of NV were given.,0,0,0,0,N,0,0,0,0,0,0
95,"Eyes without DME at baseline (N=133) received a median (quartiles) of 7 (5, 9) injections through 1 year; eyes without DME at baseline (N=126) received a median of 10 (6, 13) injections through 2 years (Table S3).",0,0,0,0,N,0,0,0,0,0,0
96,"Eyes with DME at baseline (N=36) received 9 (7, 11) injections through 1 year; eyes with DME at baseline (N=33) received 14 (10, 17) injections through 2 years.",0,0,0,0,N,0,0,0,0,0,0
97,Focal/grid laser was performed in 15 eyes (8%).,0,0,0,0,N,0,0,0,0,0,0
98,"Through 2 years, 12 eyes (6%) received PRP including 8 during vitrectomy.",0,0,0,0,N,0,0,0,0,0,0
99,"All eyes received initial PRP, 98% received protocol-defined complete PRP (Table S4).",0,0,0,0,N,0,0,0,0,0,0
100,"After the completion of PRP, 92 (45%) eyes received additional PRP (median [quartiles] time from baseline to additional PRP was 221 [116, 386] days).",0,0,0,0,N,0,0,0,0,0,0
101,"In addition to PRP, 72 (35%) eyes received ranibizumab for DME at baseline; an additional 36 (18%) received ranibizumab for DME prior to 2 years (Table S5).",0,0,0,0,N,0,0,0,0,0,0
102,"Among eyes with baseline DME (N = 46), median (quartiles) number of injections for DME was 5 (3, 9) prior to 1 year and 9 (4, 15) prior to 2 years.",0,0,0,0,N,0,0,0,0,0,0
103,"Among eyes without baseline DME (N = 155) that were later treated for DME, median (quartiles) number of injections was 3 (1, 6) and 4 (2, 7) prior to 1 and 2 years, respectively.",0,0,0,0,N,0,0,0,0,0,0
104,Focal/grid laser was performed in 21 eyes (10%).,0,0,0,0,N,0,0,0,0,0,0
105,"At 2 years, mean visual acuity letter score improvement from baseline was +2.8 in the ranibizumab group and +0.2 in the PRP group.",0,0,0,0,N,0,0,0,0,0,0
106,"The mean treatment group difference was +2.2 (95% confidence interval [CI]: −0.5 to +5.0, non-inferiority <span class=""italic"">P</span>&lt;0.001, <a href=""#T2"">Table 2</a>).",0,0,0,0,N,0,0,0,0,0,0
107,This result met the pre-specified non-inferiority criterion (the lower bounds of the 95% CI of −0.5 letter was greater than the non-inferiority limit of −5.0 letters).,0,0,0,0,N,0,0,0,0,0,0
108,"Mean change in visual acuity letter score over 2 years (area under the curve) was +4.5 compared with −0.3 for the ranibizumab and PRP groups, respectively (mean difference= 4.2 ([95% CI: 3.0 to 5.4]; <span class=""italic"">P</span>&lt; 0.001, <a href=""#T2"">Table 2</a>, <a href=""#F2"">Figure 2</a>).",0,0,0,0,N,0,0,0,0,0,0
109,The difference between groups was greater at 1 year than at 2 years.,0,0,0,0,N,0,0,0,0,0,0
110,"Results were similar in per-protocol analyses limited to participants who completed 2-years (Figure S2, Table S6, treatment group difference +2.1 [95% CI: −0.5, +4.6]) or eyes with definite baseline PDR on fundus photographs (Table S6).",0,0,0,0,N,0,0,0,0,0,0
111,Results were similar when limiting analyses to participants with two study eyes (Table S7).,0,0,0,0,N,0,0,0,0,0,0
112,"Sensitivity analyses using cube transformation (one-sided test for superiority =0.006) and a nonparametric approach (one-sided test for superiority <span class=""italic"">P</span> =0.013) were similar to overall results (one-sided test for superiority <span class=""italic"">P</span>=0.053, Table S8).",0,0,0,0,N,0,0,0,0,0,0
113,"Slight differences in <span class=""italic"">P</span>-values likely were a result of transformations reducing skewness and thus increasing precision, however, <span class=""italic"">a priori</span>, the untransformed analysis was designated as primary.",0,0,0,0,N,0,0,0,0,0,0
114,"Percentages of eyes with ≥15 letter (Table S9) improvement or worsening (judged clinically relevant when visual acuity is moderately impaired<sup><a href=""#R17"">17</a></sup>) at 2 years and over time (Figure S3 and S4) were similar between the groups.",0,0,0,0,N,0,0,0,0,0,0
115,Percentages of eyes with ≥10 letter worsening (similarly judged clinically relevant when visual acuity is minimally impaired) also were similar.,0,0,0,0,N,0,0,0,0,0,0
116,"No significant interaction of treatment with pre-planned subgroups (Table S10) was identified except for a possible interaction of visual acuity and prior DME treatment (<span class=""italic"">P</span>=0.02).",0,0,0,0,N,0,0,0,0,0,0
117,"Among eyes with DME at baseline, mean change in visual acuity letter score differed between ranibizumab and PRP by +3.0 (95% CI: −4.2 to 10.3) and +1.4 (95% CI: −1.5 to 4.4; interaction <span class=""italic"">P</span> value = 0.84, Table S10, Table S11, <a href=""#F2"">Figure 2B</a>, and <a href=""#F2"">Figure 2C</a>) for eyes without baseline DME.",0,0,0,0,N,0,0,0,0,0,0
118,"At the 2-year visit, outcomes were better in the ranibizumab than the PRP group for binocular visual acuity (mean change from baseline +3.4±10.9 versus 0 ±11.8, respectively; difference 3.2 [95% CI: −0.3 to 6.1]; <span class=""italic"">P</span> = 0.03) and visual field (mean change, combining 30-2 and 60-4 total point score -23±410 dB versus −422±518 dB, respectively; mean difference 372 dB (95% CI: 213 to 531; <span class=""italic"">P</span> &lt;0.001), Table S12.",0,0,0,0,N,0,0,1,1,0,0
119,There were no statistically significant differences identified in the subscale scores for the National Eye Institute Visual Function Questionnaire-25 or University of Alabama-Birmingham Low Luminescence Questionnaire outcomes (Tables S13 and S14).,0,0,0,0,N,0,0,0,1,0,0
120,"At the 2-year visit, among eyes with baseline DME (N=68), central subfield thickness decreased, on average, by 153±129 μm in the ranibizumab group and by 48±124 μm in the PRP group receiving ranibizumab for DME (adjusted difference = −65μm; 95% CI: −126 to −4.5; <span class=""italic"">P</span>=0.035; Table S15).",0,0,0,0,N,0,0,0,0,0,0
121,"Among eyes without baseline DME, (N=242), mean change in central subfield thickness was −18±37 versus +10±54 (difference = −31μm; 95% CI: −41 to −21; <span class=""italic"">P</span>&lt;0.001, Table S15) while the cumulative probability of developing central DME with vision impairment by 2 years was 9% versus 28% (adjusted difference 19% more frequently in the PRP group, 95% CI: 10% to 28%, <span class=""italic"">P</span>&lt;0.001) in the ranibizumab and PRP groups, respectively (Figure S5).",0,0,0,0,N,0,0,0,0,0,0
122,Changes in retinal volume are in Table S16.,0,0,0,0,N,0,0,0,0,0,0
123,"A vitreous hemorrhage developed in 52 eyes (27%) within the ranibizumab group and 69 eyes (34%) within the PRP group (difference 7% more in the PRP group, 95% CI: 15% more in the PRP group to 1% more in the ranibizumab group, <span class=""italic"">P</span> = 0.09, <a href=""#T2"">Table 2</a>) and a retinal detachment occurred in 6% versus 10%, respectively (difference 4% more in the PRP group, 95% CI: 9% more in the PRP group to 1% more in the ranibizumab group, <span class=""italic"">P</span> = 0.08).",0,0,0,0,N,0,0,0,0,0,0
124,"A vitrectomy was performed in 8 (4%) versus 30 (15%) eyes in the ranibizumab and PRP groups, respectively (difference 9% more in the PRP group, 95% CI: 4% to 15% more in the PRP group, <span class=""italic"">P</span>&lt;0.001), including 2% versus 14% among the 302 eyes without baseline DME and 12% versus 17% among the 88 eyes with baseline DME.",0,0,0,0,N,0,0,0,0,0,0
125,Timing of events related to complications of PDR is in Table S17.,0,0,0,0,N,0,0,0,0,0,0
126,Rates of neovascular glaucoma were 2% in the ranibizumab group and 3% in the PRP group.,0,0,0,0,N,0,0,0,0,0,0
127,New iris neovascularization was 1% in both groups.,0,0,0,0,N,0,0,0,0,0,0
128,"Percentages of eyes without active or regressed neovascularization at the disc or elsewhere on fundus photographs (excluding PRP lesions) at 2 years was 35% among 142 eyes in the ranibizumab group and 30% among 148 eyes in the PRP group (difference 3%, 95% CI: −7% to 12%, <span class=""italic"">P</span>=0.58, <a href=""#T2"">Table 2</a>).",0,0,0,0,N,0,0,0,0,0,0
129,"At 2 years, 48% of eyes in the ranibizumab group improved by 2 or more steps in diabetic retinopathy severity on fundus photographs, an outcome not assessable after PRP.",0,0,0,0,N,0,0,0,0,0,0
130,"Injection-related endophthalmitis occurred in one eye (0.5%) in the ranibizumab group and no eyes in the PRP group (0.04% of 2,581 total injections, 0.33% among the 299 eyes receiving ranibizumab).",0,0,0,0,N,0,0,0,0,0,0
131,"Ocular inflammation excluding endophthalmitis was reported in 2 (1%) and 9 (4%) eyes in the ranibizumab and PRP groups, respectively, (<span class=""italic"">P</span> = 0.02).",0,0,0,0,N,0,0,0,0,0,0
132,"Cataract extraction occurred in 4 (2%) and 12 (6%), respectively (<span class=""italic"">P</span> = 0.06).",0,0,0,0,N,0,0,0,0,0,0
133,"Additional ocular events are reported in <a href=""#T3"">Table 3</a>.",0,0,0,0,N,0,0,0,0,0,0
