Sentence-ID,Sentence-String,Q1,Q2,Q3,Q4,Q5,Q6,Q7,Q8,Q9,Q10,Q11
134,"There were no significant differences identified between groups in the number of participants with a serious adverse event, hospitalization, death, Antiplatelet Trialists’ Collaboration arteriothromboembolic events (<a href=""#T3"">Table 3</a>),<sup><a href=""#R20"">20</a></sup> or events in each individual MedDRA system organ class (Table S18).",0,0,0,0,N,0,0,0,0,0,0
135,"However, differences with a <span class=""italic"">P</span> value slightly greater than the pre-specified cut point of <span class=""italic"">P</span>&lt;0.01 with fewer events in the PRP group were seen in 6 of 22 system organ classes of cardiac disorders (<span class=""italic"">P</span> = 0.01), endocrine disorders (<span class=""italic"">P</span> = 0.02), infections/infestations (<span class=""italic"">P</span> = 0.02), respiratory disorders (<span class=""italic"">P</span> = 0.04), skin and subcutaneous tissue disorders (P=0.03), and surgical and medical procedures (<span class=""italic"">P</span> = 0.01).",0,0,0,0,N,0,0,0,0,0,0
136,Table S19 lists all systemic adverse events.,0,0,0,0,N,0,0,0,0,0,0
137,"In this randomized clinical trial, intravitreous ranibizumab met the primary non-inferiority outcome of visual acuity change at 2 years being no worse than PRP for treatment of PDR.",0,0,0,0,N,0,0,0,0,0,0
138,"A statistically significant visual acuity difference between ranibizumab and PRP was not present at 2 years, recognizing that 53% of the PRP group received ranibizumab injections for DME.",0,0,0,0,N,0,0,0,0,0,0
139,"Ranibizumab resulted in better visual acuity when evaluated over the course of 2 years (area under the curve), although the clinical importance of this difference is unknown.",0,0,0,0,N,0,0,0,0,0,0
140,"More peripheral visual field loss occurred (95% CI difference: 213 dB to 531 dB), and more vitrectomies were performed in the PRP group compared with the ranibizumab group (95% CI difference: 4% to 15%).",0,0,0,0,N,0,0,0,0,0,0
141,"Among eyes without center-involved DME at baseline, development of DME with vision impairment was substantially more frequent in the PRP group (95% CI difference: 10% to 28%).",0,0,0,0,N,0,0,0,0,0,0
142,"Only 12 eyes (6%) in the ranibizumab group received PRP; more than half the eyes in the PRP group received ranibizumab for DME; thus, the protocol essentially tested ranibizumab for PDR versus PRP plus ranibizumab when needed for DME treatment.",0,0,0,0,N,0,0,0,0,0,0
143,No systemic safety concerns with ranibizumab were identified in the pre-specified major safety outcomes.,0,0,0,0,N,0,0,0,0,0,0
144,"Differences in MedDRA system organ classes of cardiac, endocrine, infections/infestations, respiratory, skin, or surgical disorders, while not confidently different, could be real, due to chance, or due to ascertainment bias since the ranibizumab group had more frequent visits than the PRP group.",0,0,0,0,N,0,0,0,0,0,0
145,Interpreting the safety findings is difficult since a large proportion of the PRP group received ranibizumab for DME.,0,0,0,0,N,0,0,0,0,0,0
146,"Rates of endophthalmitis or other injection-related serious adverse events were very low, consistent with other studies.<sup><a href=""#R21"">21</a>–<sup><a href=""#R23"">23",0,0,0,0,N,0,0,0,0,0,0
147,Several limitations related to the study design and conduct are important when interpreting these results.,0,0,0,0,N,0,0,0,0,0,0
148,Participant retention through two years (87% of those who had not died) was lower than desired.,0,0,0,0,N,0,0,0,0,0,0
149,"Although participants who completed the 2-year visit had slightly better baseline visual acuities than those who did not, no visual acuity differences between treatment groups with respect to the 2-year visit completion status were apparent, limiting the possibility of differential treatment bias.",0,0,0,0,N,0,0,0,0,0,0
150,"Considering the final visual acuity in the PRP group, but not in the ranibizumab group, was better for those who did vs. those who did not complete the 2-year visit, if bias was present, it likely favored the PRP group.",0,0,0,0,N,0,0,0,0,0,0
151,The nature of the treatments precluded masking participants and clinicians.,0,0,0,0,N,0,0,0,0,0,0
152,"Although DME treatment was at investigator discretion, the fixed PRP or anti-VEGF regimen for PDR limited clinician discretion, and protocol treatment adherence was high, limiting the bias of clinician unmasking except for considering vitrectomy which was at clinician discretion.",0,0,0,0,N,0,0,0,0,0,0
153,"Visual acuity testers were masked at the primary outcome visit and the computerized testing methods minimized acquisition bias.<sup><a href=""#R14"">14",0,0,0,0,N,0,0,0,0,0,0
154,"Costs, including cost-effectiveness are beyond the scope of this manuscript.",0,0,0,0,N,0,0,0,0,0,0
155,It is unknown if results would have been similar with another anti-VEGF treatment.,0,0,0,0,N,0,0,0,0,0,0
156,"When designing this protocol, another trial evaluating ranibizumab for DME had secondary analyses supporting the potential for ranibizumab to prevent worsening of PDR.<sup><a href=""#R23"">23</a></sup> No such data were available for aflibercept or bevacizumab at that time.",0,0,0,0,N,0,0,0,0,0,0
157,"Thus, from a scientific perspective, DRCR.net investigators judged ranibizumab the best anti-VEGF agent for this trial as enrollment began.",0,0,0,0,N,0,0,0,0,0,0
158,"In applying these results to clinical practice, PRP sometimes can be completed in one visit and not require additional procedures, although, in this study, 45% needed additional PRP.",0,0,0,0,N,0,0,0,0,0,0
159,"PRP may cost less than ranibizumab injections, and carries no risk of endophthalmitis or systemic anti-VEGF exposure.",0,0,0,0,N,0,0,0,0,0,0
160,Weighing the relative benefits of PDR treatment with PRP versus ranibizumab may be influenced by whether DME is present.,0,0,0,0,N,0,0,0,0,0,0
161,"When DME is present for which ranibizumab treatment is planned, PRP may be unnecessary since ranibizumab will treat both the PDR and DME, assuming access to ranibizumab and patient adherence to follow-up.",0,0,0,0,N,0,0,0,0,0,0
162,"Regardless of presence or absence of DME, the results of this study suggest that ranibizumab is more effective than PRP for mean visual acuity outcomes over the course of 2 years with less visual field loss, and fewer eyes developing DME or undergoing vitrectomy.",0,0,0,0,N,0,0,0,0,0,0
163,"Nevertheless, treatment cost, adherence to and frequency of follow-up, and patient preference should be considered.",0,0,0,0,N,0,0,0,0,0,0
164,"Among eyes with proliferative diabetic retinopathy, treatment with ranibizumab resulted in visual acuity that was non-inferior to (not worse than) panretinal photocoagulation at two years.",0,0,0,0,N,0,0,0,0,0,0
165,"Although longer term follow-up is needed, ranibizumab may be a reasonable treatment alternative at least through 2 years for patients with proliferative diabetic retinopathy.",0,0,0,0,N,0,0,0,0,0,0
166,"View larger version</a></span><span class=""fig-label"">Figure 1.",0,0,0,0,N,0,0,0,0,0,0
167,"<span class=""title"">Completion of Follow-up for Study Eyes</span></span>*Two-year completed visits include those that occurred between 644 and 812 days (between 92 and 116 weeks).",0,0,0,0,N,0,0,0,0,0,0
168,** Participants are not formally screened prior to obtaining an informed consent,0,0,0,0,N,0,0,0,0,0,0
169,ITT = Intention-to-treat,0,0,0,0,N,0,0,0,0,0,0
170,"View larger version</a></span><span class=""fig-label"">Figure 2.",0,0,0,0,N,0,0,0,0,0,0
171,"</span>Shown are changes in visual acuity over time for the overall cohort (Panel A), for eyes with baseline DME (Panel B), and for eyes without baseline DME (Panel C).",0,0,0,0,N,0,0,0,0,0,0
172,Outlying values were truncated to 3 SD from the mean.,0,0,0,0,N,0,0,0,0,0,0
173,Bars represent 95% confidence interval on the mean,0,0,0,0,N,0,0,0,0,0,0
174,"See full table</a></span><span class=""fig-label"">Table 1.",0,0,0,0,N,0,0,0,0,0,0
175,</span>Baseline Characteristics,0,0,0,0,N,0,0,0,0,0,0
176,"See full table</a></span><span class=""fig-label"">Table 2.",0,0,0,0,N,0,0,0,0,0,0
177,</span>Main Study Outcomes,0,0,0,0,N,0,0,0,0,0,0
178,"See full table</a></span><span class=""fig-label"">Table 3.",0,0,0,0,N,0,0,0,0,0,0
179,"</span>Ocular and Systemic Adverse Events of Interest through 2 Years<a href=""#TFN19"">*</a><a href=""#TFN20"">†",0,0,0,0,N,0,0,0,0,0,0
180,Open In Web Browser,0,0,0,0,N,0,0,0,0,0,0