Sentence-ID,Sentence-String,Q1,Q2,Q3,Q4,Q5,Q6,Q7,Q8,Q9,Q10,Q11
139,"Although the AS OCT quantitative data were significant numerically in terms of overall widening of the angle from baseline, this did not translate into the desired Shaffer anatomic grade of at least 3 (posterior trabecular meshwork or scleral spur).",0,0,0,0,N,N,N,0,0,0,0
140,"This inadequate response could be the result of a thicker iris root in Asian eyes with angle closure or the presence of plateau iris configuration, which could have rendered ALPI less effective.Among our subjects, 27% were classified as having plateau iris based on predefined ultrasound biomicroscopy criteria.",0,0,0,0,N,N,N,0,0,0,0
141,A multivariate regression analysis did not specifically implicate plateau iris configuration to be associated directly with failure.,0,0,0,0,N,N,N,0,0,0,0
142,"However, it would be hard to arrive at any conclusions because the study was not designed specifically to address this issue.",0,0,0,0,N,N,N,0,0,0,0
143,Larger numbers and studies of non-Asian subjects would provide insights regarding the implications of these factors in other populations.,0,0,0,0,N,N,N,0,0,0,0
144,A further reason accounting for the inefficacy of the ALPI could be a dysfunctional trabecular meshwork.,0,0,0,0,N,N,N,0,0,0,0
145,"Chronic iridotrabecular contact could lead to loss of trabecular architecture and could render the meshwork dysfunctional, as substantiated in a study by Sihota et al.",0,0,0,0,N,N,N,0,0,0,0
146,They also reported that the ultrastructural trabecular meshwork changes could exist even in areas without PAS.,0,0,0,0,N,N,N,0,0,0,0
147,"This essentially means that ALPI may not always translate into effective IOP reduction, despite morphologic widening of the angle.",0,0,0,0,N,N,N,0,0,0,0
148,"Finally, it has to be acknowledged that the true effect of iridoplasty on IOP reduction in eyes where iridotrabecular contact is 180° is likely to be minimal.",0,0,0,0,N,N,N,0,0,0,0
149,"However, the bias associated with this factor specifically was examined, and it seems to be limited, because we found that 87.0% of the eyes recruited in our study had iridotrabecular contact extending beyond 180°.",0,0,0,0,N,N,N,0,0,0,0
150,A primary concern with regard to ALPI is long-term complications.,0,0,0,0,N,N,N,0,0,0,0
151,This study did not find any detrimental effect on the endothelial cell count or central corneal thickness at 1 year.,0,0,0,0,N,N,N,0,0,0,0
152,"Corneal decompensation has been documented late after LI, which involves laser exposure at only a single site.",0,0,0,0,N,N,N,0,0,0,0
153,Ritch et al reported ALPI to be safe over a 6-year period.,0,0,0,0,N,N,N,0,0,0,0
154,"The sample size in their study was rather small, and because ALPI involves multiple site exposures with lower laser energy, we have to acknowledge the possible risk of late corneal decompensation.",0,0,0,0,N,N,N,0,0,0,0
155,"Interestingly, our study showed a slight increase in the extent of PAS in the ALPI arm, which was unexpected, because one of the aims of ALPI is to help widen angle recess and to reduce PAS formation.",0,0,0,0,N,N,N,0,0,0,0
156,"This also contradicts the findings of Sun et al, who reported a reduced rate of PAS formation after ALPI.",0,0,0,0,N,N,N,0,0,0,0
157,"However, as acknowledged by them, their inferences were inconclusive because of the nonindentation technique used for assessment of PAS extent in their study.",0,0,0,0,N,N,N,0,0,0,0
158,"One possible reason for increased PAS at 1 year in our study subjects is the ineffectiveness of ALPI to widen the angle adequately in eyes with persistent iridotrabecular contact, possibly combined with low-grade inflammation induced by laser treatment.",0,0,0,0,N,N,N,0,0,0,0
159,"Other complications such as IOP spikes were minimal, and only 1 subject required a trabeculectomy during the study period.",0,0,0,0,N,N,N,0,0,0,0
160,"We did not encounter other potential complications of ALPI, such as persistent uveitis or Urrets-Zavalia syndrome.",0,0,0,0,N,N,N,0,0,0,0
161,Some of the limitations of our study were that IOP estimations in study subjects were single-visit readings and could not be masked because of the visibility of iridoplasty scars.,0,0,0,0,N,N,N,0,0,0,0
162,The ideal scenario would have been diurnal IOP measurements at baseline and final follow-up visits.,0,0,1,0,N,N,N,0,0,0,0
163,"However, because of practical limitations and patient inconvenience, this protocol could not be adopted.",0,0,0,0,N,N,N,0,0,0,0
164,The study was not designed to evaluate the response of ALPI in diagnostic subtypes of angle closure.,0,0,0,0,N,N,N,0,0,0,0
165,"Eyes with PAC may have responded differently compared with eyes with PACG, which are at the advanced end of the angle-closure disease spectrum.",0,0,0,0,N,N,N,0,0,0,0
166,"It has to be acknowledged that although the diagnostic distributions of angle-closure subtypes were similar in both arms of the study and the multivariate analysis suggested that the final outcomes of iridoplasty were not influenced by this aspect, the study had limited power to evaluate this variable.",0,0,0,0,N,N,N,0,0,0,0
167,"Furthermore, masked assessment of trial patients was not possible because of the visibility of iridoplasty scars, and this could have induced bias in some of our findings, such as the assessment of extent of PAS.",0,0,0,0,N,N,N,0,0,0,0
168,The sample size had to be modified midway through the study because of safety concerns arising from poor response to the ALPI intervention.,0,0,0,0,N,N,N,0,0,0,0
169,"Finally, the study involved Asian subjects who were predominantly Chinese.",0,0,0,0,N,N,N,0,0,0,0
170,"The mechanisms of angle closure associated with this population may be distinct, and it may not be possible to extrapolate the results directly to all populations.",0,0,0,0,N,N,N,0,0,0,0
171,"In conclusion, ALPI as a therapeutic method in PAC and PACG, with residual angle closure and increased IOP after LI, was found to be less effective in reducing IOP compared with PGA therapy.",0,0,0,0,N,N,N,0,0,0,0