Sentence-ID,Sentence-String,Q1,Q2,Q3,Q4,Q5,Q6,Q7,Q8,Q9,Q10,Q11
125,"The strong myopia control effect found in this study, that is, an overall 72% reduction in progression, based on cycloplegic autorefraction, and 80% reduction in the rate of axial elongation, far exceeds the size of treatment effects reported in previous myopia control studies involving optical devices in humans, and only daily 1.0% topical atropine has comparable results of the pharmacological treatments studied.40 Nonetheless, the results are consistent with an already published identical twin case study by the authors.",0,0,0,0,0,0,0,0,0,0,0
126,"However, the CONTROL study provides more convincing evidence that myopia progression can be effectively controlled through optical intervention, being a well-controlled, albeit small-scale, double-masked clinical trial with treatments randomly assigned and groups well matched with regard to sex, ethnicity, refractive error, and degree of near associated phoria.",0,0,0,0,0,0,0,0,0,0,0
127,"As a 12-month study, it is not possible to comment on the enduring nature of this treatment effect, although related more recent contact lens studies have reported significant treatment effects beyond the first year.Given that many of the sight-threatening ocular complications of myopia are linked to excessive ocular elongation,it is also important to note that the BFSCL control effect reported here was achieved through reduced ocular elongation.",0,0,0,0,0,0,0,0,0,0,0
128,"The large control effects reported here contrast with the somewhat small effects reported in two COMET studies, which represent the largest and best-controlled of clinical trials involving multifocal spectacle lenses for myopia in children to date.",0,0,0,0,0,0,0,0,0,0,0
129,Both COMET studies used progressive addition lenses (PALs).,0,0,0,0,0,0,0,0,1,0,0
130,"In the first study, subgroup analyses revealed that subjects with either low baseline levels of myopia and reduced accommodative responses or near esophoria and larger than normal lags of accommodation all benefited significantly from PALs, recording treatment effects of 0.55 and 0.64D less myopia progression, respectively, across 3 years compared with that of single-vision spectacle wearers.",0,0,0,0,0,0,0,0,0,0,0
131,"The reduction in progression rates with PALs was 0.20D overall, and for near exophores, 0.05D.",0,0,0,0,0,0,0,0,0,0,0
132,"Curiously, in a 3-year follow-up study (COMET II), which was limited to children with high accommodative lags and near esophoria, the treatment effect was very small, averaging 0.28D, and another shorter study (STAMP), which was likewise limited to children with high accommodative lags, also reported only a small, 0.18D, treatment effect across 12 months.",0,0,0,0,0,0,0,0,0,0,0
133,Additional selection criteria for the latter study included either myopia less than -2.25D or myopia higher than -2.25D combined with esophoria at near.,0,0,0,0,0,0,0,0,0,0,0
134,"Although all three studies were United States based, results from studies involving multifocal spectacles in East Asia have also not revealed consistent clinically significant myopia control benefits for those with near esophorias or high lags of accommodation.",0,0,0,0,0,0,0,0,0,0,0
135,"Since the completion of the study reported here, there have been a number of other myopia control-related bifocal contact lens studies, and as reported here, most have demonstrated better efficacy than related multifocal spectacle lens studies.",0,0,0,0,0,0,0,0,0,0,0
136,"Two such studies, the DISC study  and the Dual Focus  study, involved two different custom multifocal soft contact lens designs, which both had distance and near powers arranged in some form of multiple concentric rings, as with the lens design used in the current study.",0,0,0,0,0,0,0,0,0,0,0
137,"Both studies reported significant slowing of myopia progression in the wearers of their device relative to those receiving the single-vision control treatment, although less than in the current study, that is, 36% slower progression in both the DISC study overall and in the first 10 months of the crossover Dual Focus study.",0,0,0,0,0,0,0,0,0,0,0
138,"In the first year of yet another multiyear study comparing myopia progression with a soft contact lens design with peripheral plus power and single-vision soft contact lenses, an adjusted 34% relative reduction was reported.",0,0,0,0,0,0,0,0,0,0,0
139,"Finally, a 1-year study comparing myopia progression in wearers of a distance center multifocal soft lens with a +2.00D add with historical controls involving wearers of single-vision daily disposable soft contact lenses reported a 50% relative reduction in myopia progression and a 29% relative reduction in axial elongation.",0,0,0,0,0,0,0,0,0,0,0
140,Why are bifocal soft contact lenses apparently more effective in controlling myopia progression than bifocal or PAL spectacles?,0,0,0,0,0,0,0,0,0,0,0
141,"While the current study was relatively short-term (12 months), and it is possible that treatment effects may have declined with time, had our study been extended, the picture is likely more complex.",0,0,0,0,0,0,0,0,0,0,0
142,"In this context, the practical limitations of bifocal and PAL spectacles for children and adolescents and their implications for compliance cannot be ignored.",0,0,0,0,0,0,0,0,0,0,0
143,"Once inserted, contact lenses are more likely to be left in place throughout the day than spectacle lenses for practical reasons, thereby favoring compliance.",0,0,0,0,0,0,0,0,0,0,0
144,"Furthermore, assuming that the maximum treatment effects of multifocal spectacle lenses requires children to use the near addition during near work, then compared with presbyopic adults, children are likely to be less compliant because of the unusual head and eye postures required (head up and eyes lowered) and because of the optical distortions encountered on viewing obliquely through the lower regions of such spectacle lenses.",0,0,0,0,0,0,0,0,0,0,0
145,"Indeed, video monitoring of children participating in one myopia control study found that they commonly dropped their heads while reading.Thus, although most studies report training their subjects in the proper use of multifocal spectacles and many of them also sought to monitor compliance, it is not clear how effective these strategies were in ensuring their proper use in everyday tasks.",0,0,0,0,0,0,0,0,0,0,0
146,"Furthermore, with the extensive use by today's children and adolescents of computers with screens at or above eye level, one could argue that the more traditional multifocal spectacle lens designs are not practical for these age groups.",0,0,0,0,0,0,0,0,0,0,0
147,"Lending weight to these arguments is the impressive sustained myopia control reported in a study using high-set executive-style bifocal spectacles with or without base-in prism for rapidly progressing Chinese Canadian children with high accommodative lags and/or with esophoria at near, that is, 39 and 51% slowing in myopia progression and 30 and 34% slowing in axial elongation, respectively, relative to changes with single-vision spectacles across 3 years.",0,0,0,0,0,0,0,0,0,0,0
148,"The children are likely to have had difficulty in looking over the top of the near segments during reading, and the addition of base-in prism may have improved visual comfort and thus compliance in those with induced near exophoric tendencies.",0,0,0,0,0,0,0,0,0,0,0
149,"The bifocal soft contact lenses used in the current study represent the end of this continuum, exposure to the near addition having no dependence on gaze direction and/or training, the only requirement being that the lenses are worn on a daily basis.",0,0,0,0,0,0,0,0,0,0,0
150,"The arguments presented above rest on an assumption that accommodative lags stimulate eye elongation, that the adds in bifocal lenses and PALs served to correct them, and that the superiority of bifocal contact lenses reflects the near addition being available at all angles of gaze and near distances.",0,0,0,0,0,0,0,0,0,0,0
151,"A number of studies have attempted to directly measure the effects of bifocal soft contact lenses on accommodation, with significant differences in their outcomes.",0,0,0,0,0,0,0,0,0,0,0
152,"In one such study, myopes as well as emmetropes were reported to overaccommodate when wearing bifocal soft contact lenses, whereas only emmetropes showed this behavior for single-vision contact lenses incorporating the near addition power and only at some distances.",0,0,0,0,0,0,0,0,0,0,0
153,"However, two other studies have reported near normal accommodation in nonpresbyopic users of bifocal contact lenses, suggesting that they ignored the near zones of the lenses.",0,0,0,0,0,0,0,0,0,0,0
154,"Although different methodologies, including instrumentation, were used in these three studies, nonetheless, taken together, these results suggest that a simple analogy between bifocal spectacles and bifocal contact lenses is not appropriate here.",0,0,0,0,0,0,0,0,0,0,0
155,"Induced changes in net optical aberrations, including spherical aberration, are likely to also impact on accommodation, greater in the case of bifocal contact lenses than equivalent spectacle lenses, and these effects are also likely to be lens design dependent, a subject of an ongoing study.",0,0,0,0,0,0,0,0,0,0,0
156,The possibility that such changes might contribute to the apparently greater efficacy of some bifocal contact lens designs cannot be ruled out.,0,0,0,0,0,0,1,0,0,0,0
157,"It is perhaps important to note that all CONTROL subjects exhibited near associated esophorias, with the bifocal adds being selected to maximally neutralize them and without which they could be expected to exhibit larger lags of accommodation as reduced accommodative effort is one way of reducing accommodative convergence by way of compensating for near esophorias.",0,0,0,0,0,0,0,0,0,0,0
158,"Based on animal model studies, the resulting retinal (hyperopic) defocus can be expected to contribute to myopic progression and bifocal adds to slow progression by attenuating such focusing errors.",0,0,0,0,0,0,0,0,0,0,0
159,"In this context, myopes exhibiting near eso-fixation disparities may represent a special subset likely to benefit significantly from near additions.",0,0,0,0,0,0,0,0,0,0,0
160,"Note also that most other multifocal lens studies have used standardized additions, with no selection criteria related to binocular vision status, perhaps contributing to the lower efficacies reported.",0,0,0,0,0,0,0,0,0,0,0
161,Other characteristics of bifocal soft contact lenses may also have contributed to their apparently greater effectiveness than spectacle lenses as myopia control treatments.,0,0,0,0,0,0,0,0,0,0,0
162,"Specifically, the improved efficacy of bifocal contact lenses over their spectacle lens equivalents may be related to differences in the defocus experience, including more sustained myopic defocus provided with the former.",0,0,0,0,0,0,0,0,0,0,0
163,Animal studies have shown that the imposition of sustained myopic defocus over a sufficiently large area of retina (central or peripheral) strongly inhibits eye growth.,0,0,0,0,0,0,0,0,0,0,0
164,"The designers of the DISC study have argued that their contact lens imposes frequent near constant myopic defocus, distributed relatively evenly across the retina, thereby providing a robust stop signal to eye growth.",0,0,0,0,0,0,0,0,0,0,0
165,The bifocal contact lens design used in the current study included alternating rings of distance and near powers.,0,0,0,0,0,0,0,0,1,0,0
166,"Interestingly, Fresnel spectacle lens designs incorporating rings of positive power have also been shown to have strong inhibitory effects on eye growth in both chick and guinea pig models.The prolate eye shape commonly linked to human myopia may also be of relevance, as it is generally coupled to peripheral hyperopic defocus, which will be reduced, or even reversed in sign, at least during distance viewing, with bifocal contact lens designs incorporating peripheral adds, as used in the current study.",0,0,0,0,0,0,0,0,0,0,0
167,"The myopia control effect of such lenses would also be improved further if, during near viewing, nonpresbyopic wearers did not reduce their accommodation, as reported in two of the studies described above.",0,0,0,0,0,0,0,0,0,0,0
168,"The observed decreases in axial length and apparent myopia regression, mostly limited to the BFSCLs group, warrant some comment.",0,0,0,0,0,0,0,0,0,0,0
169,"A similar pattern of response was observed previously by us in a myopia control case study involving BFSCLs and identical twins, as well as in both an unrelated study involving orthokeratology  and the ATOM 1 study.",0,0,0,0,0,0,0,0,0,0,0
170,"In the current study, 13 subjects in the BFSCL group recorded reductions in axial length, and eight subjects recorded hyperopic shifts in cycloplegic spherical equivalent refractive error, that is, regression in myopia, based on the average for the two eyes.",0,0,0,0,0,0,0,0,0,0,0
171,"These observations contrast with findings for the SVSCL group, in which only one subject showed a decrease in axial length and one subject showed a decrease in myopia.",0,0,0,0,0,0,0,0,0,0,0
172,"Such changes were more commonly encountered in older (13 years and older) subjects, with both cases in the SVSCL group, as well as 11 of 13 cases of axial ""shrinkage"" and 5 of 8 cases of myopia regression in the BFSCL group falling within this age range.",0,0,0,0,0,0,0,0,0,0,0
173,"Reductions in accommodative tone across the treatment period may have contributed to these refractive error changes, that is, apparent myopia regression, although such effects are expected to be very small, given that reported refractive error data were obtained under cycloplegia.",0,0,0,0,0,0,0,0,0,0,0
174,Also no treatment-induced corneal changes were observed to provide an alternative optical explanation for this finding.,0,0,0,0,0,0,0,0,0,0,0
175,"Noteworthy and more challenging to explain are the observed decreases in axial length in some of our subjects, given that a small amount of eye elongation, not shrinkage, can be expected among growing children, even in the absence of myopic progression.",0,0,0,0,0,0,0,0,0,0,0
176,"Indeed, in a study involving Nepalese children aged 6 to 18 years, the vitreous chamber depths of nonmyopic subjects were reported to increase at a rate of 0.07 mm/year.",0,0,0,0,0,0,0,0,0,0,0
177,"Because the average axial length change for the BFSCL group is very small, that is, 0.05 mm, measurement error cannot be ruled out as the explanation for some of the cases of apparent shrinkage.",0,0,0,0,0,1,0,0,0,0,0
178,"However, choroidal thickening in response to imposed myopic defocus is offered as one of two alternative explanations of some of these cases.",0,0,0,0,0,0,0,0,0,0,0
179,"First reported in chicks, defocus-driven choroidal thickening has since been reported in other animal models  and most recently in young adult subjects.",0,0,0,0,0,0,0,0,0,0,0
180,"The effect of choroidal thickening is to move the retina forward, thereby leading to a reduction of axial length as referenced to the retinal pigment epithelium and measured with the IOLMaster.",1,0,0,0,0,0,0,0,0,0,0
181,"As the second more speculative explanation, it is plausible that co-contraction of resident myofibroblasts in the human sclera could lead to a decrease in axial length, although little is known about the role of these cells and the signal pathway that regulates their activity.",0,0,0,0,0,0,0,0,0,0,0
182,"Suffice it to say, it remains beyond the scope of this report to conclusively identify the mechanism underlying the observed reductions in axial length in otherwise growing children.",0,0,0,0,0,0,0,0,0,0,0
183,No clinical trial is without its limitations.,0,0,0,0,0,0,0,0,0,0,0
184,Limiting our subjects to those having eso fixation disparity at near prevents generalization of our conclusions about the treatment effects found with BFSCLs.,0,0,0,0,0,0,0,0,0,0,0
185,The relatively short duration of our study is also a limitation.,0,0,0,0,0,0,0,0,0,0,0
186,A follow-up longer-term study is needed to address the question of whether good control over myopia progression is maintained with BFSCLs beyond 12 months.,0,0,0,0,0,0,0,0,0,0,0
187,"Future studies should also aim for a more balanced representation by sex and include a wider range of ethnicities to cover the possibility of genetic differences in the evolution of myopia, as proposed by Yang et al., among others.",0,0,0,0,0,0,0,0,0,0,0
188,"Finally, it will also be important to understand how early intervention influences the course of later progression on discontinuation of treatment.",0,0,0,0,0,0,0,0,0,0,0
189,"Acuvue BFSCLs, prescribed to maximally neutralize near associated esophoria in children and adolescents, are effective in limiting the rate of myopia progression and axial elongation relative to conventional single-vision contact lenses during a 12-month treatment period.",0,0,0,0,0,0,0,0,0,0,0
190,Understanding the specific factors contributing to the efficacy of this contact lens design in controlling myopia progression will be important for refining related clinical protocols.,0,0,0,0,0,0,0,0,0,0,0