Sentence-ID,Sentence-String,Q1,Q2,Q3,Q4,Q5,Q6,Q7,Q8,Q9,Q10,Q11
0,"Purpose: Most studies have reported only minimal reductions in myopia progression with bifocal or progressive multifocal spectacles, although somewhat larger, although mostly still clinically insignificant, effects have been reported in children with nearpoint esophoria and/or accommodative dysfunctions.",0,0,0,0,0,0,0,0,0,0,0
1,"The CONTROL study was a 1-year, prospective, randomized, clinical trial of bifocal contact lenses for control of myopia in children with eso fixation disparities at near.",1,0,0,0,0,0,0,0,0,0,0
2,"Methods: Eighty-six myopic subjects, aged 8 to 18 years, were enrolled in the study after passing the screening examination.",0,0,0,0,0,0,0,0,0,0,0
3,"Of these, 79 completed lens assignment and 78 completed the study.",0,0,0,0,0,0,0,1,0,0,0
4,"The mean refractive error of these 79 subjects was -2.69 +/- 1.40D (SD), and all had progressed by -0.50D or more since their last examination.",1,0,0,0,0,0,0,0,1,0,0
5,All subjects also had eso fixation disparity at near.,0,0,0,0,0,0,0,0,0,0,0
6,Subjects were randomly assigned to wear either Vistakon Acuvue 2 (single-vision soft contact lenses [SVSCLs]) or Vistakon Acuvue Bifocal (bifocal soft contact lenses [BFSCLs]).,0,1,0,0,0,0,0,0,0,0,0
7,Bifocal adds were selected to neutralize the associated phoria.,0,0,0,0,1,0,0,0,0,0,0
8,"Treatment outcomes included cycloplegic autorefraction and axial length, assessed in terms of changes after 6 and 12 months of treatment from pretreatment baseline values.",0,0,0,0,0,0,0,0,0,0,0
9,"Results: The BFSCLs significantly slowed myopia progression, with statistically significant differences between the treatment groups after 6 months.",0,0,0,0,0,0,0,0,0,0,0
10,"After 12 months of treatment, the SVSCL group had progressed by -0.79 +/- 0.43D compared with -0.22 +/- 0.34D for the BFSCL group (cycloplegic objective spherical equivalent, average of two eyes).",0,0,0,0,0,0,0,0,0,0,0
11,"Corresponding axial length changes were 0.24 +/- 0.17 mm and 0.05 +/- 0.14 mm, respectively.",0,0,0,0,0,0,0,0,0,0,0
12,"All of these differences were found to be statistically significant (unpaired t-tests, p < 0.001).",0,0,0,0,0,0,0,0,0,0,0
13,Conclusions: The distance center bifocal contact lenses tested in this study achieved greater control over myopia progression and axial elongation (>70%) compared with most published results with multifocal spectacles.,0,0,0,0,0,0,0,0,0,0,0
14,Further studies are warranted to identify the critical factors and mechanisms underlying this myopia control effect.,0,0,1,0,0,0,0,0,0,1,0
15,Myopia is the focus of growing attention and concern because of the now extremely high prevalence of myopia in some East Asian populations.,0,0,0,0,0,0,0,0,0,0,0
16,"Remarkably, myopia prevalence figures in the mid to high 90 percent have been reported in some studies of university student populations in Taiwan  and Shanghai, with a figure of 96.5% being reported for young adult Korean male conscripts in Seoul.",0,0,0,0,0,0,0,0,0,0,0
17,"Equivalent prevalence figures for the United States have also been trending upward, albeit lagging behind those of East Asia.",0,0,0,0,0,0,0,0,0,0,0
18,"For example, comparison of data from two studies of the same population across the periods 1971 to 1972 and 1999 to 2004 revealed an increase in the prevalence of myopia from 25% to 41.6% for the 12- to 54-year age range (after adjustment for differences in the methods used to detect myopia).",0,0,0,0,0,0,0,0,0,0,0
19,These figures would not be of concern were it not for the well-established link between myopia and sight-threatening ocular pathologies.,0,0,0,0,0,0,0,0,0,0,0
20,"Importantly, and as well summarized in a recent review by Flitcroft,5 even low myopia is associated with an increased risk of pathology, with the latter, measured in terms of odds ratios, simply increasing with increasing myopia.",0,0,0,0,0,0,0,0,0,0,0
21,"Myopes are at an increased risk of myopic maculopathy, retinal detachment, cataracts, and glaucoma, with myopic maculopathy now the leading cause of monocular blindness in Japan and of new cases of blindness in Shanghai.",0,0,0,0,0,0,0,0,0,0,0
22,The rapidly changing myopia prevalence figures are consistent with the increasing acceptance of the role that environmental influences play in the development of myopia.,0,0,0,0,0,0,1,0,0,0,0
23,"Some but not all studies have linked myopia with increased near work, for example, books read, and one recent German study showed a correlation between years of formal education with level of myopia.",0,0,0,0,0,0,0,0,0,0,0
24,There are other studies pointing to outdoor activities being protective against the development of myopia.,0,0,0,0,0,0,0,0,0,0,0
25,"Although unresolved are the specific factors contributing to myopia development and progression, that visual experience seems to play a central role has refocused attention on the possibility that myopia progression can and should be controlled.",0,0,0,0,0,0,0,0,0,0,0
26,"Studies involving animal models for myopia (chicks, guinea pigs, marmosets, rhesus monkeys) provide compelling evidence for active emmetropization and a role for optical defocus in ocular growth modulation.",0,0,0,0,0,0,0,0,0,0,0
27,"Specifically, hyperopic defocus imposed on young eyes accelerates eye growth while imposed myopia slows it.",0,0,0,0,0,0,0,0,0,0,0
28,"Local retinal mechanisms have been implicated, with the peripheral retina apparently playing an important role in ocular growth regulation.",0,0,0,0,0,0,0,0,0,0,0
29,"Of relevance to the current study, in recent animal model studies, multifocal lenses incorporating zones of positive power were found to inhibit eye growth, even when these zones are limited to the periphery of the lenses.",0,0,0,0,0,0,0,0,0,0,0
30,"For already myopic eyes, both stabilization of myopia and reversal have been described.",0,0,0,0,0,0,0,0,0,0,0
31,"The above observations with animal models, translated to human myopia, raise the possibility of increased progression with standard corrective spectacle and soft contact lenses, given that the image shell providing accurate on-axis focus typically falls increasingly behind the retina with increasing distance off-axis.",0,0,0,0,0,0,0,0,0,0,0
32,"Furthermore, more prolate eye shapes, a common finding in myopia, are expected to exaggerate this problem.",0,0,0,0,0,0,0,0,0,0,0
33,"Conversely, prescribing optical devices that impose peripheral myopic defocus is predicted to slow myopia progression, consistent with results from a number of independent myopia control studies involving orthokeratology, which produces a relative myopic shift in peripheral retinal defocus, a consequence of induced corneal shape changes.",0,0,0,0,0,0,0,0,0,0,0
34,The Control Of Nearsightedness-TRial Of Lenses (CONTROL) study reported here investigated myopia progression with distance center multi-ring bifocal soft contact lenses (BFSCLs) compared with single-vision soft contact lenses (SVSCLs) in children.,0,0,0,0,0,0,0,0,0,0,0
35,It was prospective and double masked.,0,0,0,0,1,0,0,0,0,0,0
36,"Motivation for the study came partly from promising retrospective data collected from the practice of one of the authors (TA), in which BFSCLs had been prescribed as a substitute for bifocal spectacles to address the compliance issues (Aller et al., OVS 2000;77(12s):182).",0,0,0,0,0,0,0,0,0,0,0
37,"Emerging results from animal studies showing that imposed myopic defocus is a potent inhibitor of eye growth, as discussed above, provided additional motivation.",0,0,0,0,0,0,0,0,0,0,0
38,The study was limited to myopes with associated esophoria at near based on reports from earlier intervention studies that bifocal spectacles were more effective in slowing myopia progression in those with near esophoria and results from subgroup analysis in the original COMET study that revealed subjects with near esophoria to be among those to show least myopia progression.,0,0,0,0,0,0,0,0,0,0,0
39,"We report here highly clinically and statistically significant slowing of myopia progression with BFSCLs, exceeding results from all published optical intervention trials for control of myopia progression to date and directly reflecting a slowing of axial elongation relative to changes with SVSCLs.",0,0,0,0,0,0,0,0,0,0,0
40,"The study design and results are described in the following sections, and implications are discussed in the context of potential underlying mechanisms and the broader topic of control of myopia progression.",0,0,0,0,0,0,0,0,0,0,0
41,Study results have also been reported in abstract form previously.,0,0,0,0,0,0,0,0,0,0,0
42,"This study involved a randomized double-masked design, with two treatment groups of young progressing myopes wearing either distance center (alternating 5-ring) BFSCLs (Vistakon Acuvue Bifocal) or SVSCLs (Vistakon Acuvue 2).",0,0,0,0,1,0,0,0,0,0,0
43,Both were made from 58% etafilcon A visibility tinted material.,0,0,0,0,0,0,0,0,0,0,0
44,"In both cases, lenses were worn on a daily wear basis for 12 months, with a 2-week replacement schedule and Optifree solutions (provided by Alcon) used for cleaning, rinsing, and disinfection.",0,0,0,0,0,0,0,0,0,0,0
45,The lenses were delivered to the subjects in their original containers with tamper-proof opaque masking labels.,0,0,1,0,0,0,0,0,0,0,0
46,"Because of the relatively small group (sample) sizes involved, a modified covariate adaptive randomization approach was used to allocate treatments.",0,0,0,0,0,0,0,0,0,0,0
47,"Specifically, subjects were randomly assigned a treatment by the masked off-site clinical trial coordinator who used an adaptive biased coin toss design to increase the probability that successive subjects were assigned to the group with the smaller sample size with respect to age, refractive error, amount of eso-associated near phoria, sex, and Asian versus non-Asian ethnicity.",0,0,0,0,0,1,0,0,0,0,0
48,"The study examiner, office staff, subjects, and parents were not aware of the lens assignments before the end of the study.",0,0,0,0,1,1,1,1,0,0,0
49,"Subjects were required to attend a maximum of six office visits, which included an initial measurement session to collect baseline ocular biometric and refraction data, and follow-up measurement sessions at 6 and 12 months, at which biometric and refraction data were again collected.",0,0,0,0,0,0,0,0,0,0,0
50,"Other sessions included a contact lens fitting session, a contact lens dispensing/training session, and a routine contact lens follow-up session to verify that the lenses fit satisfactorily and were without adverse effects on ocular health.",0,0,0,0,0,0,0,0,0,0,0
51,The study was conducted in the clinical practice of TA after the protocol was reviewed and approved by Quorum Review IRB.,0,0,0,0,0,0,0,0,0,0,0
52,The study followed the tenets of the Declaration of Helsinki and is listed on clinicaltrials.gov (NCT00214487).,0,0,0,0,1,0,0,0,0,0,0
53,"Informed assent was obtained from all subjects, and informed consent was obtained from all parents or guardians.",0,0,0,0,0,0,0,1,0,0,0
54,All subjects also underwent an on-site vision screening before acceptance into the study.,0,0,0,0,0,0,0,1,0,0,0
55,"Selection and exclusion criteria covered the refractive error and binocular vision profiles of the subjects, freedom from confounding ocular or systemic diseases, as well as ability to wear soft contact lenses.",0,0,0,0,0,0,0,0,0,0,0
56,"In brief, based on manifest subjective refractions, eligible subjects were limited to those in whom each eye exhibited -0.50D or more myopia in the least myopic meridian, -6.00D or less myopia in the most myopic meridian, anisometropia of 2.00D or less, refractive astigmatism of 1.00D or less, and best-corrected visual acuity of 20/20 or better in each eye.",1,0,0,0,0,0,0,0,0,0,0
57,All refractive error data here and elsewhere are referenced to the corneal plane.,0,0,0,0,0,0,0,0,0,0,0
58,"In addition, subjects were required to have progressed by -0.50D or more in one or both eyes since their last examination based on clinical records, results of spectacle neutralization, or written prescriptions.",0,0,0,0,0,0,0,0,0,0,0
59,"This selection criterion was included to limit the study to those experiencing myopia progression, and thus the timing of the last eye examination of individual subjects was not itself limited.",1,0,0,0,0,0,0,0,0,0,0
60,"Only those with near eso-associated phoria through their distance correction, measured as the amount of plus power required to neutralize their fixation disparity at their habitual viewing distance and angle for reading, were included.",0,0,0,0,0,0,0,0,0,0,0
61,"Existing soft contact lens wearers, as well as non-contact lens wearers, were accepted into the study, with current wearers being required to discontinue wear for 1 week before initial evaluation for this study.",0,0,0,0,0,0,0,0,0,0,0
62,"Non-contact lens wearers underwent routine clinical prefitting assessment to first verify their suitability for contact lens wear, although there was no run-in period before enrollment.",0,0,0,0,0,0,0,0,0,0,0
63,"Specific exclusion criteria included any pathology that may alter eye growth (e.g., history of retinal detachment) and/or adversely impact on their ability to successfully wear contact lenses (e.g., moderate to severe, or poorly treated, chronic allergic conjunctivitis) and prior ocular surgery.",0,0,0,0,0,0,0,0,0,0,0
64,Also excluded were subjects who had worn rigid contact lenses within the preceding 2 years or soft contact lenses on an extended wear basis within the preceding 6 months.,0,0,0,0,0,0,0,0,0,0,0
65,Other exclusion criteria included nursing or pregnant mothers and participants who were unable to commit to the 12 months of contact lens wear and follow-up testing or who had a high likelihood of leaving the area within the 12-month study period.,0,0,0,0,0,0,0,0,0,0,0
66,"Key baseline measurements included refraction, ocular biometry, keratometry, and near associated phorias.",0,0,0,0,0,0,0,0,0,0,0
67,All were undertaken either at the same time as the vision screening session or in a follow-up session.,0,0,0,0,0,0,0,0,0,0,0
68,Refractive errors were measured both objectively and subjectively with and without cycloplegia (30 min after two drops of 1% tropicamide administered 5 min apart).,0,0,1,0,0,0,0,0,0,0,0
69,"Objective refraction data were obtained using a Nidek (Marco) ARK 700 auto-refractor, with nine valid readings averaged for each eye.",0,0,0,0,0,0,0,0,0,0,0
70,Monocular subjective refractions were followed by binocular Polaroid balance using the endpoint of least minus power for best-corrected visual acuity.,0,0,0,0,0,0,0,0,0,0,0
71,Both procedures were repeated after cycloplegia was achieved.,0,0,0,0,0,0,0,0,0,0,0
72,Only objective refractive error data obtained under cycloplegia are reported here.,0,0,0,0,0,0,0,0,0,0,0
73,The distance powers of selected SVSCL and BFSCL represented in each case the minimum minus power providing monocular visual acuity of 20/30 or better.,0,0,0,0,0,0,0,0,0,0,0
74,"Axial lengths and anterior chamber depths were measured after cycloplegia using a Zeiss IOLMaster, with reported data for each eye based on an average of 10 and 3 valid measurements for axial length and anterior chamber depths, respectively.",0,0,0,0,0,0,0,0,0,0,0
75,Corneal curvatures were measured with a Marco keratometer.,0,0,0,0,0,0,0,0,0,0,0
76,Near heterophoria were measured at 33 cm through the subject's manifest subjective spherocylindrical distance correction in a trial frame set to their distance pupillary distance using the alternating cover test method.,0,0,0,0,0,0,0,0,0,0,0
77,"The minimum amount of binocular plus power, added in +0.25D steps, required to eliminate eso-fixation disparities, that is, near associated phoria, was similarly measured while viewing through Polaroid filters, a Bernell Near Point Examination card in a lighted box at 33 cm at their habitual reading angle.",0,0,0,0,0,0,0,0,0,0,0
78,Near associated esophorias were also measured in trial contact lens fitting sessions through both SVSCLs and BFSCLs.,0,0,0,0,0,0,0,0,0,0,0
79,"In determining the BFSCL prescription, a bifocal add power one step higher than the previously measured near associated phoria was used as a starting point and the add power subsequently adjusted to determine the minimum power necessary to completely eliminate or maximally reduce the near associated esophoria while maintaining acceptable distance visual acuity.",0,0,0,0,0,0,0,0,0,0,0
80,Both SVSCL and BFSCL prescriptions were submitted to the off-site clinical trial coordinator responsible for allocating treatments.,0,0,1,0,0,0,0,0,0,0,0
81,"Although many ocular parameters were monitored during the treatment period, reported data analyses are limited to those parameters most likely to offer insight into myopia progression.",0,0,0,0,0,0,0,0,0,0,0
82,Two primary outcome measures were used: (1) changes from baseline in spherical equivalent refractive errors based on cycloplegic autorefraction measurements and (2) changes in axial length-both parameters being objective and thus free of subjective biases.,0,0,0,0,0,0,0,0,0,0,0
83,"Anterior chamber depth, corneal curvature, and near associated phoria data were also included in some analyses.",0,0,0,0,0,0,0,0,0,0,0
84,"Initial comparison of primary outcome data for right and left eyes revealed no significant differences between them, and so the data for the two eyes of individual subjects were averaged for use in subsequent analyses.",0,0,0,0,0,0,0,0,0,0,0
85,Follow-up analyses used to evaluate treatment effects included unpaired t-tests with Bonferroni correction to examine differences between the two treatment groups (SVSCLs vs. BFSCLs) in outcome measures at both 6 and 12 months.,0,0,0,0,0,0,0,0,0,0,0
86,"To understand the origin of refractive error changes, correlations between changes in refractive errors and biometric parameters were analyzed using Pearson correlations.",0,0,0,0,0,0,0,0,0,0,0
87,"Finally, multivariate analyses of variance were used to examine the influence on treatment outcomes of various factors, including age, sex, baseline refractive error, near associated phorias, and BFSCL add power.",0,0,0,0,0,0,0,0,0,0,0
88,"Eighty-six myopic subjects were recruited, comprising an ethnically diverse group, with 27 white, 24 Asian (Chinese, Japanese, Korean, and Indian), 23 Hispanic, 9 Filipino or Pacific Islander children, and 3 children of African descent.",0,0,0,0,0,0,0,0,0,0,1
89,"In total, approximately 300 subjects were screened by telephone to determine their potential eligibility, with 125 subjects undergoing in-office screening.",0,0,0,0,0,1,0,0,0,0,1
90,"Thirty-nine screened subjects (18 male, 21 female) either failed the screening (N = 33) or qualified but declined to participate for various reasons (N = 6).",0,0,0,0,0,0,0,0,0,0,1
91,Seventy-eight subjects of the 86 recruited completed all aspects of the study.,0,0,0,0,0,0,1,1,0,0,1
92,There were no significant differences in any of the measured baseline measures between these two groups.,0,0,0,0,0,0,1,0,0,0,1
93,"Five subjects were dispensed lenses, with two completing only the dispensing visit and three completing only the 2-week follow-up visit.",0,0,0,0,0,0,0,0,0,0,0
94,"The other three subjects wore contact lenses for 6 months or more, one of whom wore lenses for 6 months but declined to undergo cycloplegia as part of the 6-month follow-up visit and was thus dropped from the study; of the remaining two subjects, one completed the 6-month visit but not the 12-month visit and the other completed the 12-month visit only.",0,0,0,0,0,0,0,0,0,0,0
95,The data for both of the latter two subjects were included in the analyses.,0,0,0,0,0,0,0,0,1,0,0
96,"The subject pool had a distinct female sex bias (60 of 86 subjects, 70%), which was preserved within each group; there were 27 females and 11 males in the BFSCL group and 27 females and 13 males in the SVSCL group.",0,0,0,0,0,0,0,0,0,0,0
97,"The subjects ranged in age from 8 to 18 years, their median age being 13.6 years, with 38 subjects (44%) being 13 years or younger.",0,0,0,0,0,0,0,0,0,0,0
98,Summary statistics for both SVSCL and BFSCL groups are given in Table 1.,0,0,0,0,0,0,0,0,1,0,0
99,"The groups were not significantly different from each other (p > 0.05, unpaired t-tests in all cases).",0,0,0,1,0,0,0,0,0,1,0
100,"All subjects fell into the category of low to moderate myopia, based on cycloplegic autorefractions, which ranged from -0.25 to -6.00D in the least myopic meridian, with mean equivalent spherical refractive errors ranging from -0.75 to -5.82D and astigmatism ranging from 0 to -1.00D.",0,0,0,1,0,0,0,0,0,0,0
101,"Axial lengths ranged from 22.58 to 26.41 mm, with anterior chamber depths ranging from 2.21 to 4.33 mm.",0,0,0,1,0,0,0,0,0,0,0
102,"Corneal curvatures, averaged across the two principal meridians, ranged from 41.06 to 47.03D.",0,0,0,0,0,0,0,0,0,0,0
103,"All subjects exhibited near associated esophorias, the plus power required to neutralize the latter ranging from +0.25 to +3.75D.",0,0,0,1,0,0,0,0,0,0,0
104,"Corresponding near heterophorias ranged from 8 PD exophoria to 18 PD esophoria, with a mean of 5.5 PD esophoria.",0,0,0,1,0,0,0,0,0,0,0
105,Changes in refractive error and axial length during the study period are summarized for both treatment groups in Table 2 and shown graphically in Fig.,0,0,0,0,0,0,0,0,0,0,0
106,There were significant changes in both refractive error and axial lengths from baseline in each group and at both 6 and 12 months (p < 0.001 in all cases).,0,0,0,0,0,0,0,0,0,1,0
107,"However, for both parameters, changes were significantly less for the BFSCL group than for the SVSCL group at both 6 and 12 months (p < 0.001), the finding at 6 months implying a rapid onset of the myopia control effect of the BFSCLs.",0,0,0,0,0,0,0,0,0,1,0
108,"Note also that at the 6-month time point, hyperopic shifts in refractive error were recorded for five subjects in the BFSCL group compared with one subject in the SVSCL group (Fig.",0,0,0,0,0,1,0,0,0,0,0
109,"1, left panel, data above zero).",0,0,0,0,0,0,0,0,0,0,0
110,A slightly larger number of subjects in the BFSCL group also recorded reductions in axial length (Fig.,0,0,1,0,0,0,0,0,0,0,0
111,"To better illustrate the contrasting effects of the two treatments, refractive error data were categorized according to whether or not there was progression during the treatment period.",0,0,0,0,0,0,0,0,0,0,0
112,"Using this binary outcome measure, the number of subjects showing either no progression of myopia or a hyperopic shift in refractive error represents 26% and 29% of the BFSCL treatment group at 6 and 12 months, respectively, compared with 5% (two subjects) for the SVSCL treatment group at both time points.",0,0,0,0,0,0,0,0,0,0,0
113,Also note that only one subject in the BFSCL group progressed by 1D or more during the 12-month study period compared with 11 subjects in the SVSCL group.,0,0,0,0,0,0,0,0,0,0,0
114,These figures further reinforce the significant differences between the two groups in terms of myopia progression.,0,0,0,0,0,0,0,0,0,0,0
115,"During the total 12-month study period, changes in refractive error were well predicted by changes in axial length (R2 = 0.64, p < 0.001) but not by changes in anterior chamber depth (R2 = -0.012; p = 0.79).",0,0,0,0,0,0,0,0,0,0,0
116,"Indeed, both the BFSCL and SVSCL groups recorded significant reductions rather than increases in anterior chamber depth (p < 0.01), presumably reflecting the growth of the crystalline lens in these young eyes, as the magnitude of the change was not significantly different between the groups (p = 0.94).",0,0,0,0,0,0,0,0,0,0,0
117,There was no significant change of corneal curvature for either group during the 12-month treatment period (p = 0.40).,0,0,0,0,0,0,0,0,0,0,0
118,A series of multivariate analyses of variance were also conducted to identify potentially significant associations.,0,0,0,0,0,0,0,0,0,0,0
119,"Only the most efficient model, that is, with the least number of variables without affecting the goodness of fit of the model, is reported, with changes in axial length and in refractive error as dependent continuous variables and six independent variables, treatment, sex, age, baseline refractive error, baseline near associated phoria, and BFSCL add power.",0,0,0,0,0,0,0,0,0,0,0
120,"Of these six variables, only age, considered as a continuous variable, and contact lens treatment proved to be significantly associated with changes in refractive error and axial length (Wilks [lambda] = 0.579, F2,74 = 26.86, p < 0.0001 for age; and Wilks [lambda] = 0.533, F2,74 = 32.41, p < 0.0001 for contact lens treatment, respectively).",0,0,0,0,0,0,0,0,0,0,0
121,Our study specifically targeted subjects with near associated esophorias based on early reports linking near dissociated esophoria with better myopia control with multifocal spectacle lenses.,0,0,0,0,0,0,0,0,0,1,0
122,"As expected, the BFSCL group showed a significant reduction in residual associated esophorias (associated phoria measured with contact lenses in place) relative to that of the SVSCL group (-1.10 +/- 0.52D vs. -0.16 +/- 0.43D, p < 0.0001).",0,0,0,0,0,0,0,0,0,0,0
123,"Nonetheless, neither baseline associated phorias nor residual associated phorias were significantly associated with overall changes in refractive error (F1,73 = 0.17, p = 0.68; F1,73 = 1.13, p = 0.29 for baseline near associated phoria and change in near associated phoria across 12 months, respectively).",0,0,0,0,0,0,0,0,0,0,0
124,The CONTROL study described here provides compelling evidence for the efficacy of bifocal contact lenses as a myopia control treatment.,0,0,0,0,0,0,0,0,0,0,0
