Sentence-ID,Sentence-String,Q1,Q2,Q3,Q4,Q5,Q6,Q7,Q8,Q9,Q10,Q11
209,"In (B) and (C), the region shaded red corresponds to glucose concentrations of less than 2·8 mmol/L, green to 3·9–6·7 mmol/L, and blue to 6·7–10 mmol/L.",0,0,0,0,N,N,N,0,0,0,0
210,"The vertical black line at 3·9 mmol/L is the bottom of the normal glucose range, by convention.",0,0,0,0,N,N,N,0,0,0,0
211,"To convert the values for glucose to mg/dL, multiply by 18.",0,0,0,0,N,N,N,0,0,0,0
212,CGM=continuous glucose monitoring.,0,0,0,0,N,N,N,0,0,0,0
213,"View larger version</a></span><span class=""fig-label"">Figure 3.",0,0,0,0,N,N,N,0,0,0,0
214,"<span class=""title"">Variation in the CGM-measured mean glucose concentration during the bionic pancreas and control periods over the course of the study</span></span>Mean daily (A) and night-time (B) CGM-measured glucose concentrations and proportion of time spent with a glucose concentration lower than 3·3 mmol/L on days (or nights) 1–5 during the bionic pancreas period (blue) and the control period (red).",0,0,0,0,N,N,N,0,0,0,0
215,(C) Superposition of tracings of mean glucose concentrations at all 5 min intervals during the bionic pancreas (blue) and control (red) periods.,0,0,0,0,N,N,N,0,0,0,0
216,Each tracing is surrounded by an area of shading of the same colour that spans 1 SD in both directions from the mean.,0,0,0,0,N,N,N,0,0,0,0
217,"The horizontal region shaded in purple corresponds to glucose concentrations of less than 2·8 mmol/L, green to 3·9–6·7 mmol/L, and blue to 6·7–10 mmol/L.",0,0,0,0,N,N,N,0,0,0,0
218,"To convert the values for glucose to mg/dL, multiply by 18.",0,0,0,0,N,N,N,0,0,0,0
219,CGM=continuous glucose monitoring.,0,0,0,0,N,N,N,0,0,0,0
220,"View larger version</a></span><span class=""fig-label"">Figure 4.",0,0,0,0,N,N,N,0,0,0,0
221,"<span class=""title"">Distributions of mean glucose concentrations and insulin doses</span></span>(A) Histogram distribution of mean CGM-measured glucose concentrations per participant on days 2–5 during the bionic pancreas and control periods, with mean glucose concentrations divided into intervals of 0·39 mmol/L.",0,0,0,0,N,N,N,0,0,0,0
222,"The dashed red line shows the mean glucose concentration of 9·4 mmol/L, which corresponds to a predicted HbA<sub>1c</sub> of 7·5%.",0,0,0,0,N,N,N,0,0,0,0
223,"(B) Histogram distribution of mean total daily doses of insulin on days 2–5, divided into intervals of 0·1 units/kg of bodyweight per day.",0,0,0,0,N,N,N,0,0,0,0
224,"To convert the values for glucose to mg/dL, multiply by 18.",0,0,0,0,N,N,N,0,0,0,0
225,CGM=continuous glucose monitoring.,0,0,0,0,N,N,N,0,0,0,0
226,"See full table</a></span><span class=""fig-label"">Table 1.",0,0,0,0,N,N,N,0,0,0,0
227,</span> Baseline characteristics,0,0,0,0,N,N,N,0,0,0,0
228,"See full table</a></span><span class=""fig-label"">Table 2.",0,0,0,0,N,N,N,0,0,0,0
229,</span>Glucose concentrations measured by CGM and fingerstick testing during 24 h day and night only,0,0,0,0,N,N,N,0,0,0,0
230,Research in context,0,0,0,0,N,N,N,0,0,0,0
231,"We searched Ovid Medline for articles published in English up to July 10, 2015, using the search terms [“artificial pancreas” OR “bionic pancreas” OR “closed-loop”] AND [“diabetes mellitus” OR “diabetes”] AND “children” OR “pediatric/s” OR “pre-adolescent”] AND [“randomized” OR “randomized controlled trial”], and identified two randomised trials in which automated glucose control was tested in outpatient settings during the day and night.",0,0,0,0,N,N,N,0,0,0,0
232,"One of these was our crossover study comparing the bihormonal bionic pancreas in 36 adolescent children (aged 12–20 years) at a diabetes camp for 5 days with camp-managed insulin pump therapy for 5 days, in random order.",0,0,0,0,N,N,N,0,0,0,0
233,The other was a study by Ly and colleagues comparing an insulin-only artificial pancreas system in 21 adolescents and adults (aged 15–31 years) for 6 days with sensor-augmented pump therapy for 6 days.,0,0,0,0,N,N,N,0,0,0,0
234,"Our previous study showed a reduction in mean glucose concentration, increased time in target range (3·9–10 mmol/L [70–180 mg/dL]), and a reduced need for carbohydrate interventions for hypoglycaemia during the bionic pancreas period.",0,0,0,0,N,N,N,0,0,0,0
235,Results of Ly and colleagues’ study showed no difference in time in target range (3·9–10 mmol/L [70–180 mg/dL]) between the two groups or any other improvement in glucose control with their insulin-only artificial pancreas.,0,0,0,0,N,N,N,0,0,0,0
236,"To our knowledge, this is the first outpatient study of automated glycaemic control in preadolescent children.",0,0,0,0,N,N,N,0,0,0,0
237,"We show that the bionic pancreas reduced mean glucose concentration, increased the time in the target glucose range (3·9–10 mmol/L [70–180 mg/dL]), reduced the time spent with hypoglycaemia, and reduced the need for carbohydrate interventions for hypoglycaemia versus insulin pump therapy managed by the camp medical staff.",0,0,0,0,N,N,N,0,0,0,0
238,"This is the first time, to our knowledge, that an automated glucose control system has been shown to be effective in young children, who are often unable to take care of themselves without the assistance of adult caregivers and are therefore likely to particularly benefit from automated glycaemic control.",0,0,0,0,N,N,N,0,0,0,0
239,A bihormonal bionic pancreas can improve glycaemic regulation in children compared with standard insulin pump therapy in a highly supervised diabetes camp environment that is designed to provide optimum management of diabetes.,0,0,0,0,N,N,N,0,0,0,0
240,Longer outpatient trials in the less supervised home and school environments of preadolescent children are warranted.,0,0,0,0,N,N,N,0,0,0,0
241,Open In Web Browser,0,0,0,0,N,N,N,0,0,0,0