Sentence-ID,Sentence-String,Q1,Q2,Q3,Q4,Q5,Q6,Q7,Q8,Q9,Q10,Q11
126,"The participants were representative of a typical stroke population in rehabilitation according to most demographic and stroke characteristics, although they were more dependent than stroke patients in the most recent clinical audit of Australian rehabilitation services by the National Stroke Foundation according to average FIM scores.",0,0,N,1,N,N,N,1,N,1,1
127,"There were no significant differences in the demographic or clinical features, swallowing severity, or food or fluid consistency between patients allocated to the two arms of the RCT demonstrating that the groups were comparable at baseline and that any differences could be attributed to the intervention.",0,0,N,1,N,N,N,1,N,1,1
128,"Contrary to our expectations and previous reports, the total beverage intake of participants in the water protocol group of 1103 ml was not higher than for those who consumed thickened liquids only, demonstrating that participants offset the amount of water they consumed by drinking less of the thickened liquids.",0,0,N,0,N,N,N,0,N,0,0
129,"Given there was no other influence on fluid intake from demographic or stroke related clinical factors such as age, sex, mobility/ambulation or level of dependency, it is likely that the dysphagia itself limited their intake.",0,0,N,0,N,N,N,0,N,0,0
130,"Even when given the choice to drink water, participants in the water protocol group drank more thickened liquids (807 mls) than water (299 mls), a finding that is consistent with the other published water protocol studies.",0,0,N,0,N,N,N,0,N,0,0
131,Of concern was that a large number of participants (71 %) were classified as dehydrated at entry to the study as objectively measured by BUN/Cr ratio.,0,0,N,0,N,N,N,0,N,0,0
132,"Notably, the hydration of participants in the water protocol group demonstrated a trend of improvement, in contrast to the deteriorating trend of those in the thickened liquids only group.",0,0,N,0,N,N,N,0,N,0,0
133,"Although none of these changes over time were significant, the calculated effect sizes were promising.",0,0,N,0,N,N,N,0,N,0,0
134,"As there were no differences in hydration measures between the groups according to factors such as age, sex, mobility/ambulation or dependency, the finding suggests that water may have contributed to the apparent difference in trajectories, despite participants in the water protocol group drinking only 300 ml of water on average per day.",0,0,N,0,N,N,N,0,N,0,0
135,"The exact mechanism for this apparent difference in hydration, without an associated overall increase in fluid intake, from a physiological and biochemical point of view, is not known.",0,0,N,0,N,N,N,0,N,0,0
136,"The groups were equivalent in terms of baseline diet consistencies, so it cannot be assumed that food contributed to the difference.",0,0,N,0,N,N,N,0,N,0,0
137,"Rather, it could be hypothesized that water is more accessible to the body than thickened liquids for the purposes of hydration, particularly in removing waste products from the blood, a finding that is juxtaposed to research which indicated there is no evidence for the reduced availability of water from thickened liquids.",0,0,N,0,N,N,N,0,N,0,0
138,Further biochemical exploration of the potential benefits to hydration of consuming small amounts of water in the rehabilitation phase of dysphagia post stroke is warranted.,0,0,N,0,N,N,N,0,N,0,0
139,This study provided unique findings about health outcomes.,0,0,N,0,N,N,N,0,N,0,0
140,Participants in the thickened liquids only group had significantly more UTIs than those in the water protocol group.,0,0,N,0,N,N,N,0,N,0,0
141,"It is recognized that UTIs can be associated with many factors other than fluid intake, such as incontinence, catheterisation, medications and mobility but, in theory, these other factors should have been accounted for by the randomization process.",0,0,N,0,N,N,N,0,N,0,0
142,"In this study, 21 % of participants across both groups were medically diagnosed to be dehydrated.",0,0,N,0,N,N,N,0,N,0,0
143,"This is in contrast to the findings of other studies of water protocols, which found no adverse events for any of their participants.",0,0,N,0,N,N,N,0,N,0,0
144,This discrepancy may be attributable to the differing definitions for dehydration and follow-up periods.,0,0,N,0,N,N,N,0,N,0,0
145,"Notably, no participants in either group developed aspiration pneumonia, a finding consistent with previous reports but in contrast to another.",0,0,N,0,N,N,N,0,N,0,0
146,The mandated oral hygiene routine which resulted in significant improvement in participants’ oral health scores in just 1 week from enrolment may have contributed to this outcome.,0,0,N,0,N,N,N,0,N,0,0
147,"The resolution of dysphagia for thin liquids for participants in the water protocol group was faster, albeit not significantly, than for those in the thickened liquids only group, in line with a previous report.",0,0,N,0,N,N,N,0,N,0,0
148,"Together, these findings may indicate that allowing patients to “practice” drinking thin liquids in the relatively safe form of water, may in fact promote recovery of dysphagia for thin liquids, in accordance with the principles of experience dependent neuroplasticity.",0,0,N,0,N,N,N,0,N,0,0
149,"A surprising finding was that participants in the water protocol group rated their overall satisfaction with water at a similar level to that for thickened liquids and, when asked their preferred drink, were evenly split in their choice between water and thickened liquids.",0,0,N,0,N,N,N,0,N,0,0
150,"On average, they rated the taste of thickened liquids higher than the taste of water.",0,0,N,0,N,N,N,0,N,0,0
151,"It would appear that individuals’ taste preferences play an important role in what they drink when given a choice; some like the taste of tap water, whilst others do not.",0,0,N,0,N,N,N,0,N,0,0
152,"The participants’ ambivalence about thickened liquids is in contrast to the common perception of clinicians, who frequently report that patients’ dislike of thickened liquids is the main reason for their poor intake, and previously published satisfaction reports about water protocols.",0,0,N,0,N,N,N,0,N,0,0
153,It is acknowledged that this study had methodological limitations and the findings should therefore be interpreted in this context.,0,0,N,0,N,N,N,0,N,0,0
154,The use of fluid balance charts as a measure of fluid intake may have resulted in inaccurate amounts being recorded despite procedures being established to minimize errors.,0,0,N,0,N,N,N,0,N,0,0
155,The amount of beverages offered to individual participants in this study was not controlled or recorded and may have varied between individuals and institutions which may have differentially influenced consumption.,0,0,N,0,N,N,N,0,N,0,0
156,"In addition, fluid from food sources was not measured although it was assumed that the randomization process and equivalence of groups at baseline accounted for any differences in fluid intake from food.",0,0,N,0,N,N,N,0,N,0,0
157,"Furthermore, it is acknowledged that the use of a single biochemical metric (BUN/Cr ratio) is a limitation as the clinical diagnosis of dehydration is complex and highly variable in any clinical setting.",0,0,N,0,N,N,N,0,N,0,0
158,"Clearly, sample size was a major limitation, and, despite being designed as a multi-centre RCT, the number of patients proceeding to group allocation and intervention was small.",0,0,N,0,N,N,N,0,N,0,0
159,This resulted in the study being underpowered to demonstrate hypothesized differences between groups.,0,0,N,0,N,N,N,0,N,0,0
160,Reasons for poor recruitment included the narrow window of time between the patient with dysphagia no longer requiring supplementary non-oral feeding and then being upgraded to thin liquids due to the rapid recovery in the first weeks post stroke; the large numbers of exclusions due to COPD; and the number of potential candidates who were deemed to be aspirating thin liquids on a clinical assessment but subsequently had to be excluded as aspiration of thin liquid was not detected during VFSS.,0,0,N,0,N,N,N,0,N,0,0
161,"Notably, the sample size of the present study was similar to previous studies utilizing similar exclusion criteria and instrumental assessment to classify participants as aspirating.",0,0,N,0,N,N,N,0,N,0,0
162,"Whilst distinct exclusion and inclusion criteria are necessary for experimental rigour, it is acknowledged that generalizability to the wider stroke population is thereby sacrificed.",0,0,N,0,N,N,N,0,N,0,0
163,"Future studies of water protocols may benefit from a thorough interdisciplinary review of inclusion and exclusion criteria, in particular with regard to participants’ respiratory status.",0,0,N,0,N,N,N,0,N,0,0
164,"In conclusion, the water protocol employed in this study did not result in an increase in total fluid intake.",0,0,N,0,N,N,N,0,N,0,0
165,"However, those who were permitted water had an improving trajectory of hydration levels compared to those on thickened liquids only, suggesting even a small amount of water per day may make a difference to hydration levels.",0,0,N,0,N,N,N,0,N,0,0
166,There is also an indication that water protocols may hasten the resolution of dysphagia for thin liquids.,0,0,N,0,N,N,N,0,N,0,0
167,"Given there were no increased adverse outcomes for participants who were allowed to drink water and, importantly, there were no diagnoses of pneumonia, the findings reinforce current evidence about the relative safety of water protocols for patients in rehabilitation post stroke with similar profiles (i.e.",0,0,N,0,N,N,N,0,N,0,0
168,"no history of COPD, reduced immune status, neuro-degenerative disease, or head and neck cancer).",0,0,N,0,N,N,N,0,N,0,0
169,"Future research should revisit the exclusion criteria to widen potential applicability to more patients post stroke, consider the measurement of total fluid intake by including fluid from food sources, use multiple indices to measure hydration and investigate the safety of water protocols for patients in acute settings.",0,0,N,0,N,N,N,0,N,0,0