Sentence-ID,Sentence-String,Q1,Q2,Q3,Q4,Q5,Q6,Q7,Q8,Q9,Q10,Q11
159,This could explain the relatively mild TAS increase observed in our study.,0,0,0,0,0,0,0,0,0,0,0
160,More prolonged and intense computer work could aggravate TAS.,0,0,0,0,0,0,0,0,0,0,0
161,Another limitation of this study is the lack of eye exercises screening of the participants.,0,0,0,0,0,0,0,0,0,0,0
162,"Recently, awareness regarding the eye disorders is on the rise and many people are doing regular eye exercises which can have significant impact on the study.",0,0,0,0,0,0,0,0,0,0,0
163,"In addition, although DA9301 was found to significantly alleviate asthenopia induced by table computer watching, a reverse trial of DA9301 and placebo (applying DA9301 in placebo group and vice versa) after a washout period may significantly enhance the strength of our result.",0,0,0,0,0,0,0,0,0,0,0
164,Oral intake of DA9301 was effective in alleviating CVS induced by a tablet computer and this could be attributed to its strong antioxidant potential.,0,0,0,0,0,0,0,0,0,0,0
165,Further investigation of the mechanisms underlying the effect of DA9301 is warranted.,0,0,0,0,0,0,0,0,0,0,0
166,"The authors appreciate Dong-A ST Co., Ltd. for its generous support of DA9301.",0,0,0,0,0,0,0,0,0,0,0
167,"This study was partially supported by a grant of the Korea Health Technology R&amp;D Project through the Korea Health Industry Development Institute (KHIDI), funded by the Ministry of Health &amp; Welfare, Republic of Korea (Grant number: HI-15C1653).",0,0,0,0,0,0,0,0,0,0,0
168,"This study was partially supported by a grant of the Korea Health Technology R&amp;D Project through the Korea Health Industry Development Institute (KHIDI), funded by the Ministry of Health &amp; Welfare, Republic of Korea (Grant number: HI-15C1653).",0,0,0,0,0,0,0,0,0,0,0
169,"The study is registered at <a href=""http://www.clinicaltrials.gov"">www.clinicaltrials.gov</a> (registration number: NCT 02641470).",0,0,0,0,0,0,0,0,0,0,0
170,"The data that support the findings of this study are available from Clinical Research Center located in Ilsan Hospital, Dongguk University, Goyang, South Korea but restrictions apply to the availability of these data, which were used under license for the current study, and so are not publicly available.",0,0,0,0,0,0,0,0,0,0,0
171,"Data are however available from the authors upon reasonable request and with permission of Clinical Research Center located in Ilsan Hospital, Dongguk University, Goyang, South Korea.",0,0,0,0,0,0,0,0,0,0,0
172,"CYP: design of the study, interpretation of data, drafting the manuscript, revising manuscript, give final approval for the version to be published.",0,0,0,0,0,0,0,0,0,0,0
173,"NG: design of the study, interpretation of data, drafting the manuscript, revising manuscript.",0,0,0,0,0,0,0,0,0,0,0
174,"CYL: design of the study, analysis and interpretation of data, drafting the manuscript.",0,0,0,0,0,0,0,0,0,0,0
175,"JHO: design of the study, acquisition of data, revising manuscript.",0,0,0,0,0,0,0,0,0,0,0
176,"MC: design of the study, acquisition of data, revising manuscript.",0,0,0,0,0,0,0,0,0,0,0
177,"MK: design of the study, acquisition of data, drafting the manuscript.",0,0,0,0,0,0,0,0,0,0,0
178,"MYR: design of the study, interpretation of data, drafting the manuscript.",0,0,0,0,0,0,0,0,0,0,0
179,All authors read and approved the final manuscript.,0,0,0,0,0,0,0,0,0,0,0
180,The authors declare that they have no competing interest.,0,0,0,0,0,0,0,0,0,0,0
181,Not applicable.,0,0,0,0,0,0,0,0,0,0,0
182,"The manuscript does not include details, images, or videos relating to individual participants.",0,0,0,0,0,0,0,0,0,0,0
183,Informed consent to participate in this study was obtained from all participants as stated in the manuscript.,0,0,0,0,0,0,0,0,0,0,0
184,"This study followed the tenets of the Declaration of Helsinki and was approved by the institutional review board (IRB) of Ilsan Hospital, Dongguk University (IRB approval number: 2013–95).",0,0,0,0,0,0,0,0,0,0,0
185,"Articles from BMC Complementary and Alternative Medicine are provided here courtesy of <span class=""bold"">BioMed Central",0,0,0,0,0,0,0,0,0,0,0
186,PMC Copyright Notice,0,0,0,0,0,0,0,0,0,0,0
187,"The articles available from the PMC site are protected by copyright, even though access is free.",0,0,0,0,0,0,0,0,0,0,0
188,Copyright is held by the respective authors or publishers who provide these articles to PMC.,0,0,0,0,0,0,0,0,0,0,0
189,Users of PMC are responsible for complying with the terms and conditions defined by the copyright holder.,0,0,0,0,0,0,0,0,0,0,0
190,"Users should assume that standard copyright protection applies to articles in PMC, unless an article contains an explicit license statement that gives a user additional reuse or redistribution rights.",0,0,0,0,0,0,0,0,0,0,0
191,PMC does not allow automated/bulk downloading of articles that have standard copyright protection.,0,0,0,0,0,0,0,0,0,0,0
192,"See the copyright notice on the PMC site, <a href=""https://www.ncbi.nlm.nih.gov/pmc/about/copyright/"">https://www.ncbi.nlm.nih.gov/pmc/about/copyright/</a>, for further details and specific exceptions.",0,0,0,0,0,0,0,0,0,0,0