Sentence-ID,Sentence-String,Q1,Q2,Q3,Q4,Q5,Q6,Q7,Q8,Q9,Q10,Q11
165,Epithelial keratitis (SPK) occurs due to adenovirus replication within the corneal epithelium.,0,0,N,0,0,0,0,0,0,0,0
166,"In the present study, we found a rise in epithelial keratitis in the dexamethasone and artificial tears group by the 7th day of treatment.",0,0,N,0,0,0,0,0,0,0,0
167,It can be assumed that in the study group PVI counteracted the effect of dexamethasone on SEI.,0,0,N,0,0,0,0,0,0,0,0
168,"Thus, by combining PVI and dexamethasone, we achieve the combination of the antiviral effect of PVI and the anti‐inflammatory effect of dexamethasone.",1,0,N,0,0,0,0,0,0,0,0
169,An in vitro study that investigated PVI for treatment of adenoviral keratoconjunctivitis 34 reported that diluted PVI at concentration of 0.8% completely extinguishes infectivity of free adenovirus after an exposure of 10 min and is less effective against intracellular adenovirus.,0,0,N,0,0,0,0,0,0,0,0
170,"This fact tends to suggest that the earlier the PVI treatment starts, the more likely it is that the virus can be eradicated.",0,0,N,0,0,0,0,0,0,0,0
171,The serotype 8 was identified in most eyes (83%) in our study.,0,0,N,0,0,0,0,0,0,0,0
172,"It is known that adenovirus type 8 is responsible for EKC, in its most frequent and aggressive form (Nicholson 1993; Aoki & Tagawa 2002).",0,0,N,0,0,0,0,0,0,0,0
173,The present study also contains limitations.,0,0,N,0,0,0,0,0,0,0,0
174,"Although this study was double‐blinded, concealing the dark brown colour of the PVP‐I drops proved to be difficult and therefore not performed.",0,0,N,0,1,1,0,0,0,0,0
175,"In addition, this study was limited to patients with a disease duration of up to 3 days, as opposed to the inclusion of patients with a disease duration of up to 2 weeks used in a recent randomized placebo‐controlled trial of topical steroids in presumed keratoconjunctivitis (Adleberg & Wittwer 1995).",0,0,N,0,0,0,0,0,0,0,0
176,"Thus, its conclusions may not be applied to treatment initiated later than 3 days in the course of the disease.",0,0,N,0,0,0,0,0,0,0,0
177,"Although desirable, an arm of PVP‐I alone was not ethically authorized, we can only speculate that such a treatment would have been as efficient as its combination with dexamethasone 1% meriting further research in this regard.",0,0,N,0,0,0,0,0,0,0,0
178,A potential limitation of this study is that some serotypes may have more aggressive disease course than others and as such the difference in distribution of serotypes between treatment arms might have influenced the results of this study.,0,0,N,0,0,0,0,0,0,0,0
179,"Last, this study's follow‐up was limited to 7 days of treatment and therefore further studies should plan longer follow‐up times to monitor the longer‐term effects of this treatment specifically in terms of prevention of formation of SEI.",0,0,N,0,0,0,0,0,0,0,0
180,"In conclusion, our results indicate that the combination of PVI 1.0%/dexamethasone 0.1% is effective in treating adenoviral keratoconjunctivitis.",0,0,N,0,0,0,0,0,0,0,0
181,"This combination improved the patient's ailment and clinical signs to almost complete recovery in 5–7 days, which correlated with the eradication of the virus by PCR.",0,0,N,0,0,0,1,0,0,0,0
182,Further studies are needed to test the long term safety of this treatment.,0,0,N,0,0,0,0,0,0,0,0