Sentence-ID,Sentence-String,Q1,Q2,Q3,Q4,Q5,Q6,Q7,Q8,Q9,Q10,Q11
0,"The dramatic rise in the use of smartphones, tablets, and laptop computers over the past decade has raised concerns about potentially deleterious health effects of increased “screen time” (ST) and associated short-wavelength (blue) light exposure.",N,0,0,0,N,N,N,0,0,0,0
1,"We determined baseline associations and effects of 6 months’ supplementation with the macular carotenoids (MC) lutein, zeaxanthin, and mesozeaxanthin on the blue-absorbing macular pigment (MP) and measures of sleep quality, visual performance, and physical indicators of excessive ST. Forty-eight healthy young adults with at least 6 h of daily near-field ST exposure participated in this placebo-controlled trial.",N,0,0,0,N,N,N,0,0,0,0
2,"Visual performance measures included contrast sensitivity, critical flicker fusion, disability glare, and photostress recovery.",N,0,0,0,N,N,N,0,0,0,0
3,Physical indicators of excessive screen time and sleep quality were assessed via questionnaire.,N,0,0,0,N,N,N,0,0,0,0
4,MP optical density (MPOD) was assessed via heterochromatic flicker photometry.,N,0,0,0,N,N,N,0,0,0,0
5,"At baseline, MPOD was correlated significantly with all visual performance measures (<span class=""italic"">p</span> &lt; 0.05 for all).",N,0,0,0,N,N,N,0,0,0,0
6,"MC supplementation (24 mg daily) yielded significant improvement in MPOD, overall sleep quality, headache frequency, eye strain, eye fatigue, and all visual performance measures, versus placebo (<span class=""italic"">p</span> &lt; 0.05 for all).",N,0,0,0,N,N,N,0,0,0,0
7,"Increased MPOD significantly improves visual performance and, in turn, improves several undesirable physical outcomes associated with excessive ST.",N,0,0,0,N,N,N,0,0,0,0
8,"The improvement in sleep quality was not directly related to increases in MPOD, and may be due to systemic reduction in oxidative stress and inflammation.",N,0,0,0,N,N,N,0,0,0,0
9,"Prior to the advent of artificial lighting, the sun was the primary source of light.",N,0,0,0,N,N,N,0,0,0,0
10,"When the sun sets today, however, one is hard-pressed to find darkness—illumination from light-emitting diodes (LEDs), and incandescent, fluorescent, and xenon-arc sources (among others) provide indoor and outdoor illumination.",N,0,0,0,N,N,N,0,0,0,0
11,"The effects of exposure to this seemingly unnatural technological adaptation are starting to become evident, with several studies indicating undesirable associations between exposure to artificial light at night and both reduced sleep quality [<a href=""#B1-foods-06-00047"">1</a>,<a href=""#B2-foods-06-00047"">2</a>] and diminished alertness during the day [<a href=""#B3-foods-06-00047"">3</a>].",N,0,0,0,N,N,N,0,0,0,0
12,A relatively recent concern is the excessive near-field exposure to handheld and other electronic light-emitting devices.,N,0,0,0,N,N,N,0,0,0,0
13,"Estimates from large population surveys in developed countries indicate that 35% of people born between the years of 1965 and 1996 spend at least 9 h/day on digital devices, such as smartphones, tablets, or computers [<a href=""#B4-foods-06-00047"">4</a>], and a recent report indicates that the average American spends 10 h and 39 min viewing screens [<a href=""#B5-foods-06-00047"">5</a>].",N,0,0,0,N,N,N,0,0,0,0
14,"Such intense use of these devices has been found to have undesirable effects not only on sleep quality and alertness during waking hours, but also on parameters of physical health (e.g., neck and eye strain, eye fatigue, headache; [<a href=""#B6-foods-06-00047"">6</a>,<a href=""#B7-foods-06-00047"">7</a>,<a href=""#B8-foods-06-00047"">8</a>]) and cognitive performance (e.g., poor inhibitory control; [<a href=""#B9-foods-06-00047"">9</a>]).",N,0,0,0,N,N,N,0,0,0,0
15,"The prevalence of complaints associated with excessive use of computers and other digital devices is so great that the common ocular and physical effects have been collectively termed “Computer Vision Syndrome” (CVS; for a review please see [<a href=""#B10-foods-06-00047"">10</a>]).",N,0,0,0,N,N,N,0,0,0,0
16,"An additional concern is the potential for retinal damage from cumulative, excessive exposure to the relatively high-energy, short-wavelength (blue) light produced by these devices.",N,0,0,0,N,N,N,0,0,0,0
17,"In the case of LED-based devices, for example, a vivid white background is composed of blue light (emitted from an electrically activated phosphor) that is either passed through a yellow filter, or mixed with the output of red and green LEDs [<a href=""#B11-foods-06-00047"">11</a>].",N,0,0,0,N,N,N,0,0,0,0
18,"In either case, blue is the peak of the overall output of the LED.",N,0,0,0,N,N,N,0,0,0,0
19,"Although the blue component in an LED is relatively strong, it is not nearly intense enough to produce acute damage in the retina.",N,0,0,0,N,N,N,0,0,0,0
20,"There is, however, potential for long-term, cumulative effects, including cellular damage arising primarily from increased oxidative stress [<a href=""#B12-foods-06-00047"">12</a>].",N,0,0,0,N,N,N,0,0,0,0
21,"Because of their consistency, efficiency, and durability, LEDs have become the prevalent light source for devices ranging from smartphones to computer displays to televisions [<a href=""#B4-foods-06-00047"">4</a>].",N,0,0,0,N,N,N,0,0,0,0
22,"The potential for damage from blue light in the retina has been met with a favorable adaptation in the eye: a diet-derived, blue-absorbing pigment composed of the dietary carotenoids lutein (L) and zeaxanthin (Z).",N,0,0,0,N,N,N,0,0,0,0
23,"L and Z are found in relatively high concentrations in leafy-green vegetables [<a href=""#B13-foods-06-00047"">13</a>], and along with the Z isomer mesozeaxanthin (MZ), are deposited in rich concentrations in the macular retina [<a href=""#B14-foods-06-00047"">14</a>].",N,0,0,0,N,N,N,0,0,0,0
24,"Due to their specific location, they are referred to as the macular carotenoids (MC); due to their yellow–orange pigmentation, they are collectively known as macular pigment (MP).",N,0,0,0,N,N,N,0,0,0,0
25,"All three MCs are potent antioxidants, which forms the basis of their putative role in protecting the retina from cumulative damage that can result in age-related macular degeneration (AMD) [<a href=""#B15-foods-06-00047"">15</a>,<a href=""#B16-foods-06-00047"">16</a>].",N,0,0,0,N,N,N,0,0,0,0
26,"Indeed, the fovea’s metabolic demand for oxygen, and resulting potential for oxidative stress, is the highest of any tissue in the human body [<a href=""#B17-foods-06-00047"">17</a>].",N,0,0,0,N,N,N,0,0,0,0
27,"Because of its yellow–orange pigmentation and its location anterior to the photoreceptors, MP also acts as a blue light filter that protects against photo-oxidation of the vulnerable lipid-rich photoreceptor outer segments.",N,0,0,0,N,N,N,0,0,0,0
28,"Additionally, MP has been shown previously to significantly improve several aspects of visual performance that may be related to outcomes associated with excessive ST exposure, such as contrast sensitivity [<a href=""#B18-foods-06-00047"">18</a>,<a href=""#B19-foods-06-00047"">19</a>,<a href=""#B20-foods-06-00047"">20</a>,<a href=""#B21-foods-06-00047"">21</a>], temporal vision [<a href=""#B22-foods-06-00047"">22</a>,<a href=""#B23-foods-06-00047"">23</a>,<a href=""#B24-foods-06-00047"">24</a>], and several aspects of visual performance in glare, including visual discomfort [<a href=""#B25-foods-06-00047"">25</a>,<a href=""#B26-foods-06-00047"">26</a>], disability glare [<a href=""#B27-foods-06-00047"">27</a>,<a href=""#B28-foods-06-00047"">28</a>], and photostress recovery [<a href=""#B27-foods-06-00047"">27</a>,<a href=""#B28-foods-06-00047"">28</a>,<a href=""#B29-foods-06-00047"">29</a>].",N,0,0,0,N,N,N,0,0,0,0
29,"The present study was motivated not only by the potential deleterious effects of the precipitous recent increase in the use of near-field technological devices (e.g., smartphones), but also the fact that the optical density (OD) of MP (MPOD) is (given its source in the diet) notoriously variable among people, ranging from 0 to well over 1 logarithmic unit of OD [<a href=""#B30-foods-06-00047"">30</a>].",N,0,0,0,N,N,N,0,0,0,0
30,"If there exists a benefit for MPOD in terms of negative effects of excessive ST, are those with little or no MP compromised?",N,0,0,0,N,N,N,0,0,0,0
31,"This question was addressed by the two primary goals of our study: (1) to characterize the baseline relationships between MPOD, visual performance measures, sleep quality, and physical indicators of excessive screen time (ST) in young, healthy adults; and (2) to determine effects of a 6-month MC supplementation on these same outcomes.",N,0,0,0,N,N,N,0,0,0,0
32,This study was reviewed and approved by the University of Georgia Institutional Review Board.,N,0,1,1,N,N,N,0,0,0,0
33,"Informed consent was obtained for each subject, and the study adhered to the tenets of the Declaration of Helsinki.",N,0,1,1,N,N,N,0,0,0,0
34,"Forty-eight subjects, recruited from the population of students at the University of Georgia in Athens, Georgia, participated in this 6-month, double-blind, randomized, placebo-controlled supplementation trial.",N,0,1,1,N,N,N,0,0,0,0
35,"Subjects were healthy, college-aged (18–25, mean = 21.2 years; 25 female/23 male) non-smokers with a body mass index (BMI) &lt;27.",N,0,1,1,N,N,N,0,0,0,0
36,"The concern with BMI involves not only good general health, but also the possibility that, being lipid-soluble, supplemented macular carotenoids may be deposited in adipose tissue, thus reducing the fraction deposited in the retina.",N,0,1,1,N,N,N,0,0,0,0
37,A BMI of 27 is higher than “normal” (18.5–24.9) but falls well below “obese” (BMI = 30 or greater).,N,0,0,0,N,N,N,0,0,0,0
38,"We had seven participants who approached 27, and five of them were athletes (whose muscle structure accounted for the relatively high BMI).",N,0,0,0,N,N,N,0,0,0,0
39,Subjects were instructed to maintain their current diet; those that were planning on changing their diet (for whatever reason) were excluded from consideration for the trial.,N,0,0,0,N,N,N,0,0,0,0
40,"For those subjects enrolled in the trial, stability of diet was evaluated via questionnaire at each visit.",N,0,0,0,N,N,N,0,0,0,0
41,"In consideration of vision testing, all subjects had uncorrected or contact lens-corrected visual acuity of 20/20 or better in the test (right) eye, and had no current or previous history of ocular pathology.",N,0,0,0,N,N,N,0,0,0,0
42,"Subjects wearing spectacles for vision correction were not considered for the study, due primarily to potential reflection and coating-mediated light absorption issues with glare testing.",N,0,0,0,N,N,N,0,0,0,0
43,Subjects were also screened to ensure that they spent at least 6 h daily viewing screens at a distance of 3 feet or less.,N,0,0,0,N,N,N,0,0,0,0
44,"Items specific to smartphones, tablets, computers, and television viewing were included on the questionnaire.",N,0,0,0,N,N,N,0,0,0,0
45,"Measures of all visual and physical parameters (detailed below) were taken at baseline, 3 months and 6 months.",N,0,0,0,N,N,N,0,0,0,0
46,"Subjects were randomly assigned to either placebo (<span class=""italic"">n</span> = 13) or MC supplement (<span class=""italic"">n</span> = 35) groups.",N,1,0,0,N,N,N,0,0,0,0
47,"Pills for each group were identical, brown-colored, soft gelatin capsules.",N,0,0,0,N,N,N,0,0,0,0
48,"Placebos contained no L, Z, or MZ, but only safflower oil.",N,0,0,0,N,N,N,0,0,0,0
49,"Independent analysis indicated that the active supplement pills (Lutemax 2020 formulation) contained 24 mg of L, Z, and MZ suspended in safflower oil at a ratio of 83%:10%:7%, respectively.",N,0,0,0,N,N,N,0,0,0,0
50,All reported values were within +/−5% sum total variability.,N,0,0,0,N,N,N,0,0,0,0
51,"A previous investigation [<a href=""#B31-foods-06-00047"">31</a>] of these supplements demonstrated good bioavailability, as indicated by significant serum response.",N,0,0,0,N,N,N,0,0,0,0
52,Subjects were instructed to ingest one pill with a meal (preferably lunch or dinner) every day.,N,0,0,0,N,N,N,0,0,0,0
53,Compliance was ensured with weekly phone calls and pill counts.,N,0,0,0,N,N,N,0,0,0,0
54,2.2. Measurement of Macular Pigment Optical Density (MPOD),N,0,0,0,N,N,N,0,0,0,0
55,"MPOD was assessed with a non-invasive, perceptual task called heterochromatic flicker photometry (HFP).",N,0,0,0,N,N,N,0,0,0,0
56,"A densitometer (Macular Metrics Corp., Rehoboth, MA, USA) described by Wooten et al.",N,0,0,0,N,N,N,0,0,0,0
57,"[<a href=""#B32-foods-06-00047"">32</a>] was used for this purpose.",N,0,0,0,N,N,N,0,0,0,0
58,"The densitometer, detailed measurement procedures, and the principle of HFP have been fully described in earlier publications (e.g., [<a href=""#B33-foods-06-00047"">33</a>,<a href=""#B34-foods-06-00047"">34</a>]).",N,0,0,0,N,N,N,0,0,0,0
59,"Briefly, subjects are presented with two superimposed lights that are temporally alternated in square-wave counterphase.",N,0,0,0,N,N,N,0,0,0,0
60,This creates the perception of a flickering disc of light for the subject.,N,0,0,0,N,N,N,0,0,0,0
61,"The peak (550 nm) of the spectral composition of one of the lights is chosen to bypass the absorption of MP, and the other (460 nm) is strongly absorbed by MP.",N,0,0,0,N,N,N,0,0,0,0
62,"The subject’s task is to adjust the relative radiance of the two lights until a percept of no flicker, due to perceived isoluminance, is achieved.",N,0,0,0,N,N,N,0,0,0,0
63,"All other factors being equal, a subject that requires more short-wave (i.e., 460 nm) relative to middle-wave (i.e., 550 nm) light to achieve null flicker has higher MPOD.",N,0,0,0,N,N,N,0,0,0,0
64,"This task is performed for the locations of interest within the fovea, which presumably contain MP, and for a reference location in the parafovea that does not (about 7° eccentricity).",N,0,0,0,N,N,N,0,0,0,0
65,"To obtain a measure of MPOD at a given test locus, the logarithmic ratio of short- to middle-wave radiance (for null flicker) at the reference location is subtracted from the corresponding logarithmic ratio found at the test locus.",N,0,0,0,N,N,N,0,0,0,0
66,"We obtained spatial profiles of MPOD at each visit, with measures at 10’, 20’, 30’, 1.75 degrees, and 2.75 degrees of retinal eccentricity.",N,0,0,0,N,N,N,0,0,0,0
67,"MPOD for centrally-viewed relatively small (less than or equal to 1.5 degrees) circular targets has been shown to correspond to the edge of the disc [<a href=""#B35-foods-06-00047"">35</a>].",N,0,0,0,N,N,N,0,0,0,0
68,"Therefore, our stimuli of 20’, 40’, and 10 of visual angle corresponded to 10’, 20’, and 30’ retinal eccentricities.",N,0,0,0,N,N,N,0,0,0,0
69,"For measures corresponding to 1.75 and 2.75 degrees of retinal eccentricity, subjects viewed a small fixation dot in the center of annuli with diameters of 3.5 and 5.5 degrees, respectively.",N,0,0,0,N,N,N,0,0,0,0
70,"Due to the nature of the variables tested in the study (involving relatively large viewing angles), we averaged MPOD across participants’ spatial distributions.",N,0,0,0,N,N,N,0,0,0,0
71,"Although this technique effectively compresses any absolute increases in OD, it yields a more reasonable estimate of the overall effect of MP across the macula.",N,0,0,0,N,N,N,0,0,0,0
72,The total time spent on MPOD measurement was 15 min per session.,N,0,0,0,N,N,N,0,0,0,0
73,"Subjects were presented with a 550 nm narrow-band (10 nm at half peak), 1-degree disc of light that was alternated on and off in square-wave counterphase.",N,0,0,0,N,N,N,0,0,0,0
74,Thresholds for flicker fusion (when the light was flickering at a rate such that there was no longer any flickering or pulsing evident) were obtained for both ascending and descending trials.,N,0,0,0,N,N,N,0,0,0,0
75,"For ascending trials, the rate of flicker was set well below the critical flicker fusion frequency (CFF) threshold, and at a rate of roughly 1 Hz/second, the flicker rate was increased by the experimenter until the participant indicated complete flicker fusion.",N,0,0,0,N,N,N,0,0,0,0
76,"On descending trials, the rate of flicker was set well above the CFF threshold, and then decreased roughly 1 Hz/second until the participant just noticed minimal pulsing or flicker.",N,0,0,0,N,N,N,0,0,0,0
77,The overall threshold for the CFF task was calculated as the average of two ascending and two descending thresholds; the task took 1 min for subjects to complete.,N,0,0,0,N,N,N,0,0,0,0
78,"During each visit, participants completed a short questionnaire regarding the weekly frequency of occurrence of five outcome variables typically associated with excessive ST: headache, blurry vision, neck strain, eye strain, and eye fatigue.",N,0,0,0,N,N,N,0,0,0,0
79,"If a specific item occurred less frequently than once/week, but still occurred on a monthly basis (e.g., twice/month), participants were instructed to write down the monthly frequency next to the item.",N,0,0,0,N,N,N,0,0,0,0
80,"For calculation purposes, a month was considered four weeks; monthly frequency was therefore simply divided by four to yield a weekly value.",N,0,0,0,N,N,N,0,0,0,0
81,The questionnaire took approximately 5 min to complete.,N,0,0,0,N,N,N,0,0,0,0
82,"Sleep quality was evaluated with the Pittsburgh Sleep Quality index (PSQI; [<a href=""#B36-foods-06-00047"">36</a>]), a 19-item self-rated questionnaire.",N,0,0,0,N,N,N,0,0,0,0
83,"The PSQI determines the number of undesirable sleep symptoms (e.g., “wake up in the middle of the night”), which are then weighted for severity and used to calculate the overall sleep quality score.",N,0,0,0,N,N,N,0,0,0,0
84,The questionnaire took subjects approximately 5 min to complete.,N,0,0,0,N,N,N,0,0,0,0
85,Contrast sensitivity (CS) testing was conducted on the same computer/monitor as described above.,N,0,0,0,N,N,N,0,0,0,0
86,"A subject’s threshold for detection of a Gabor patch’s orientation (tilted right or left 45 degrees from vertical) was determined for a single stimulus, a 6 cycle/degree target subtending 2 degrees of visual angle.",N,0,0,0,N,N,N,0,0,0,0
87,"A two-alternative, forced-choice staircase procedure was implemented to determine a subject’s contrast threshold.",N,0,0,0,N,N,N,0,0,0,0
88,"If there was no response, it was recorded as incorrect.",N,0,0,0,N,N,N,0,0,0,0
89,Contrast was specified as Michelson contrast:,N,0,0,0,N,N,N,0,0,0,0
90,"where <span class=""italic"">Lmax</span> and <span class=""italic"">Lmin</span> represent the maximum and minimum luminance in a grating, respectively.",N,0,0,0,N,N,N,0,0,0,0
91,"Twenty-five stimulus presentations were used to determine a threshold, and trials always started with the Gabor set to maximum contrast (90% Michelson contrast).",N,0,0,0,N,N,N,0,0,0,0
92,"On correct responses, the contrast of the Gabor was decreased by 27% of its previous value.",N,0,0,0,N,N,N,0,0,0,0
93,Incorrect responses resulted in an increase of 21% of the previous Gabor’s contrast value.,N,0,0,0,N,N,N,0,0,0,0
94,"Based on the results of an ideal observer model, these values most accurately predicted actual contrast thresholds for a trial consisting of 25 stimulus presentations, averaging the last three reversals.",N,0,0,0,N,N,N,0,0,0,0
95,The subjects typically produced five or more reversals; actual thresholds were determined by computing the average of the last three reversals.,N,0,0,0,N,N,N,0,0,0,0
96,"Two thresholds were determined at each visit; the average of the two thresholds was taken as the true threshold, and used for statistical analysis.",N,0,0,0,N,N,N,0,0,0,0
97,A 1-min rest period was allowed between each trial.,N,0,0,0,N,N,N,0,0,0,0
98,Total time spent on contrast sensitivity testing was roughly 10 min.,N,0,0,0,N,N,N,0,0,0,0
99,A custom apparatus for assessing disability glare (DG) and photostress recovery (PSR) time was created to provide sufficient intensity of light and a uniform spatial distribution with minimal reliance on optics.,N,0,0,0,N,N,N,0,0,0,0
100,"A microcontroller, coupled to high-intensity cool-white LEDs, provided a pulse-width modulated signal, which permitted the glare and photostress sources to be held at an adjustable intensity for any needed duration, while maintaining a high degree of linearity and stability in adjustment.",N,0,0,0,N,N,N,0,0,0,0
101,The LEDs appear white by virtue of the phosphor emitting a strong blue component and a broad yellow–orange component.,N,0,0,0,N,N,N,0,0,0,0
102,"For human vision, a mix of blue and yellow sources will result in a range of whites, denoted “cool” to “warm” (e.g., [<a href=""#B37-foods-06-00047"">37</a>]).",N,0,0,0,N,N,N,0,0,0,0
103,"For the DG source, a ring of 47 LEDs were placed on a circuit board with a viewing hole in its center.",N,0,0,0,N,N,N,0,0,0,0
104,The LEDs were arranged in a circular pattern with a 20 mm radius to create a plane of uniform illumination at the pupil when held approximately 25 mm from the subject’s pupil.,N,0,0,0,N,N,N,0,0,0,0
105,The photostress source was created by using 45 of the same high-intensity cool-white LEDs arranged in an approximately square pattern with 5 mm center-to-center spacing of the LEDs.,N,0,0,0,N,N,N,0,0,0,0
106,"This arrangement was used to create a uniform, circular illumination pattern on an acrylic diffuser that subtended 10 degrees of visual angle and maintained an illumination of 12,000 lux.",N,0,0,0,N,N,N,0,0,0,0
107,The driving microcontroller was given commands over a serial connection to coordinate the intensity of the glare and photostress sources with a custom-made program that also produced visual targets for the subject.,N,0,0,0,N,N,N,0,0,0,0
108,"To control for any possible interocular effects (however unlikely), only the right eye was used for all vision testing.",N,0,0,0,N,N,N,0,0,0,0
109,"For both DG and PSR experiments, the target was a 6 cycle/degree, 15% Michelson contrast Gabor patch that subtended 2 degrees of visual angle.",N,0,0,0,N,N,N,0,0,0,0
110,The Gabor patch was presented centrally on an LCD monitor.,N,0,0,0,N,N,N,0,0,0,0
111,"The background luminance was 20 cd/m<sup>2</sup>, and appeared medium-gray to subjects.",N,0,0,0,N,N,N,0,0,0,0
112,"For the PSR experiment, subjects were aligned to the optical system via an adjustable chin and forehead rest.",N,0,0,0,N,N,N,0,0,0,0
113,"Once comfortable, subjects were instructed to direct their gaze at the center of the monitor.",N,0,0,0,N,N,N,0,0,0,0
114,"The photostress light (12,000 lux) was then presented for 8 s. Subjects were asked to look directly at the light, and try to refrain from blinking or closing their eyes.",N,0,0,0,N,N,N,0,0,0,0
115,"After the exposure was complete, subjects were advised to blink and look in the center of the monitor for the Gabor target, which was tilted 45 degrees left or right from vertical.",N,0,0,0,N,N,N,0,0,0,0
116,"Once the target was detected, subjects pressed either the left or right arrow key on a keyboard to indicate which direction the target was leaning.",N,0,0,0,N,N,N,0,0,0,0
117,"If correct, subjects were again presented with the photostress light for 8 s. This procedure was repeated until a total of 5 recovery thresholds were obtained.",N,0,0,0,N,N,N,0,0,0,0
118,"For DG testing, subjects viewed the Gabor patch target through the ring of LEDs.",N,0,0,0,N,N,N,0,0,0,0
119,"To guard against visual adaptation effects or potential subject bias, the Gabor patch was made to vertically tilt back and forth 45 degrees every second.",N,0,0,0,N,N,N,0,0,0,0
120,The experimenter adjusted the intensity of the LED ring to the point at which the veiling glare was sufficient to prevent a subject from detecting the tilting of the Gabor patch.,N,0,0,0,N,N,N,0,0,0,0
121,"Four thresholds were obtained: two approaching from below, and two approaching from above the visibility threshold.",N,0,0,0,N,N,N,0,0,0,0
122,The four thresholds were averaged to form the overall DG threshold.,N,0,0,0,N,N,N,0,0,0,0
123,Total time per session for these tasks was roughly 15 min.,N,0,0,0,N,N,N,0,0,0,0
124,"The statistical and graphing program OriginPro 9.3 (Northampton, MA, USA) was used to conduct repeated-measures ANOVA, Pearson product–moment correlations, and generate figures for the manuscript.",N,0,0,0,N,N,N,0,0,0,0
125,Levene’s test for homogeneity of variance was used and determined to be non-significant.,N,0,0,0,N,N,N,0,0,0,0
126,"In consideration of the unequal N for the two groups, a power analysis was conducted to determine adequate sample sizes in order to detect effects of supplementation on all of the outcome measures.",N,0,0,0,N,N,N,0,0,0,0
127,"The statistical power rate 1−β was set at 0.80; a 20% change in visual performance or physical indicator status in treatment groups, a standard deviation of 20%, and α = 0.05 were parameters used for calculation.",N,0,0,0,N,N,N,0,0,0,0
128,"With the placebo group set at <span class=""italic"">n</span> = 12, the power calculation determined that the treatment group required 30 subjects to detect effects (if present).",N,0,0,0,N,N,N,0,0,0,0
129,"We recruited additional subjects for the study, assuming some attrition.",N,0,0,0,N,N,N,0,0,0,0
130,"At baseline, several measures were found to be significantly correlated.",N,0,0,0,N,N,N,1,1,1,1
131,"For the visual measures, MPOD was correlated with PSR (<span class=""italic"">r</span> = −0.48; <span class=""italic"">p</span> &lt; 0.001), DG (<span class=""italic"">r</span> = 0.40; <span class=""italic"">p</span> = 0.03), CFF (<span class=""italic"">r</span> = 0.31; <span class=""italic"">p</span> = 0.035), and CS (<span class=""italic"">r</span> = 0.29; <span class=""italic"">p</span> = 0.048).",N,0,0,0,N,N,N,1,1,1,1
