Sentence-ID,Sentence-String,Q1,Q2,Q3,Q4,Q5,Q6,Q7,Q8,Q9,Q10,Q11
131,"However, some researchers did not observe any beneficial effects of omega-3 fatty acids supplementation on glycemic control.",0,0,0,0,0,0,0,0,0,0,0
132,"For instance, dietary EPA + DHA supplementation for 6 months did not improve peripheral glucose disposal, insulin secretion, or skeletal muscle mitochondrial function in insulin-resistant nondiabetic subjects.",0,0,0,0,0,0,0,0,0,0,0
133,"In addition, flaxseed oil intake in patients with T2DM had no effect on fasting serum glucose, insulin or HbA1c levels.",0,0,0,0,0,0,0,0,0,0,0
134,"The different findings might be related to differences in sample size, methods of delivering flaxseed supplementation (eg, baked in bread, flaxseed-derived lignans or capsules), or participant disease states (eg, T2DM, hypercholesterolemia).",0,0,0,0,0,0,0,0,0,0,0
135,"Furthermore, different results might be related to the dosage and the formulations used or possibly some other component associated with flaxseed oil as well as duration of the study.",0,0,0,0,0,0,0,0,0,0,0
136,"In the current study, beneficial effects of taking omega-3 fatty acids on insulin metabolism may be mediated by reduction of free fatty acids, modulating function of peroxisome proliferator-activated receptors and sterol regulatory binding proteins.",0,0,0,0,0,0,0,0,0,0,0
137,"Another mechanism was suggested by Oh DY et al., they suggested a molecular mechanism throughout G protein-coupled receptor 120 (GPR120) functions as omega-3 fatty acids receptor/sensor.",0,0,0,0,0,0,0,0,0,0,0
138,"In other words, omega-3 fatty acids increase gene expression of GPR120 receptor and association with b-arrestin 2, as well as the association between Tak/Tab proteins in the adipose tissue of the treated subjects, improving markers of insulin metabolism.",0,0,0,0,0,0,0,0,0,0,0
139,"The current study demonstrated that compared with the placebo, omega-3 fatty acids supplementation for 12 weeks among subjects with DFU was associated with a significant decrease in serum hs-CRP, and significant increases in plasma TAC and GSH levels, but did not influence plasma NO and MDA concentrations.",0,0,0,0,0,0,0,0,0,0,0
140,"We have previously shown that 1000 mg of omega-3 fatty acids supplementation in gestational diabetes mellitus (GDM) women for 6 weeks had beneficial effects on maternal serum hs-CRP and plasma MDA concentrations, but did not affect other biomarkers of oxidative stress.",0,0,0,0,0,0,0,0,0,0,0
141,"In addition, supplementation with omega-3 fatty acids in women with systemic lupus erythematosus for 12 weeks led to a significant decrease of CRP levels, but did not alter serum concentrations of IL-6 and IL-10.",0,0,0,0,0,0,0,0,0,0,0
142,"However, supplementation with omega-3 fatty acid did not change serum CRP concentrations among subjects with chronic periodontitis after 6-week and 12-week treatment.",0,0,0,0,0,0,0,0,0,0,0
143,"Furthermore, no significant effect in TAC concentrations was seen following supplementation with a combined dietary supplementation containing omega-3, vitamin E, niacin and gamma-oryzanol among dyslipidemic patients.",0,0,0,0,0,0,0,0,0,0,0
144,"Different our findings with others might be explained by different study designs, the variation in the population studied, and the source of omega-3 fatty acids, dosage of omega-3 fatty acids as well as duration of the study.",0,0,0,0,0,0,0,0,0,0,0
145,"Omega-3 fatty acids intake directly decreases the production of inflammatory cytokines Moreover, omega-3 fatty acids may decrease inflammation and oxidative stress through inhibiting activation of nuclear factor kappa-light-chain-enhancer of activated B cells.",0,0,0,0,0,0,0,0,0,0,0
146,This trial had few limitations.,1,0,0,0,0,0,0,0,0,0,0
147,"Firstly, we did not evaluate gene expression of related to insulin, lipid and inflammation to explore the plausible mechanism.",0,0,0,0,0,0,0,0,0,0,0
148,"In addition, we did not evaluate other biomarkers of inflammation and oxidative stress.",1,0,0,0,0,0,0,0,0,0,0
149,"It must be kept in mind that in the current study, we quantified ulcer size using wound surface area measurements.",0,0,0,0,0,0,0,0,0,0,0
150,The use of greatest length and width of the wound at each examination and the calculation of the ratio of greatest length and width provide a coarse surface area change measure that has been used as an indicator of healing rate.,0,0,0,0,0,0,0,0,0,0,0
151,"We did not measure a wound area using more accurate determination of ulcer size, including a permanent marker, acetate or tracing paper (or a wound dressing packet), digital planimetry, digital photography combined with wound analysis software and a piece of graph paper.",0,0,0,0,0,0,0,0,0,0,0
152,"Therefore, our findings should be interpreted with caution.",0,0,0,0,0,0,0,0,0,0,0
153,"Furthermore, in the current study, we quantified serum hs-CRP levels as a systemic inflammatory marker.",0,0,0,0,0,0,0,0,0,0,0
154,Systemic markers such as CRP can be influenced by a variety of factors that are not always related to wounds.,0,0,0,0,0,0,0,0,0,0,0
155,Wound specific measures of wound inflammatory markers such as interleukins or matrix metalloproteinases would have given more validity to the results.,0,0,0,0,0,0,0,0,0,0,0
156,"Therefore, this should be considered in our interpretation.",0,0,0,0,0,0,0,0,0,0,0
157,"In addition, presentation of wound healing trajectories in graphical form (time vs. % decrease in wound size for example) would have been useful.",0,0,0,0,0,0,0,0,0,0,0
158,"Overall, taking omega-3 fatty acids for 12 weeks among subjects with DFU had beneficial effects on parameters of ulcer size, markers of insulin metabolism, serum hs-CRP, plasma TAC and GSH values; but, it did not had any effect on lipid profiles and other biomarkers of inflammation and oxidative stress.",0,0,0,0,0,0,0,0,0,0,0
159,"In addition, flaxseed oil omega-3 fatty acids may have played an indirect role in wound healing due to its effects on improved metabolic profiles.",0,0,0,0,0,0,0,0,0,0,0