Sentence-ID,Sentence-String,Q1,Q2,Q3,Q4,Q5,Q6,Q7,Q8,Q9,Q10,Q11
158,"Thus, it is possible for IPL treatment to increase visual acuity, since corneal scattering was improved as a result of improvements in epithelial defects and tear film stability.",0,0,0,0,0,0,0,0,N,0,0
159,The IOP in both the study and control eyes was significantly decreased by approximately 1 mmHg.,0,0,0,0,0,0,0,0,N,0,0
160,reported that dry eye patients blink twice as much as normal controls.,0,0,0,0,0,0,0,0,N,0,0
161,"In our study, intraocular pressure was measured using an air-puff tonometer.",0,0,0,0,0,0,0,0,N,0,0
162,The results of air-puff tonometers can be affected by eyelid blinking.,0,0,0,0,0,0,0,0,N,0,0
163,"After the dry eye syndrome was corrected, patients may have blinked less when they were told to stare at the tonometer probe.",0,0,0,0,0,0,0,0,N,0,0
164,This better compliance may have led to decreased bias caused by half-opened eyelids.,0,0,0,0,0,0,0,0,N,0,0
165,"In future studies, we recommend that the Goldmann applanation tonometer be used to avoid this bias.",0,0,0,0,0,0,0,0,N,0,0
166,There are certain limitations to our study.,0,0,0,0,0,0,0,0,N,0,0
167,"The majority of our patients were women, which may affect the representativeness of our findings.",0,0,0,0,0,0,0,0,N,0,0
168,"We chose a relatively fixed treatment energy (14–16 J/cm2), which might have influenced the treatment outcomes.",0,0,0,0,0,0,0,0,N,0,0
169,"In subsequent studies, researchers should enlarge the sample size, lengthen the observation period, adjust the IPL parameters/protocol to maximize treatment benefit, and explore the mechanisms underlying the effects of IPL treatment for MGD.",0,0,0,0,0,0,0,0,N,0,0
170,"OCT images of the iris, angle, and ciliary body should be studied to confirm the safety of IPL on these structures.",0,0,0,0,0,0,0,0,N,0,0
171,"In summary, three sessions of IPL treatments applied directly on the eyelids combined with MGX are effective and safe for MGD treatment by improving meibomian gland secretion function and increasing TBUT.",0,0,0,0,0,0,0,0,N,0,0
172,Our results may provide a solid foundation for future studies on IPL treatment for MGD/dry eye in the Asian population.,0,0,0,0,0,0,0,0,N,0,0